Event.Index,UTC.Timestamp,UTC.Date,Local.Timestamp,Local.Timezone,Local.Date,Experiment.ID,Experiment.Version,Tree.Node.Key,Repeat.Key,Schedule.ID,Participant.Private.ID,Participant.Starting.Group,Participant.Status,Participant.Completion.Code,Participant.External.Session.ID,Participant.Device.Type,Participant.Device,Participant.OS,Participant.Browser,Participant.Monitor.Size,Participant.Viewport.Size,Checkpoint,Task.Name,Task.Version,branch.69an,randomiser.8vg2,quota.bqtt,quota.rycs,quota.wtfi,quota.usve,quota.zgic,quota.f3yz,quota.r9vy,quota.tfqq,quota.3dga,quota.kfqt,Spreadsheet,Spreadsheet.Name,Spreadsheet.Row,Trial.Number,Screen.Number,Screen.Name,Zone.Name,Zone.Type,Reaction.Time,Reaction.Onset,Response.Type,Response,Attempt,Correct,Incorrect,Dishonest,X.Coordinate,Y.Coordinate,Timed.Out,randomise_blocks,randomise_trials,display,Arguments,ShowProgressBar,StartDate,EndDate,ResponseId,CONSENT,LeaveOrRemain,brex_conf,stanely_L,stanley_R,intellectual_R_1,intellectual_R_2,intellectual_R_3,intellectual_L_1,intellectual_L_2,intellectual_L_3,morality_R_1,morality_R_2,morality_R_3,morality_L_1,morality_L_2,morality_L_3,discuss_1,read_1,age,gender,gender_4_TEXT,edu,anything_else,ID,arg_ID,Position,Arg_Position
1,1652090179919,09/05/2022 09:56:19,1652090180460,1,09/05/2022 10:56:20,87571,5,task-39lm,NA,21755400,6431758,NA,complete,NA,6278e5149c9c4544d2389bc8,computer,Desktop or Laptop,Windows 10,Chrome 101.0.4951.54,1536x864,767x744,NA,ITT Ratings,4,Remain,5,NA,NA,NA,ACCEPT,NA,NA,NA,NA,NA,NA,batch5_REM,NA,NA,BEGIN TASK,NA,NA,NA,NA,NA,NA,NA,NA,NA,0,1,0,NA,NA,NA,NA,NA,NA,NA,NA,NA,NA,NA,NA,NA,NA,NA,NA,NA,NA,NA,NA,NA,NA,NA,NA,NA,NA,NA,NA,NA,NA,NA,NA,NA,NA,NA,NA,NA,NA,NA
2,1652090188079,09/05/2022 09:56:28,1652090188486,1,09/05/2022 10:56:28,87571,5,task-39lm,NA,21755400,6431758,NA,complete,NA,6278e5149c9c4544d2389bc8,computer,Desktop or Laptop,Windows 10,Chrome 101.0.4951.54,1536x864,767x744,NA,ITT Ratings,4,Remain,5,NA,NA,NA,ACCEPT,NA,NA,NA,NA,NA,NA,batch5_REM,batch5_REM,1,1,1,Screen 1,advancementZone,continue_button,7931.09999999404,NA,NA,NA,NA,0,1,0,NA,NA,NA,NA,NA,instructions,NA,NA,NA,NA,NA,NA,NA,NA,NA,NA,NA,NA,NA,NA,NA,NA,NA,NA,NA,NA,NA,NA,NA,NA,NA,NA,NA,NA,NA,NA,NA,NA,NA
3,1652090200092,09/05/2022 09:56:40,1652090200673,1,09/05/2022 10:56:40,87571,5,task-39lm,NA,21755400,6431758,NA,complete,NA,6278e5149c9c4544d2389bc8,computer,Desktop or Laptop,Windows 10,Chrome 101.0.4951.54,1536x864,767x744,NA,ITT Ratings,4,Remain,5,NA,NA,NA,ACCEPT,NA,NA,NA,NA,NA,NA,batch5_REM,batch5_REM,19,1,1,Screen 1,continueButton,response_rating_scale_likert_active,12147.20000001788,NA,NA,Somewhat Disagree,1,0,1,0,NA,NA,NA,NA,1,statements,Independence from European decisions,1,5/4/22,5/4/22,R_11Y0Ua8MWcGpcYP,YES,Remain (Against Brexit),Confident,NA,Somewhat Agree,NA,NA,NA,Somewhat Disagree,Somewhat Disagree,Somewhat Agree,NA,NA,NA,Somewhat Disagree,Somewhat Disagree,Disagree,Never,Rarely,30,Female,NA,"Postgraduate degree (MSc, MA, MPhil)",NA,43,1,Remain,Leave
4,1652090206491,09/05/2022 09:56:46,1652090207089,1,09/05/2022 10:56:47,87571,5,task-39lm,NA,21755400,6431758,NA,complete,NA,6278e5149c9c4544d2389bc8,computer,Desktop or Laptop,Windows 10,Chrome 101.0.4951.54,1536x864,767x744,NA,ITT Ratings,4,Remain,5,NA,NA,NA,ACCEPT,NA,NA,NA,NA,NA,NA,batch5_REM,batch5_REM,31,2,1,Screen 1,continueButton,response_rating_scale_likert_active,6366.5,NA,NA,Disagree,1,0,1,0,NA,NA,NA,NA,1,statements,I wanted the UK to have more control over its own affairs,1,5/4/22,5/4/22,R_1etaBZleKRYNeVh,YES,Remain (Against Brexit),Confident,NA,Somewhat Disagree,NA,NA,NA,Somewhat Agree,Somewhat Agree,Somewhat Agree,NA,NA,NA,Neither Agree nor Disagree,Somewhat Agree,Neither Agree nor Disagree,Rarely,Rarely,28,Male,NA,"Postgraduate degree (MSc, MA, MPhil)",NA,45,1,Remain,Leave
5,1652090211357,09/05/2022 09:56:51,1652090211863,1,09/05/2022 10:56:51,87571,5,task-39lm,NA,21755400,6431758,NA,complete,NA,6278e5149c9c4544d2389bc8,computer,Desktop or Laptop,Windows 10,Chrome 101.0.4951.54,1536x864,767x744,NA,ITT Ratings,4,Remain,5,NA,NA,NA,ACCEPT,NA,NA,NA,NA,NA,NA,batch5_REM,batch5_REM,40,3,1,Screen 1,continueButton,response_rating_scale_likert_active,4747.799999982119,NA,NA,Strongly Disagree,1,0,1,0,NA,NA,NA,NA,1,statements,Better for our economy and trade within Europe.,1,5/4/22,5/4/22,R_5nkz1BlowolfJol,YES,Remain (Against Brexit),Undecided,NA,Disagree,NA,NA,NA,Strongly Disagree,Somewhat Agree,Somewhat Agree,NA,NA,NA,Strongly Disagree,Strongly Disagree,Strongly Disagree,Rarely,A few times a year,21,Female,NA,"Undergraduate degree (BSc, BA)",NA,47,1,Remain,Remain
6,1652090214218,09/05/2022 09:56:54,1652090214822,1,09/05/2022 10:56:54,87571,5,task-39lm,NA,21755400,6431758,NA,complete,NA,6278e5149c9c4544d2389bc8,computer,Desktop or Laptop,Windows 10,Chrome 101.0.4951.54,1536x864,767x744,NA,ITT Ratings,4,Remain,5,NA,NA,NA,ACCEPT,NA,NA,NA,NA,NA,NA,batch5_REM,batch5_REM,20,4,1,Screen 1,continueButton,response_rating_scale_likert_active,2937.5999999940395,NA,NA,Strongly Disagree,1,0,1,0,NA,NA,NA,NA,1,statements,Freedom to trade with other countries,1,5/4/22,5/4/22,R_11Y0Ua8MWcGpcYP,YES,Remain (Against Brexit),Confident,NA,Somewhat Agree,NA,NA,NA,Somewhat Disagree,Somewhat Disagree,Somewhat Agree,NA,NA,NA,Somewhat Disagree,Somewhat Disagree,Disagree,Never,Rarely,30,Female,NA,"Postgraduate degree (MSc, MA, MPhil)",NA,43,2,Remain,Leave
7,1652090219509,09/05/2022 09:56:59,1652090220032,1,09/05/2022 10:57:00,87571,5,task-39lm,NA,21755400,6431758,NA,complete,NA,6278e5149c9c4544d2389bc8,computer,Desktop or Laptop,Windows 10,Chrome 101.0.4951.54,1536x864,767x744,NA,ITT Ratings,4,Remain,5,NA,NA,NA,ACCEPT,NA,NA,NA,NA,NA,NA,batch5_REM,batch5_REM,46,5,1,Screen 1,continueButton,response_rating_scale_likert_active,5164.600000023842,NA,NA,Agree,1,0,1,0,NA,NA,NA,NA,1,statements,To maintain our European identity.,1,5/4/22,5/4/22,R_2YxoWL19PyHfcHi,YES,Remain (Against Brexit),Very confident,NA,Disagree,NA,NA,NA,Neither Agree nor Disagree,Somewhat Agree,Somewhat Agree,NA,NA,NA,Neither Agree nor Disagree,Disagree,Neither Agree nor Disagree,Once or twice a year,Once or twice a year,63,Male,NA,"Postgraduate degree (MSc, MA, MPhil)",None - thank you.,48,1,Remain,Remain
8,1652090222454,09/05/2022 09:57:02,1652090223027,1,09/05/2022 10:57:03,87571,5,task-39lm,NA,21755400,6431758,NA,complete,NA,6278e5149c9c4544d2389bc8,computer,Desktop or Laptop,Windows 10,Chrome 101.0.4951.54,1536x864,767x744,NA,ITT Ratings,4,Remain,5,NA,NA,NA,ACCEPT,NA,NA,NA,NA,NA,NA,batch5_REM,batch5_REM,61,6,1,Screen 1,continueButton,response_rating_scale_likert_active,2974.399999976158,NA,NA,Strongly Disagree,1,0,1,0,NA,NA,NA,NA,1,statements,The UK pays too much to the EU - not financially profitable,1,5/4/22,5/4/22,R_D0RxpgPvJO2T9yF,YES,Remain (Against Brexit),Very confident,NA,Disagree,NA,NA,NA,Neither Agree nor Disagree,Neither Agree nor Disagree,Neither Agree nor Disagree,NA,NA,NA,Neither Agree nor Disagree,Neither Agree nor Disagree,Neither Agree nor Disagree,Rarely,Rarely,58,Female,NA,"Undergraduate degree (BSc, BA)",NA,50,1,Remain,Leave
9,1652090227828,09/05/2022 09:57:07,1652090228428,1,09/05/2022 10:57:08,87571,5,task-39lm,NA,21755400,6431758,NA,complete,NA,6278e5149c9c4544d2389bc8,computer,Desktop or Laptop,Windows 10,Chrome 101.0.4951.54,1536x864,767x744,NA,ITT Ratings,4,Remain,5,NA,NA,NA,ACCEPT,NA,NA,NA,NA,NA,NA,batch5_REM,batch5_REM,2,7,1,Screen 1,continueButton,response_rating_scale_likert_active,5379.299999982119,NA,NA,Somewhat Agree,1,0,1,0,NA,NA,NA,NA,1,statements,We would like to check you are reading each argument carefully. Please select 'Somewhat Agree' for this answer,1,NA,NA,NA,NA,NA,NA,NA,NA,NA,NA,NA,NA,NA,NA,NA,NA,NA,NA,NA,NA,NA,NA,NA,NA,NA,NA,NA,NA,check1,NA,NA
10,1652090232241,09/05/2022 09:57:12,1652090232844,1,09/05/2022 10:57:12,87571,5,task-39lm,NA,21755400,6431758,NA,complete,NA,6278e5149c9c4544d2389bc8,computer,Desktop or Laptop,Windows 10,Chrome 101.0.4951.54,1536x864,767x744,NA,ITT Ratings,4,Remain,5,NA,NA,NA,ACCEPT,NA,NA,NA,NA,NA,NA,batch5_REM,batch5_REM,43,8,1,Screen 1,continueButton,response_rating_scale_likert_active,4396.799999982119,NA,NA,Strongly Disagree,1,0,1,0,NA,NA,NA,NA,1,statements,It will be better for our economy. We can run our own businesses etc.,1,5/4/22,5/4/22,R_5nkz1BlowolfJol,YES,Remain (Against Brexit),Undecided,NA,Disagree,NA,NA,NA,Strongly Disagree,Somewhat Agree,Somewhat Agree,NA,NA,NA,Strongly Disagree,Strongly Disagree,Strongly Disagree,Rarely,A few times a year,21,Female,NA,"Undergraduate degree (BSc, BA)",NA,47,1,Remain,Leave
11,1652090234393,09/05/2022 09:57:14,1652090234823,1,09/05/2022 10:57:14,87571,5,task-39lm,NA,21755400,6431758,NA,complete,NA,6278e5149c9c4544d2389bc8,computer,Desktop or Laptop,Windows 10,Chrome 101.0.4951.54,1536x864,767x744,NA,ITT Ratings,4,Remain,5,NA,NA,NA,ACCEPT,NA,NA,NA,NA,NA,NA,batch5_REM,batch5_REM,48,9,1,Screen 1,continueButton,response_rating_scale_likert_active,1954.5,NA,NA,Strongly Disagree,1,0,1,0,NA,NA,NA,NA,1,statements,"Ease of trade, travel, migration for work and education.",1,5/4/22,5/4/22,R_2YxoWL19PyHfcHi,YES,Remain (Against Brexit),Very confident,NA,Disagree,NA,NA,NA,Neither Agree nor Disagree,Somewhat Agree,Somewhat Agree,NA,NA,NA,Neither Agree nor Disagree,Disagree,Neither Agree nor Disagree,Once or twice a year,Once or twice a year,63,Male,NA,"Postgraduate degree (MSc, MA, MPhil)",None - thank you.,48,3,Remain,Remain
12,1652090236041,09/05/2022 09:57:16,1652090236441,1,09/05/2022 10:57:16,87571,5,task-39lm,NA,21755400,6431758,NA,complete,NA,6278e5149c9c4544d2389bc8,computer,Desktop or Laptop,Windows 10,Chrome 101.0.4951.54,1536x864,767x744,NA,ITT Ratings,4,Remain,5,NA,NA,NA,ACCEPT,NA,NA,NA,NA,NA,NA,batch5_REM,batch5_REM,5,10,1,Screen 1,continueButton,response_rating_scale_likert_active,1599.7000000178814,NA,NA,Strongly Disagree,1,0,1,0,NA,NA,NA,NA,1,statements,how much it cost to remain in the EU,1,5/4/22,5/4/22,R_1DAOsFtxfbfUhGa,YES,Remain (Against Brexit),Confident,NA,Disagree,NA,NA,NA,Somewhat Agree,Neither Agree nor Disagree,Agree,NA,NA,NA,Neither Agree nor Disagree,Neither Agree nor Disagree,Neither Agree nor Disagree,A few times a year,Once or twice a year,48,Female,NA,"Undergraduate degree (BSc, BA)",NA,41,2,Remain,Remain
13,1652090241044,09/05/2022 09:57:21,1652090241646,1,09/05/2022 10:57:21,87571,5,task-39lm,NA,21755400,6431758,NA,complete,NA,6278e5149c9c4544d2389bc8,computer,Desktop or Laptop,Windows 10,Chrome 101.0.4951.54,1536x864,767x744,NA,ITT Ratings,4,Remain,5,NA,NA,NA,ACCEPT,NA,NA,NA,NA,NA,NA,batch5_REM,batch5_REM,35,11,1,Screen 1,continueButton,response_rating_scale_likert_active,5186.5,NA,NA,Strongly Agree,1,0,1,0,NA,NA,NA,NA,1,statements,"to remain a part of a democratic free market, where import and export costs are lower and the process is simpler than trading internationally",1,5/4/22,5/4/22,R_2cnrY5mNhD3MwkK,YES,Remain (Against Brexit),Very confident,NA,Disagree,NA,NA,NA,Neither Agree nor Disagree,Agree,Somewhat Agree,NA,NA,NA,Somewhat Agree,Neither Agree nor Disagree,Somewhat Agree,Once or twice a year,A few times a year,27,Other,genderqueer,"Postgraduate degree (MSc, MA, MPhil)","after what has happened in the last few years, people who voted leave don't mention Brexit or the referendum at all. I suspect that nowadays some will even lie about how they voted. It's very frustrating.",46,2,Remain,Remain
14,1652090243559,09/05/2022 09:57:23,1652090244156,1,09/05/2022 10:57:24,87571,5,task-39lm,NA,21755400,6431758,NA,complete,NA,6278e5149c9c4544d2389bc8,computer,Desktop or Laptop,Windows 10,Chrome 101.0.4951.54,1536x864,767x744,NA,ITT Ratings,4,Remain,5,NA,NA,NA,ACCEPT,NA,NA,NA,NA,NA,NA,batch5_REM,batch5_REM,50,12,1,Screen 1,continueButton,response_rating_scale_likert_active,2491.600000023842,NA,NA,Strongly Disagree,1,0,1,0,NA,NA,NA,NA,1,statements,To regain independence from foreign powers and their interference.,1,5/4/22,5/4/22,R_2YxoWL19PyHfcHi,YES,Remain (Against Brexit),Very confident,NA,Disagree,NA,NA,NA,Neither Agree nor Disagree,Somewhat Agree,Somewhat Agree,NA,NA,NA,Neither Agree nor Disagree,Disagree,Neither Agree nor Disagree,Once or twice a year,Once or twice a year,63,Male,NA,"Postgraduate degree (MSc, MA, MPhil)",None - thank you.,48,2,Remain,Leave
15,1652090245576,09/05/2022 09:57:25,1652090246165,1,09/05/2022 10:57:26,87571,5,task-39lm,NA,21755400,6431758,NA,complete,NA,6278e5149c9c4544d2389bc8,computer,Desktop or Laptop,Windows 10,Chrome 101.0.4951.54,1536x864,767x744,NA,ITT Ratings,4,Remain,5,NA,NA,NA,ACCEPT,NA,NA,NA,NA,NA,NA,batch5_REM,batch5_REM,55,13,1,Screen 1,continueButton,response_rating_scale_likert_active,1991.800000011921,NA,NA,Strongly Disagree,1,0,1,0,NA,NA,NA,NA,1,statements,I'm worried about immigration and the effect it has on UK resources.,1,5/4/22,5/4/22,R_3meHA57NeKCm3q0,YES,Remain (Against Brexit),Very confident,NA,Disagree,NA,NA,NA,Somewhat Disagree,Disagree,Somewhat Agree,NA,NA,NA,Disagree,Disagree,Disagree,Rarely,Most months,40,Female,NA,"Undergraduate degree (BSc, BA)",NA,49,1,Remain,Leave
16,1652090250461,09/05/2022 09:57:30,1652090251062,1,09/05/2022 10:57:31,87571,5,task-39lm,NA,21755400,6431758,NA,complete,NA,6278e5149c9c4544d2389bc8,computer,Desktop or Laptop,Windows 10,Chrome 101.0.4951.54,1536x864,767x744,NA,ITT Ratings,4,Remain,5,NA,NA,NA,ACCEPT,NA,NA,NA,NA,NA,NA,batch5_REM,batch5_REM,42,14,1,Screen 1,continueButton,response_rating_scale_likert_active,4880.100000023842,NA,NA,Strongly Agree,1,0,1,0,NA,NA,NA,NA,1,statements,Supply chains are a lot easier. Much of our items are sourced from neighbouring European countries and we have made it harder for ourselves to get items over here.,1,5/4/22,5/4/22,R_5nkz1BlowolfJol,YES,Remain (Against Brexit),Undecided,NA,Disagree,NA,NA,NA,Strongly Disagree,Somewhat Agree,Somewhat Agree,NA,NA,NA,Strongly Disagree,Strongly Disagree,Strongly Disagree,Rarely,A few times a year,21,Female,NA,"Undergraduate degree (BSc, BA)",NA,47,3,Remain,Remain
17,1652090252807,09/05/2022 09:57:32,1652090253411,1,09/05/2022 10:57:33,87571,5,task-39lm,NA,21755400,6431758,NA,complete,NA,6278e5149c9c4544d2389bc8,computer,Desktop or Laptop,Windows 10,Chrome 101.0.4951.54,1536x864,767x744,NA,ITT Ratings,4,Remain,5,NA,NA,NA,ACCEPT,NA,NA,NA,NA,NA,NA,batch5_REM,batch5_REM,57,15,1,Screen 1,continueButton,response_rating_scale_likert_active,2327.699999988079,NA,NA,Strongly Disagree,1,0,1,0,NA,NA,NA,NA,1,statements,I'm sick of contributing to EU funds and would rather all money was spent at home.,1,5/4/22,5/4/22,R_3meHA57NeKCm3q0,YES,Remain (Against Brexit),Very confident,NA,Disagree,NA,NA,NA,Somewhat Disagree,Disagree,Somewhat Agree,NA,NA,NA,Disagree,Disagree,Disagree,Rarely,Most months,40,Female,NA,"Undergraduate degree (BSc, BA)",NA,49,3,Remain,Leave
18,1652090255543,09/05/2022 09:57:35,1652090256133,1,09/05/2022 10:57:36,87571,5,task-39lm,NA,21755400,6431758,NA,complete,NA,6278e5149c9c4544d2389bc8,computer,Desktop or Laptop,Windows 10,Chrome 101.0.4951.54,1536x864,767x744,NA,ITT Ratings,4,Remain,5,NA,NA,NA,ACCEPT,NA,NA,NA,NA,NA,NA,batch5_REM,batch5_REM,26,16,1,Screen 1,continueButton,response_rating_scale_likert_active,2701.300000011921,NA,NA,Disagree,1,0,1,0,NA,NA,NA,NA,1,statements,I want more jobs to be available for UK citizens. Making it harder for immigrants to have the right to work in the UK.,1,5/4/22,5/4/22,R_1l0o1B0iCDpatcZ,YES,Remain (Against Brexit),Confident,NA,Somewhat Agree,NA,NA,NA,Neither Agree nor Disagree,Neither Agree nor Disagree,Somewhat Agree,NA,NA,NA,Neither Agree nor Disagree,Neither Agree nor Disagree,Neither Agree nor Disagree,A few times a year,Rarely,25,Female,NA,"Undergraduate degree (BSc, BA)",NA,44,2,Remain,Leave
19,1652090260895,09/05/2022 09:57:40,1652090261488,1,09/05/2022 10:57:41,87571,5,task-39lm,NA,21755400,6431758,NA,complete,NA,6278e5149c9c4544d2389bc8,computer,Desktop or Laptop,Windows 10,Chrome 101.0.4951.54,1536x864,767x744,NA,ITT Ratings,4,Remain,5,NA,NA,NA,ACCEPT,NA,NA,NA,NA,NA,NA,batch5_REM,batch5_REM,25,17,1,Screen 1,continueButton,response_rating_scale_likert_active,5333.800000011921,NA,NA,Neither Agree nor Disagree,1,0,1,0,NA,NA,NA,NA,1,statements,I want the UK to return to how it was before it joined the EU.,1,5/4/22,5/4/22,R_1l0o1B0iCDpatcZ,YES,Remain (Against Brexit),Confident,NA,Somewhat Agree,NA,NA,NA,Neither Agree nor Disagree,Neither Agree nor Disagree,Somewhat Agree,NA,NA,NA,Neither Agree nor Disagree,Neither Agree nor Disagree,Neither Agree nor Disagree,A few times a year,Rarely,25,Female,NA,"Undergraduate degree (BSc, BA)",NA,44,1,Remain,Leave
20,1652090263734,09/05/2022 09:57:43,1652090264247,1,09/05/2022 10:57:44,87571,5,task-39lm,NA,21755400,6431758,NA,complete,NA,6278e5149c9c4544d2389bc8,computer,Desktop or Laptop,Windows 10,Chrome 101.0.4951.54,1536x864,767x744,NA,ITT Ratings,4,Remain,5,NA,NA,NA,ACCEPT,NA,NA,NA,NA,NA,NA,batch5_REM,batch5_REM,17,18,1,Screen 1,continueButton,response_rating_scale_likert_active,2738.4000000059605,NA,NA,Strongly Agree,1,0,1,0,NA,NA,NA,NA,1,statements,European laws that cover us beneficial,1,5/4/22,5/4/22,R_11Y0Ua8MWcGpcYP,YES,Remain (Against Brexit),Confident,NA,Somewhat Agree,NA,NA,NA,Somewhat Disagree,Somewhat Disagree,Somewhat Agree,NA,NA,NA,Somewhat Disagree,Somewhat Disagree,Disagree,Never,Rarely,30,Female,NA,"Postgraduate degree (MSc, MA, MPhil)",NA,43,2,Remain,Remain
21,1652090265890,09/05/2022 09:57:45,1652090266490,1,09/05/2022 10:57:46,87571,5,task-39lm,NA,21755400,6431758,NA,complete,NA,6278e5149c9c4544d2389bc8,computer,Desktop or Laptop,Windows 10,Chrome 101.0.4951.54,1536x864,767x744,NA,ITT Ratings,4,Remain,5,NA,NA,NA,ACCEPT,NA,NA,NA,NA,NA,NA,batch5_REM,batch5_REM,9,19,1,Screen 1,continueButton,response_rating_scale_likert_active,2224.9000000059605,NA,NA,Disagree,1,0,1,0,NA,NA,NA,NA,1,statements,we shouldnt be ruled by the eu,1,5/4/22,5/4/22,R_1DAOsFtxfbfUhGa,YES,Remain (Against Brexit),Confident,NA,Disagree,NA,NA,NA,Somewhat Agree,Neither Agree nor Disagree,Agree,NA,NA,NA,Neither Agree nor Disagree,Neither Agree nor Disagree,Neither Agree nor Disagree,A few times a year,Once or twice a year,48,Female,NA,"Undergraduate degree (BSc, BA)",NA,41,3,Remain,Leave
22,1652090273385,09/05/2022 09:57:53,1652090273974,1,09/05/2022 10:57:53,87571,5,task-39lm,NA,21755400,6431758,NA,complete,NA,6278e5149c9c4544d2389bc8,computer,Desktop or Laptop,Windows 10,Chrome 101.0.4951.54,1536x864,767x744,NA,ITT Ratings,4,Remain,5,NA,NA,NA,ACCEPT,NA,NA,NA,NA,NA,NA,batch5_REM,batch5_REM,56,20,1,Screen 1,continueButton,response_rating_scale_likert_active,7466.5,NA,NA,Neither Agree nor Disagree,1,0,1,0,NA,NA,NA,NA,1,statements,They want control of our laws to be managed from Westminster.,1,5/4/22,5/4/22,R_3meHA57NeKCm3q0,YES,Remain (Against Brexit),Very confident,NA,Disagree,NA,NA,NA,Somewhat Disagree,Disagree,Somewhat Agree,NA,NA,NA,Disagree,Disagree,Disagree,Rarely,Most months,40,Female,NA,"Undergraduate degree (BSc, BA)",NA,49,2,Remain,Leave
23,1652090277232,09/05/2022 09:57:57,1652090277837,1,09/05/2022 10:57:57,87571,5,task-39lm,NA,21755400,6431758,NA,complete,NA,6278e5149c9c4544d2389bc8,computer,Desktop or Laptop,Windows 10,Chrome 101.0.4951.54,1536x864,767x744,NA,ITT Ratings,4,Remain,5,NA,NA,NA,ACCEPT,NA,NA,NA,NA,NA,NA,batch5_REM,batch5_REM,39,21,1,Screen 1,continueButton,response_rating_scale_likert_active,3851.300000011921,NA,NA,Disagree,1,0,1,0,NA,NA,NA,NA,1,statements,to allow us to trade with the whole world,1,5/4/22,5/4/22,R_2cnrY5mNhD3MwkK,YES,Remain (Against Brexit),Very confident,NA,Disagree,NA,NA,NA,Neither Agree nor Disagree,Agree,Somewhat Agree,NA,NA,NA,Somewhat Agree,Neither Agree nor Disagree,Somewhat Agree,Once or twice a year,A few times a year,27,Other,genderqueer,"Postgraduate degree (MSc, MA, MPhil)","after what has happened in the last few years, people who voted leave don't mention Brexit or the referendum at all. I suspect that nowadays some will even lie about how they voted. It's very frustrating.",46,3,Remain,Leave
24,1652090281644,09/05/2022 09:58:01,1652090282240,1,09/05/2022 10:58:02,87571,5,task-39lm,NA,21755400,6431758,NA,complete,NA,6278e5149c9c4544d2389bc8,computer,Desktop or Laptop,Windows 10,Chrome 101.0.4951.54,1536x864,767x744,NA,ITT Ratings,4,Remain,5,NA,NA,NA,ACCEPT,NA,NA,NA,NA,NA,NA,batch5_REM,batch5_REM,60,22,1,Screen 1,continueButton,response_rating_scale_likert_active,4385.0999999940395,NA,NA,Strongly Agree,1,0,1,0,NA,NA,NA,NA,1,statements,Important to have an inclusive attitude rather than an isolationist one,1,5/4/22,5/4/22,R_D0RxpgPvJO2T9yF,YES,Remain (Against Brexit),Very confident,NA,Disagree,NA,NA,NA,Neither Agree nor Disagree,Neither Agree nor Disagree,Neither Agree nor Disagree,NA,NA,NA,Neither Agree nor Disagree,Neither Agree nor Disagree,Neither Agree nor Disagree,Rarely,Rarely,58,Female,NA,"Undergraduate degree (BSc, BA)",NA,50,3,Remain,Remain
25,1652090287106,09/05/2022 09:58:07,1652090287640,1,09/05/2022 10:58:07,87571,5,task-39lm,NA,21755400,6431758,NA,complete,NA,6278e5149c9c4544d2389bc8,computer,Desktop or Laptop,Windows 10,Chrome 101.0.4951.54,1536x864,767x744,NA,ITT Ratings,4,Remain,5,NA,NA,NA,ACCEPT,NA,NA,NA,NA,NA,NA,batch5_REM,batch5_REM,10,23,1,Screen 1,continueButton,response_rating_scale_likert_active,5379.600000023842,NA,NA,Neither Agree nor Disagree,1,0,1,0,NA,NA,NA,NA,1,statements,I had personal reasons,1,5/4/22,5/4/22,R_1cY2f8b495jEyst,YES,Remain (Against Brexit),Undecided,NA,Somewhat Agree,NA,NA,NA,Neither Agree nor Disagree,Neither Agree nor Disagree,Neither Agree nor Disagree,NA,NA,NA,Neither Agree nor Disagree,Neither Agree nor Disagree,Neither Agree nor Disagree,Never,Never,35,Female,NA,"Undergraduate degree (BSc, BA)",NA,42,1,Remain,Remain
26,1652090291310,09/05/2022 09:58:11,1652090291670,1,09/05/2022 10:58:11,87571,5,task-39lm,NA,21755400,6431758,NA,complete,NA,6278e5149c9c4544d2389bc8,computer,Desktop or Laptop,Windows 10,Chrome 101.0.4951.54,1536x864,767x744,NA,ITT Ratings,4,Remain,5,NA,NA,NA,ACCEPT,NA,NA,NA,NA,NA,NA,batch5_REM,batch5_REM,23,24,1,Screen 1,continueButton,response_rating_scale_likert_active,4012.900000005961,NA,NA,Strongly Agree,1,0,1,0,NA,NA,NA,NA,1,statements,Travel within Europe - travelling as a EU citizen to different European counties is easier.,1,5/4/22,5/4/22,R_1l0o1B0iCDpatcZ,YES,Remain (Against Brexit),Confident,NA,Somewhat Agree,NA,NA,NA,Neither Agree nor Disagree,Neither Agree nor Disagree,Somewhat Agree,NA,NA,NA,Neither Agree nor Disagree,Neither Agree nor Disagree,Neither Agree nor Disagree,A few times a year,Rarely,25,Female,NA,"Undergraduate degree (BSc, BA)",NA,44,2,Remain,Remain
27,1652090295438,09/05/2022 09:58:15,1652090295960,1,09/05/2022 10:58:15,87571,5,task-39lm,NA,21755400,6431758,NA,complete,NA,6278e5149c9c4544d2389bc8,computer,Desktop or Laptop,Windows 10,Chrome 101.0.4951.54,1536x864,767x744,NA,ITT Ratings,4,Remain,5,NA,NA,NA,ACCEPT,NA,NA,NA,NA,NA,NA,batch5_REM,batch5_REM,15,25,1,Screen 1,continueButton,response_rating_scale_likert_active,4271.799999982119,NA,NA,Neither Agree nor Disagree,1,0,1,0,NA,NA,NA,NA,1,statements,I wanted to cause a discussion,1,5/4/22,5/4/22,R_1cY2f8b495jEyst,YES,Remain (Against Brexit),Undecided,NA,Somewhat Agree,NA,NA,NA,Neither Agree nor Disagree,Neither Agree nor Disagree,Neither Agree nor Disagree,NA,NA,NA,Neither Agree nor Disagree,Neither Agree nor Disagree,Neither Agree nor Disagree,Never,Never,35,Female,NA,"Undergraduate degree (BSc, BA)",NA,42,3,Remain,Leave
28,1652090299593,09/05/2022 09:58:19,1652090300182,1,09/05/2022 10:58:20,87571,5,task-39lm,NA,21755400,6431758,NA,complete,NA,6278e5149c9c4544d2389bc8,computer,Desktop or Laptop,Windows 10,Chrome 101.0.4951.54,1536x864,767x744,NA,ITT Ratings,4,Remain,5,NA,NA,NA,ACCEPT,NA,NA,NA,NA,NA,NA,batch5_REM,batch5_REM,12,26,1,Screen 1,continueButton,response_rating_scale_likert_active,4203.0999999940395,NA,NA,Neither Agree nor Disagree,1,0,1,0,NA,NA,NA,NA,1,statements,I didn't know what I wanted,1,5/4/22,5/4/22,R_1cY2f8b495jEyst,YES,Remain (Against Brexit),Undecided,NA,Somewhat Agree,NA,NA,NA,Neither Agree nor Disagree,Neither Agree nor Disagree,Neither Agree nor Disagree,NA,NA,NA,Neither Agree nor Disagree,Neither Agree nor Disagree,Neither Agree nor Disagree,Never,Never,35,Female,NA,"Undergraduate degree (BSc, BA)",NA,42,3,Remain,Remain
29,1652090302400,09/05/2022 09:58:22,1652090303000,1,09/05/2022 10:58:23,87571,5,task-39lm,NA,21755400,6431758,NA,complete,NA,6278e5149c9c4544d2389bc8,computer,Desktop or Laptop,Windows 10,Chrome 101.0.4951.54,1536x864,767x744,NA,ITT Ratings,4,Remain,5,NA,NA,NA,ACCEPT,NA,NA,NA,NA,NA,NA,batch5_REM,batch5_REM,30,27,1,Screen 1,continueButton,response_rating_scale_likert_active,2799.2999999821186,NA,NA,Strongly Agree,1,0,1,0,NA,NA,NA,NA,1,statements,I enjoy travel and enjoy being able to do so around the EU,1,5/4/22,5/4/22,R_1etaBZleKRYNeVh,YES,Remain (Against Brexit),Confident,NA,Somewhat Disagree,NA,NA,NA,Somewhat Agree,Somewhat Agree,Somewhat Agree,NA,NA,NA,Neither Agree nor Disagree,Somewhat Agree,Neither Agree nor Disagree,Rarely,Rarely,28,Male,NA,"Postgraduate degree (MSc, MA, MPhil)",NA,45,3,Remain,Remain
30,1652090315744,09/05/2022 09:58:35,1652090316221,1,09/05/2022 10:58:36,87571,5,task-39lm,NA,21755400,6431758,NA,complete,NA,6278e5149c9c4544d2389bc8,computer,Desktop or Laptop,Windows 10,Chrome 101.0.4951.54,1536x864,767x744,NA,ITT Ratings,4,Remain,5,NA,NA,NA,ACCEPT,NA,NA,NA,NA,NA,NA,batch5_REM,batch5_REM,51,28,1,Screen 1,continueButton,response_rating_scale_likert_active,13203.100000023842,NA,NA,Somewhat Disagree,1,0,1,0,NA,NA,NA,NA,1,statements,To never again be subject to foreign policies and laws.,1,5/4/22,5/4/22,R_2YxoWL19PyHfcHi,YES,Remain (Against Brexit),Very confident,NA,Disagree,NA,NA,NA,Neither Agree nor Disagree,Somewhat Agree,Somewhat Agree,NA,NA,NA,Neither Agree nor Disagree,Disagree,Neither Agree nor Disagree,Once or twice a year,Once or twice a year,63,Male,NA,"Postgraduate degree (MSc, MA, MPhil)",None - thank you.,48,3,Remain,Leave
