48,1652090000000,09/05/2022 10:07,1652090000000,1,09/05/2022 11:07,87571,5,task-ogmx,NA,21755908,6431923,NA,complete,NA,6278e6e050204a504598d11f,mobile,Apple iPhone,iOS 15.4.1,Mobile Safari 15.4,375x812,724x292,NA,ITT Ratings,4,Remain,8,NA,NA,NA,NA,NA,NA,ACCEPT,NA,NA,NA,batch8__REM,batch8__REM,31,45,1,Screen 1,continueButton,response_rating_scale_likert_active,2249,NA,NA,Disagree,1,0,1,0,NA,NA,NA,NA,1,statements,Being afraid that Europeans might take British jobs,1,05/04/2022,05/04/2022,R_2qf1Vgmjn4MWxT6,YES,Remain (Against Brexit),Very confident,NA,Strongly Disagree,NA,NA,NA,Disagree,Agree,Strongly Agree,NA,NA,NA,Strongly Agree,Strongly Agree,Neither Agree nor Disagree,A few times a year,A few times a year,42,Female,NA,"Postgraduate degree (MSc, MA, MPhil)",NA,75,1,Remain,Leave
49,1652090000000,09/05/2022 10:07,1652090000000,1,09/05/2022 11:07,87571,5,task-ogmx,NA,21755908,6431923,NA,complete,NA,6278e6e050204a504598d11f,mobile,Apple iPhone,iOS 15.4.1,Mobile Safari 15.4,375x812,724x292,NA,ITT Ratings,4,Remain,8,NA,NA,NA,NA,NA,NA,ACCEPT,NA,NA,NA,batch8__REM,batch8__REM,10,46,1,Screen 1,continueButton,response_rating_scale_likert_active,3326,NA,NA,Somewhat Agree,1,0,1,0,NA,NA,NA,NA,1,statements,"Free movement between countries, including being able to work and live there.",1,05/04/2022,05/04/2022,R_SWeN7xPGVK3qNEt,YES,Remain (Against Brexit),Confident,NA,Neither Agree nor Disagree,NA,NA,NA,Disagree,Disagree,Disagree,NA,NA,NA,Disagree,Disagree,Disagree,Rarely,Rarely,32,Female,NA,"Postgraduate degree (MSc, MA, MPhil)","Perhaps have a reference to time on the questions about how much you talk about it/read about it - for instance, since COVID it has not really been on my radar, whereas around the referendum it was more on my mind/part of discussions.",72,1,Remain,Remain
50,1652090000000,09/05/2022 10:07,1652090000000,1,09/05/2022 11:07,87571,5,task-ogmx,NA,21755908,6431923,NA,complete,NA,6278e6e050204a504598d11f,mobile,Apple iPhone,iOS 15.4.1,Mobile Safari 15.4,375x812,724x292,NA,ITT Ratings,4,Remain,8,NA,NA,NA,NA,NA,NA,ACCEPT,NA,NA,NA,batch8__REM,batch8__REM,23,47,1,Screen 1,continueButton,response_rating_scale_likert_active,6783,NA,NA,Neither Agree nor Disagree,1,0,1,0,NA,NA,NA,NA,1,statements,I see the value for UK businesses large and small in having easy low regulation access to such a large market on their doorsteps,1,05/04/2022,05/04/2022,R_2WHa0mJTUe9Z0c0,YES,Remain (Against Brexit),Very confident,NA,Somewhat Disagree,NA,NA,NA,Somewhat Disagree,Neither Agree nor Disagree,Neither Agree nor Disagree,NA,NA,NA,Disagree,Somewhat Disagree,Disagree,A few times a year,Most months,42,Female,NA,A levels,"Well phrased, your questions provide a nice separation between the personal and the reasoning",74,2,Remain,Remain
51,1652090000000,09/05/2022 10:07,1652090000000,1,09/05/2022 11:07,87571,5,task-ogmx,NA,21755908,6431923,NA,complete,NA,6278e6e050204a504598d11f,mobile,Apple iPhone,iOS 15.4.1,Mobile Safari 15.4,375x812,724x292,NA,ITT Ratings,4,Remain,8,NA,NA,NA,NA,NA,NA,ACCEPT,NA,NA,NA,batch8__REM,batch8__REM,54,48,1,Screen 1,continueButton,response_rating_scale_likert_active,3662,NA,NA,Somewhat Agree,1,0,1,0,NA,NA,NA,NA,1,statements,it'll affect our relationships with other members of the EU and how the country is perceived by the rest of the world.,1,05/04/2022,05/04/2022,R_3Rz6L8l6KvNvrbT,YES,Remain (Against Brexit),Confident,NA,Somewhat Agree,NA,NA,NA,Disagree,Somewhat Disagree,Somewhat Disagree,NA,NA,NA,Neither Agree nor Disagree,Somewhat Disagree,Neither Agree nor Disagree,Most months,A few times a year,NA,Female,NA,"Undergraduate degree (BSc, BA)",NA,79,3,Remain,Remain
52,1652090000000,09/05/2022 10:07,1652090000000,1,09/05/2022 11:07,87571,5,task-ogmx,NA,21755908,6431923,NA,complete,NA,6278e6e050204a504598d11f,mobile,Apple iPhone,iOS 15.4.1,Mobile Safari 15.4,375x812,724x292,NA,ITT Ratings,4,Remain,8,NA,NA,NA,NA,NA,NA,ACCEPT,NA,NA,NA,batch8__REM,batch8__REM,17,49,1,Screen 1,continueButton,response_rating_scale_likert_active,4743,NA,NA,Neither Agree nor Disagree,1,0,1,0,NA,NA,NA,NA,1,statements,European Union rules are better thought out and considered and therefore benefit us as a whole.,1,05/04/2022,05/04/2022,R_1dzzVp5jsORg8gm,YES,Remain (Against Brexit),Very confident,NA,Disagree,NA,NA,NA,Somewhat Agree,Neither Agree nor Disagree,Somewhat Agree,NA,NA,NA,Somewhat Agree,Somewhat Agree,Somewhat Agree,Most weeks,Most months,56,Female,NA,"Undergraduate degree (BSc, BA)",NA,73,2,Remain,Remain
53,1652090000000,09/05/2022 10:07,1652090000000,1,09/05/2022 11:07,87571,5,task-ogmx,NA,21755908,6431923,NA,complete,NA,6278e6e050204a504598d11f,mobile,Apple iPhone,iOS 15.4.1,Mobile Safari 15.4,375x812,724x292,NA,ITT Ratings,4,Remain,8,NA,NA,NA,NA,NA,NA,ACCEPT,NA,NA,NA,batch8__REM,batch8__REM,25,50,1,Screen 1,continueButton,response_rating_scale_likert_active,5190,NA,NA,Somewhat Agree,1,0,1,0,NA,NA,NA,NA,1,statements,"They value the idea that British laws are made only by British politicians in westminster, and distrust the European political system",1,05/04/2022,05/04/2022,R_2WHa0mJTUe9Z0c0,YES,Remain (Against Brexit),Very confident,NA,Somewhat Disagree,NA,NA,NA,Somewhat Disagree,Neither Agree nor Disagree,Neither Agree nor Disagree,NA,NA,NA,Disagree,Somewhat Disagree,Disagree,A few times a year,Most months,42,Female,NA,A levels,"Well phrased, your questions provide a nice separation between the personal and the reasoning",74,1,Remain,Leave
54,1652090000000,09/05/2022 10:07,1652090000000,1,09/05/2022 11:07,87571,5,task-ogmx,NA,21755908,6431923,NA,complete,NA,6278e6e050204a504598d11f,mobile,Apple iPhone,iOS 15.4.1,Mobile Safari 15.4,375x812,724x292,NA,ITT Ratings,4,Remain,8,NA,NA,NA,NA,NA,NA,ACCEPT,NA,NA,NA,batch8__REM,batch8__REM,56,51,1,Screen 1,continueButton,response_rating_scale_likert_active,1782,NA,NA,Somewhat Disagree,1,0,1,0,NA,NA,NA,NA,1,statements,we are strong enough on our own,1,05/04/2022,05/04/2022,R_3Rz6L8l6KvNvrbT,YES,Remain (Against Brexit),Confident,NA,Somewhat Agree,NA,NA,NA,Disagree,Somewhat Disagree,Somewhat Disagree,NA,NA,NA,Neither Agree nor Disagree,Somewhat Disagree,Neither Agree nor Disagree,Most months,A few times a year,NA,Female,NA,"Undergraduate degree (BSc, BA)",NA,79,2,Remain,Leave
55,1652090000000,09/05/2022 10:07,1652090000000,1,09/05/2022 11:07,87571,5,task-ogmx,NA,21755908,6431923,NA,complete,NA,6278e6e050204a504598d11f,mobile,Apple iPhone,iOS 15.4.1,Mobile Safari 15.4,375x812,724x292,NA,ITT Ratings,4,Remain,8,NA,NA,NA,NA,NA,NA,ACCEPT,NA,NA,NA,batch8__REM,batch8__REM,7,52,1,Screen 1,continueButton,response_rating_scale_likert_active,1710,NA,NA,Disagree,1,0,1,0,NA,NA,NA,NA,1,statements,Make Britain great again!,1,05/04/2022,05/04/2022,R_3O1GYbeNCWPy6RT,YES,Remain (Against Brexit),Very confident,NA,Strongly Disagree,NA,NA,NA,Somewhat Disagree,Neither Agree nor Disagree,Somewhat Agree,NA,NA,NA,Somewhat Disagree,Somewhat Disagree,Somewhat Agree,Once or twice a year,Most months,35,Female,NA,"Undergraduate degree (BSc, BA)",NA,71,1,Remain,Leave
56,1652090000000,09/05/2022 10:07,1652090000000,1,09/05/2022 11:07,87571,5,task-ogmx,NA,21755908,6431923,NA,complete,NA,6278e6e050204a504598d11f,mobile,Apple iPhone,iOS 15.4.1,Mobile Safari 15.4,375x812,724x292,NA,ITT Ratings,4,Remain,8,NA,NA,NA,NA,NA,NA,ACCEPT,NA,NA,NA,batch8__REM,batch8__REM,9,53,1,Screen 1,continueButton,response_rating_scale_likert_active,3275,NA,NA,Somewhat Disagree,1,0,1,0,NA,NA,NA,NA,1,statements,It means we will get back to being British and stop relying on Foreign trade,1,05/04/2022,05/04/2022,R_3O1GYbeNCWPy6RT,YES,Remain (Against Brexit),Very confident,NA,Strongly Disagree,NA,NA,NA,Somewhat Disagree,Neither Agree nor Disagree,Somewhat Agree,NA,NA,NA,Somewhat Disagree,Somewhat Disagree,Somewhat Agree,Once or twice a year,Most months,35,Female,NA,"Undergraduate degree (BSc, BA)",NA,71,3,Remain,Leave
57,1652090000000,09/05/2022 10:07,1652090000000,1,09/05/2022 11:07,87571,5,task-ogmx,NA,21755908,6431923,NA,complete,NA,6278e6e050204a504598d11f,mobile,Apple iPhone,iOS 15.4.1,Mobile Safari 15.4,375x812,724x292,NA,ITT Ratings,4,Remain,8,NA,NA,NA,NA,NA,NA,ACCEPT,NA,NA,NA,batch8__REM,batch8__REM,33,54,1,Screen 1,continueButton,response_rating_scale_likert_active,3197,NA,NA,Somewhat Agree,1,0,1,0,NA,NA,NA,NA,1,statements,Wanting the Uk to be in sole charge of decision making and legal processes,1,05/04/2022,05/04/2022,R_2qf1Vgmjn4MWxT6,YES,Remain (Against Brexit),Very confident,NA,Strongly Disagree,NA,NA,NA,Disagree,Agree,Strongly Agree,NA,NA,NA,Strongly Agree,Strongly Agree,Neither Agree nor Disagree,A few times a year,A few times a year,42,Female,NA,"Postgraduate degree (MSc, MA, MPhil)",NA,75,3,Remain,Leave
58,1652090000000,09/05/2022 10:08,1652090000000,1,09/05/2022 11:08,87571,5,task-ogmx,NA,21755908,6431923,NA,complete,NA,6278e6e050204a504598d11f,mobile,Apple iPhone,iOS 15.4.1,Mobile Safari 15.4,375x812,724x292,NA,ITT Ratings,4,Remain,8,NA,NA,NA,NA,NA,NA,ACCEPT,NA,NA,NA,batch8__REM,batch8__REM,21,55,1,Screen 1,continueButton,response_rating_scale_likert_active,3705,NA,NA,Neither Agree nor Disagree,1,0,1,0,NA,NA,NA,NA,1,statements,We will have more freedom away from EU laws.,1,05/04/2022,05/04/2022,R_1dzzVp5jsORg8gm,YES,Remain (Against Brexit),Very confident,NA,Disagree,NA,NA,NA,Somewhat Agree,Neither Agree nor Disagree,Somewhat Agree,NA,NA,NA,Somewhat Agree,Somewhat Agree,Somewhat Agree,Most weeks,Most months,56,Female,NA,"Undergraduate degree (BSc, BA)",NA,73,3,Remain,Leave
59,1652090000000,09/05/2022 10:08,1652090000000,1,09/05/2022 11:08,87571,5,task-ogmx,NA,21755908,6431923,NA,complete,NA,6278e6e050204a504598d11f,mobile,Apple iPhone,iOS 15.4.1,Mobile Safari 15.4,375x812,724x292,NA,ITT Ratings,4,Remain,8,NA,NA,NA,NA,NA,NA,ACCEPT,NA,NA,NA,batch8__REM,batch8__REM,44,56,1,Screen 1,continueButton,response_rating_scale_likert_active,1444,NA,NA,Somewhat Disagree,1,0,1,0,NA,NA,NA,NA,1,statements,to get our independence,1,05/04/2022,05/04/2022,R_2SJ1sFgfejqsqiQ,YES,Remain (Against Brexit),Very confident,NA,Neither Agree nor Disagree,NA,NA,NA,Neither Agree nor Disagree,Neither Agree nor Disagree,Somewhat Agree,NA,NA,NA,Neither Agree nor Disagree,Neither Agree nor Disagree,Neither Agree nor Disagree,Rarely,Most months,57,Female,NA,Vocational Training / Apprenticeship,NA,77,2,Remain,Leave
60,1652090000000,09/05/2022 10:08,1652090000000,1,09/05/2022 11:08,87571,5,task-ogmx,NA,21755908,6431923,NA,complete,NA,6278e6e050204a504598d11f,mobile,Apple iPhone,iOS 15.4.1,Mobile Safari 15.4,375x812,724x292,NA,ITT Ratings,4,Remain,8,NA,NA,NA,NA,NA,NA,ACCEPT,NA,NA,NA,batch8__REM,batch8__REM,24,57,1,Screen 1,continueButton,response_rating_scale_likert_active,2088,NA,NA,Somewhat Disagree,1,0,1,0,NA,NA,NA,NA,1,statements,"I see the international soft power britain exercises in europe, having more veto power and leverage than almost any other member, and that we'd lose that influence if we left",1,05/04/2022,05/04/2022,R_2WHa0mJTUe9Z0c0,YES,Remain (Against Brexit),Very confident,NA,Somewhat Disagree,NA,NA,NA,Somewhat Disagree,Neither Agree nor Disagree,Neither Agree nor Disagree,NA,NA,NA,Disagree,Somewhat Disagree,Disagree,A few times a year,Most months,42,Female,NA,A levels,"Well phrased, your questions provide a nice separation between the personal and the reasoning",74,3,Remain,Remain
61,1652090000000,09/05/2022 10:08,1652090000000,1,09/05/2022 11:08,87571,5,task-ogmx,NA,21755908,6431923,NA,complete,NA,6278e6e050204a504598d11f,mobile,Apple iPhone,iOS 15.4.1,Mobile Safari 15.4,375x812,724x292,NA,ITT Ratings,4,Remain,8,NA,NA,NA,NA,NA,NA,ACCEPT,NA,NA,NA,batch8__REM,batch8__REM,15,58,1,Screen 1,continueButton,response_rating_scale_likert_active,2998,NA,NA,Somewhat Agree,1,0,1,0,NA,NA,NA,NA,1,statements,They think that there would be less 'red tape' or regulations.,1,05/04/2022,05/04/2022,R_SWeN7xPGVK3qNEt,YES,Remain (Against Brexit),Confident,NA,Neither Agree nor Disagree,NA,NA,NA,Disagree,Disagree,Disagree,NA,NA,NA,Disagree,Disagree,Disagree,Rarely,Rarely,32,Female,NA,"Postgraduate degree (MSc, MA, MPhil)","Perhaps have a reference to time on the questions about how much you talk about it/read about it - for instance, since COVID it has not really been on my radar, whereas around the referendum it was more on my mind/part of discussions.",72,3,Remain,Leave
62,1652090000000,09/05/2022 10:08,1652090000000,1,09/05/2022 11:08,87571,5,task-ogmx,NA,21755908,6431923,NA,complete,NA,6278e6e050204a504598d11f,mobile,Apple iPhone,iOS 15.4.1,Mobile Safari 15.4,375x812,724x292,NA,ITT Ratings,4,Remain,8,NA,NA,NA,NA,NA,NA,ACCEPT,NA,NA,NA,batch8__REM,batch8__REM,19,59,1,Screen 1,continueButton,response_rating_scale_likert_active,3136,NA,NA,Neither Agree nor Disagree,1,0,1,0,NA,NA,NA,NA,1,statements,We will have £350million to spend on the NHS each week.,1,05/04/2022,05/04/2022,R_1dzzVp5jsORg8gm,YES,Remain (Against Brexit),Very confident,NA,Disagree,NA,NA,NA,Somewhat Agree,Neither Agree nor Disagree,Somewhat Agree,NA,NA,NA,Somewhat Agree,Somewhat Agree,Somewhat Agree,Most weeks,Most months,56,Female,NA,"Undergraduate degree (BSc, BA)",NA,73,1,Remain,Leave
63,1652090000000,09/05/2022 10:08,1652090000000,1,09/05/2022 11:08,87571,5,task-ogmx,NA,21755908,6431923,NA,complete,NA,6278e6e050204a504598d11f,mobile,Apple iPhone,iOS 15.4.1,Mobile Safari 15.4,375x812,724x292,NA,ITT Ratings,4,Remain,8,NA,NA,NA,NA,NA,NA,ACCEPT,NA,NA,NA,batch8__REM,batch8__REM,35,60,1,Screen 1,continueButton,response_rating_scale_likert_active,1787,NA,NA,Somewhat Disagree,1,0,1,0,NA,NA,NA,NA,1,statements,easy travel within europe,1,05/04/2022,05/04/2022,R_3hxZbOmrVJWCEp1,YES,Remain (Against Brexit),Confident,NA,Somewhat Disagree,NA,NA,NA,Disagree,Disagree,Somewhat Disagree,NA,NA,NA,Disagree,Disagree,Disagree,Rarely,A few times a year,60,Male,NA,Doctorate (PhD),NA,76,2,Remain,Remain
64,1652090000000,09/05/2022 10:08,1652090000000,1,09/05/2022 11:08,87571,5,task-ogmx,NA,21755908,6431923,NA,complete,NA,6278e6e050204a504598d11f,mobile,Apple iPhone,iOS 15.4.1,Mobile Safari 15.4,375x812,724x292,NA,ITT Ratings,4,Remain,8,NA,NA,NA,NA,NA,NA,ACCEPT,NA,NA,NA,batch8__REM,batch8__REM,26,61,1,Screen 1,continueButton,response_rating_scale_likert_active,4223,NA,NA,Disagree,1,0,1,0,NA,NA,NA,NA,1,statements,"I have concerns about immigration, and believe that leaving will lead to less immigration",1,05/04/2022,05/04/2022,R_2WHa0mJTUe9Z0c0,YES,Remain (Against Brexit),Very confident,NA,Somewhat Disagree,NA,NA,NA,Somewhat Disagree,Neither Agree nor Disagree,Neither Agree nor Disagree,NA,NA,NA,Disagree,Somewhat Disagree,Disagree,A few times a year,Most months,42,Female,NA,A levels,"Well phrased, your questions provide a nice separation between the personal and the reasoning",74,2,Remain,Leave
65,1652090000000,09/05/2022 10:08,1652090000000,1,09/05/2022 11:08,87571,5,task-ogmx,NA,21755908,6431923,NA,complete,NA,6278e6e050204a504598d11f,mobile,Apple iPhone,iOS 15.4.1,Mobile Safari 15.4,375x812,724x292,NA,ITT Ratings,4,Remain,8,NA,NA,NA,NA,NA,NA,ACCEPT,NA,NA,NA,batch8__REM,batch8__REM,12,62,1,Screen 1,continueButton,response_rating_scale_likert_active,3630,NA,NA,Disagree,1,0,1,0,NA,NA,NA,NA,1,statements,The impact on trade of being separate.,1,05/04/2022,05/04/2022,R_SWeN7xPGVK3qNEt,YES,Remain (Against Brexit),Confident,NA,Neither Agree nor Disagree,NA,NA,NA,Disagree,Disagree,Disagree,NA,NA,NA,Disagree,Disagree,Disagree,Rarely,Rarely,32,Female,NA,"Postgraduate degree (MSc, MA, MPhil)","Perhaps have a reference to time on the questions about how much you talk about it/read about it - for instance, since COVID it has not really been on my radar, whereas around the referendum it was more on my mind/part of discussions.",72,3,Remain,Remain
66,1652090000000,09/05/2022 10:08,1652090000000,1,09/05/2022 11:08,87571,5,task-ogmx,NA,21755908,6431923,NA,complete,NA,6278e6e050204a504598d11f,mobile,Apple iPhone,iOS 15.4.1,Mobile Safari 15.4,375x812,724x292,NA,ITT Ratings,4,Remain,8,NA,NA,NA,NA,NA,NA,ACCEPT,NA,NA,NA,batch8__REM,NA,NA,END TASK,NA,NA,NA,NA,218524,NA,NA,NA,NA,0,1,0,NA,NA,NA,NA,NA,NA,NA,NA,NA,NA,NA,NA,NA,NA,NA,NA,NA,NA,NA,NA,NA,NA,NA,NA,NA,NA,NA,NA,NA,NA,NA,NA,NA,NA,NA,NA,NA,NA,NA
1,1652090000000,09/05/2022 10:04,1652090000000,1,09/05/2022 11:04,87571,5,task-ogmx,NA,21755980,6431963,NA,complete,NA,6278e714b05d4828f425faef,computer,Desktop or Laptop,Windows 10,Edge 101.0.1210.39,1920x1080,1920x969,NA,ITT Ratings,4,Remain,8,NA,NA,NA,NA,NA,NA,ACCEPT,NA,NA,NA,batch8__REM,NA,NA,BEGIN TASK,NA,NA,NA,NA,NA,NA,NA,NA,NA,0,1,0,NA,NA,NA,NA,NA,NA,NA,NA,NA,NA,NA,NA,NA,NA,NA,NA,NA,NA,NA,NA,NA,NA,NA,NA,NA,NA,NA,NA,NA,NA,NA,NA,NA,NA,NA,NA,NA,NA,NA
2,1652090000000,09/05/2022 10:04,1652090000000,1,09/05/2022 11:04,87571,5,task-ogmx,NA,21755980,6431963,NA,complete,NA,6278e714b05d4828f425faef,computer,Desktop or Laptop,Windows 10,Edge 101.0.1210.39,1920x1080,1920x969,NA,ITT Ratings,4,Remain,8,NA,NA,NA,NA,NA,NA,ACCEPT,NA,NA,NA,batch8__REM,batch8__REM,1,1,1,Screen 1,advancementZone,continue_button,5924.6,NA,NA,NA,NA,0,1,0,NA,NA,NA,NA,NA,instructions,NA,NA,NA,NA,NA,NA,NA,NA,NA,NA,NA,NA,NA,NA,NA,NA,NA,NA,NA,NA,NA,NA,NA,NA,NA,NA,NA,NA,NA,NA,NA,NA,NA
3,1652090000000,09/05/2022 10:05,1652090000000,1,09/05/2022 11:05,87571,5,task-ogmx,NA,21755980,6431963,NA,complete,NA,6278e714b05d4828f425faef,computer,Desktop or Laptop,Windows 10,Edge 101.0.1210.39,1920x1080,1920x969,NA,ITT Ratings,4,Remain,8,NA,NA,NA,NA,NA,NA,ACCEPT,NA,NA,NA,batch8__REM,batch8__REM,5,1,1,Screen 1,continueButton,response_rating_scale_likert_active,10978.6,NA,NA,Somewhat Agree,1,0,1,0,NA,NA,NA,NA,1,statements,Continue to welcome people into the UK from all around Europe without visas and settled status,1,05/04/2022,05/04/2022,R_3O1GYbeNCWPy6RT,YES,Remain (Against Brexit),Very confident,NA,Strongly Disagree,NA,NA,NA,Somewhat Disagree,Neither Agree nor Disagree,Somewhat Agree,NA,NA,NA,Somewhat Disagree,Somewhat Disagree,Somewhat Agree,Once or twice a year,Most months,35,Female,NA,"Undergraduate degree (BSc, BA)",NA,71,2,Remain,Remain
4,1652090000000,09/05/2022 10:05,1652090000000,1,09/05/2022 11:05,87571,5,task-ogmx,NA,21755980,6431963,NA,complete,NA,6278e714b05d4828f425faef,computer,Desktop or Laptop,Windows 10,Edge 101.0.1210.39,1920x1080,1920x969,NA,ITT Ratings,4,Remain,8,NA,NA,NA,NA,NA,NA,ACCEPT,NA,NA,NA,batch8__REM,batch8__REM,27,2,1,Screen 1,continueButton,response_rating_scale_likert_active,5116.2,NA,NA,Somewhat Disagree,1,0,1,0,NA,NA,NA,NA,1,statements,I believe british businesses are needlessly hamstrung by european red tape,1,05/04/2022,05/04/2022,R_2WHa0mJTUe9Z0c0,YES,Remain (Against Brexit),Very confident,NA,Somewhat Disagree,NA,NA,NA,Somewhat Disagree,Neither Agree nor Disagree,Neither Agree nor Disagree,NA,NA,NA,Disagree,Somewhat Disagree,Disagree,A few times a year,Most months,42,Female,NA,A levels,"Well phrased, your questions provide a nice separation between the personal and the reasoning",74,3,Remain,Leave
5,1652090000000,09/05/2022 10:05,1652090000000,1,09/05/2022 11:05,87571,5,task-ogmx,NA,21755980,6431963,NA,complete,NA,6278e714b05d4828f425faef,computer,Desktop or Laptop,Windows 10,Edge 101.0.1210.39,1920x1080,1920x969,NA,ITT Ratings,4,Remain,8,NA,NA,NA,NA,NA,NA,ACCEPT,NA,NA,NA,batch8__REM,batch8__REM,61,3,1,Screen 1,continueButton,response_rating_scale_likert_active,2693.6,NA,NA,Somewhat Disagree,1,0,1,0,NA,NA,NA,NA,1,statements,Disagree with setting of EU laws,1,05/04/2022,05/04/2022,R_1NUPOQPEaib5zJT,YES,Remain (Against Brexit),Very confident,NA,Somewhat Disagree,NA,NA,NA,Disagree,Somewhat Agree,Somewhat Agree,NA,NA,NA,Somewhat Agree,Somewhat Agree,Somewhat Agree,Once or twice a year,A few times a year,40,Female,NA,"Postgraduate degree (MSc, MA, MPhil)",NA,80,1,Remain,Leave
6,1652090000000,09/05/2022 10:05,1652090000000,1,09/05/2022 11:05,87571,5,task-ogmx,NA,21755980,6431963,NA,complete,NA,6278e714b05d4828f425faef,computer,Desktop or Laptop,Windows 10,Edge 101.0.1210.39,1920x1080,1920x969,NA,ITT Ratings,4,Remain,8,NA,NA,NA,NA,NA,NA,ACCEPT,NA,NA,NA,batch8__REM,batch8__REM,45,4,1,Screen 1,continueButton,response_rating_scale_likert_active,4894.4,NA,NA,Neither Agree nor Disagree,1,0,1,0,NA,NA,NA,NA,1,statements,to spend money on the NHS,1,05/04/2022,05/04/2022,R_2SJ1sFgfejqsqiQ,YES,Remain (Against Brexit),Very confident,NA,Neither Agree nor Disagree,NA,NA,NA,Neither Agree nor Disagree,Neither Agree nor Disagree,Somewhat Agree,NA,NA,NA,Neither Agree nor Disagree,Neither Agree nor Disagree,Neither Agree nor Disagree,Rarely,Most months,57,Female,NA,Vocational Training / Apprenticeship,NA,77,3,Remain,Leave
7,1652090000000,09/05/2022 10:05,1652090000000,1,09/05/2022 11:05,87571,5,task-ogmx,NA,21755980,6431963,NA,complete,NA,6278e714b05d4828f425faef,computer,Desktop or Laptop,Windows 10,Edge 101.0.1210.39,1920x1080,1920x969,NA,ITT Ratings,4,Remain,8,NA,NA,NA,NA,NA,NA,ACCEPT,NA,NA,NA,batch8__REM,batch8__REM,6,5,1,Screen 1,continueButton,response_rating_scale_likert_active,4511.1,NA,NA,Agree,1,0,1,0,NA,NA,NA,NA,1,statements,Don't divide Britain. We are a multi cultural kingdom that welcomes everyone,1,05/04/2022,05/04/2022,R_3O1GYbeNCWPy6RT,YES,Remain (Against Brexit),Very confident,NA,Strongly Disagree,NA,NA,NA,Somewhat Disagree,Neither Agree nor Disagree,Somewhat Agree,NA,NA,NA,Somewhat Disagree,Somewhat Disagree,Somewhat Agree,Once or twice a year,Most months,35,Female,NA,"Undergraduate degree (BSc, BA)",NA,71,3,Remain,Remain
8,1652090000000,09/05/2022 10:05,1652090000000,1,09/05/2022 11:05,87571,5,task-ogmx,NA,21755980,6431963,NA,complete,NA,6278e714b05d4828f425faef,computer,Desktop or Laptop,Windows 10,Edge 101.0.1210.39,1920x1080,1920x969,NA,ITT Ratings,4,Remain,8,NA,NA,NA,NA,NA,NA,ACCEPT,NA,NA,NA,batch8__REM,batch8__REM,48,6,1,Screen 1,continueButton,response_rating_scale_likert_active,7124.8,NA,NA,Neither Agree nor Disagree,1,0,1,0,NA,NA,NA,NA,1,statements,"Stability and streamlined processes, consistency",1,05/04/2022,05/04/2022,R_1ODjpeXZT2x8dHs,YES,Remain (Against Brexit),Confident,NA,Agree,NA,NA,NA,Neither Agree nor Disagree,Neither Agree nor Disagree,Neither Agree nor Disagree,NA,NA,NA,Neither Agree nor Disagree,Neither Agree nor Disagree,Neither Agree nor Disagree,Rarely,Rarely,49,Other,I don't identify with a gender. I am female,"Undergraduate degree (BSc, BA)",NA,78,3,Remain,Remain
9,1652090000000,09/05/2022 10:05,1652090000000,1,09/05/2022 11:05,87571,5,task-ogmx,NA,21755980,6431963,NA,complete,NA,6278e714b05d4828f425faef,computer,Desktop or Laptop,Windows 10,Edge 101.0.1210.39,1920x1080,1920x969,NA,ITT Ratings,4,Remain,8,NA,NA,NA,NA,NA,NA,ACCEPT,NA,NA,NA,batch8__REM,batch8__REM,51,7,1,Screen 1,continueButton,response_rating_scale_likert_active,13656.4,NA,NA,Somewhat Agree,1,0,1,0,NA,NA,NA,NA,1,statements,Belief that we would be financially stronger,1,05/04/2022,05/04/2022,R_1ODjpeXZT2x8dHs,YES,Remain (Against Brexit),Confident,NA,Agree,NA,NA,NA,Neither Agree nor Disagree,Neither Agree nor Disagree,Neither Agree nor Disagree,NA,NA,NA,Neither Agree nor Disagree,Neither Agree nor Disagree,Neither Agree nor Disagree,Rarely,Rarely,49,Other,I don't identify with a gender. I am female,"Undergraduate degree (BSc, BA)",NA,78,3,Remain,Leave
10,1652090000000,09/05/2022 10:05,1652090000000,1,09/05/2022 11:05,87571,5,task-ogmx,NA,21755980,6431963,NA,complete,NA,6278e714b05d4828f425faef,computer,Desktop or Laptop,Windows 10,Edge 101.0.1210.39,1920x1080,1920x969,NA,ITT Ratings,4,Remain,8,NA,NA,NA,NA,NA,NA,ACCEPT,NA,NA,NA,batch8__REM,batch8__REM,37,8,1,Screen 1,continueButton,response_rating_scale_likert_active,5387.4,NA,NA,Strongly Disagree,1,0,1,0,NA,NA,NA,NA,1,statements,regain national sovreignty,1,05/04/2022,05/04/2022,R_3hxZbOmrVJWCEp1,YES,Remain (Against Brexit),Confident,NA,Somewhat Disagree,NA,NA,NA,Disagree,Disagree,Somewhat Disagree,NA,NA,NA,Disagree,Disagree,Disagree,Rarely,A few times a year,60,Male,NA,Doctorate (PhD),NA,76,1,Remain,Leave
11,1652090000000,09/05/2022 10:05,1652090000000,1,09/05/2022 11:05,87571,5,task-ogmx,NA,21755980,6431963,NA,complete,NA,6278e714b05d4828f425faef,computer,Desktop or Laptop,Windows 10,Edge 101.0.1210.39,1920x1080,1920x969,NA,ITT Ratings,4,Remain,8,NA,NA,NA,NA,NA,NA,ACCEPT,NA,NA,NA,batch8__REM,batch8__REM,11,9,1,Screen 1,continueButton,response_rating_scale_likert_active,2179,NA,NA,Agree,1,0,1,0,NA,NA,NA,NA,1,statements,Being outward-looking rather than insular.,1,05/04/2022,05/04/2022,R_SWeN7xPGVK3qNEt,YES,Remain (Against Brexit),Confident,NA,Neither Agree nor Disagree,NA,NA,NA,Disagree,Disagree,Disagree,NA,NA,NA,Disagree,Disagree,Disagree,Rarely,Rarely,32,Female,NA,"Postgraduate degree (MSc, MA, MPhil)","Perhaps have a reference to time on the questions about how much you talk about it/read about it - for instance, since COVID it has not really been on my radar, whereas around the referendum it was more on my mind/part of discussions.",72,2,Remain,Remain
12,1652090000000,09/05/2022 10:05,1652090000000,1,09/05/2022 11:05,87571,5,task-ogmx,NA,21755980,6431963,NA,complete,NA,6278e714b05d4828f425faef,computer,Desktop or Laptop,Windows 10,Edge 101.0.1210.39,1920x1080,1920x969,NA,ITT Ratings,4,Remain,8,NA,NA,NA,NA,NA,NA,ACCEPT,NA,NA,NA,batch8__REM,batch8__REM,53,10,1,Screen 1,continueButton,response_rating_scale_likert_active,1794.3,NA,NA,Strongly Agree,1,0,1,0,NA,NA,NA,NA,1,statements,travelling will be more difficult,1,05/04/2022,05/04/2022,R_3Rz6L8l6KvNvrbT,YES,Remain (Against Brexit),Confident,NA,Somewhat Agree,NA,NA,NA,Disagree,Somewhat Disagree,Somewhat Disagree,NA,NA,NA,Neither Agree nor Disagree,Somewhat Disagree,Neither Agree nor Disagree,Most months,A few times a year,NA,Female,NA,"Undergraduate degree (BSc, BA)",NA,79,2,Remain,Remain
