24,1652090527012,09/05/2022 10:02:07,1652090526954,1,09/05/2022 11:02:06,87571,5,task-39lm,NA,21755583,6431825,NA,complete,NA,6278e5fe6b0b4a3a7a1abcf9,computer,Desktop or Laptop,Windows 10,Chrome 96.0.4664.45,1280x720,1280x577,NA,ITT Ratings,4,Remain,5,NA,NA,NA,ACCEPT,NA,NA,NA,NA,NA,NA,batch5_REM,batch5_REM,36,22,1,Screen 1,continueButton,response_rating_scale_likert_active,5433.200000047684,NA,NA,Strongly Agree,1,0,1,0,NA,NA,NA,NA,1,statements,the benefits of leaving the EU are/were uncertain and vague. There is no guarantee of what will happen and without links to the EU I do not have faith in this government to do the right thing for us,1,5/4/22,5/4/22,R_2cnrY5mNhD3MwkK,YES,Remain (Against Brexit),Very confident,NA,Disagree,NA,NA,NA,Neither Agree nor Disagree,Agree,Somewhat Agree,NA,NA,NA,Somewhat Agree,Neither Agree nor Disagree,Somewhat Agree,Once or twice a year,A few times a year,27,Other,genderqueer,"Postgraduate degree (MSc, MA, MPhil)","after what has happened in the last few years, people who voted leave don't mention Brexit or the referendum at all. I suspect that nowadays some will even lie about how they voted. It's very frustrating.",46,3,Remain,Remain
25,1652090530537,09/05/2022 10:02:10,1652090530346,1,09/05/2022 11:02:10,87571,5,task-39lm,NA,21755583,6431825,NA,complete,NA,6278e5fe6b0b4a3a7a1abcf9,computer,Desktop or Laptop,Windows 10,Chrome 96.0.4664.45,1280x720,1280x577,NA,ITT Ratings,4,Remain,5,NA,NA,NA,ACCEPT,NA,NA,NA,NA,NA,NA,batch5_REM,batch5_REM,20,23,1,Screen 1,continueButton,response_rating_scale_likert_active,3377.7999999523163,NA,NA,Disagree,1,0,1,0,NA,NA,NA,NA,1,statements,Freedom to trade with other countries,1,5/4/22,5/4/22,R_11Y0Ua8MWcGpcYP,YES,Remain (Against Brexit),Confident,NA,Somewhat Agree,NA,NA,NA,Somewhat Disagree,Somewhat Disagree,Somewhat Agree,NA,NA,NA,Somewhat Disagree,Somewhat Disagree,Disagree,Never,Rarely,30,Female,NA,"Postgraduate degree (MSc, MA, MPhil)",NA,43,2,Remain,Leave
26,1652090533004,09/05/2022 10:02:13,1652090532931,1,09/05/2022 11:02:12,87571,5,task-39lm,NA,21755583,6431825,NA,complete,NA,6278e5fe6b0b4a3a7a1abcf9,computer,Desktop or Laptop,Windows 10,Chrome 96.0.4664.45,1280x720,1280x577,NA,ITT Ratings,4,Remain,5,NA,NA,NA,ACCEPT,NA,NA,NA,NA,NA,NA,batch5_REM,batch5_REM,32,24,1,Screen 1,continueButton,response_rating_scale_likert_active,2571.100000023842,NA,NA,Neither Agree nor Disagree,1,0,1,0,NA,NA,NA,NA,1,statements,I did not like the EU and wanted to restore the UK to its previous power,1,5/4/22,5/4/22,R_1etaBZleKRYNeVh,YES,Remain (Against Brexit),Confident,NA,Somewhat Disagree,NA,NA,NA,Somewhat Agree,Somewhat Agree,Somewhat Agree,NA,NA,NA,Neither Agree nor Disagree,Somewhat Agree,Neither Agree nor Disagree,Rarely,Rarely,28,Male,NA,"Postgraduate degree (MSc, MA, MPhil)",NA,45,2,Remain,Leave
27,1652090535593,09/05/2022 10:02:15,1652090535331,1,09/05/2022 11:02:15,87571,5,task-39lm,NA,21755583,6431825,NA,complete,NA,6278e5fe6b0b4a3a7a1abcf9,computer,Desktop or Laptop,Windows 10,Chrome 96.0.4664.45,1280x720,1280x577,NA,ITT Ratings,4,Remain,5,NA,NA,NA,ACCEPT,NA,NA,NA,NA,NA,NA,batch5_REM,batch5_REM,33,25,1,Screen 1,continueButton,response_rating_scale_likert_active,2387.5,NA,NA,Somewhat Disagree,1,0,1,0,NA,NA,NA,NA,1,statements,I wanted the foreigners to leave,1,5/4/22,5/4/22,R_1etaBZleKRYNeVh,YES,Remain (Against Brexit),Confident,NA,Somewhat Disagree,NA,NA,NA,Somewhat Agree,Somewhat Agree,Somewhat Agree,NA,NA,NA,Neither Agree nor Disagree,Somewhat Agree,Neither Agree nor Disagree,Rarely,Rarely,28,Male,NA,"Postgraduate degree (MSc, MA, MPhil)",NA,45,3,Remain,Leave
28,1652090539055,09/05/2022 10:02:19,1652090538866,1,09/05/2022 11:02:18,87571,5,task-39lm,NA,21755583,6431825,NA,complete,NA,6278e5fe6b0b4a3a7a1abcf9,computer,Desktop or Laptop,Windows 10,Chrome 96.0.4664.45,1280x720,1280x577,NA,ITT Ratings,4,Remain,5,NA,NA,NA,ACCEPT,NA,NA,NA,NA,NA,NA,batch5_REM,batch5_REM,5,26,1,Screen 1,continueButton,response_rating_scale_likert_active,3517.899999976158,NA,NA,Somewhat Disagree,1,0,1,0,NA,NA,NA,NA,1,statements,how much it cost to remain in the EU,1,5/4/22,5/4/22,R_1DAOsFtxfbfUhGa,YES,Remain (Against Brexit),Confident,NA,Disagree,NA,NA,NA,Somewhat Agree,Neither Agree nor Disagree,Agree,NA,NA,NA,Neither Agree nor Disagree,Neither Agree nor Disagree,Neither Agree nor Disagree,A few times a year,Once or twice a year,48,Female,NA,"Undergraduate degree (BSc, BA)",NA,41,2,Remain,Remain
29,1652090551097,09/05/2022 10:02:31,1652090551010,1,09/05/2022 11:02:31,87571,5,task-39lm,NA,21755583,6431825,NA,complete,NA,6278e5fe6b0b4a3a7a1abcf9,computer,Desktop or Laptop,Windows 10,Chrome 96.0.4664.45,1280x720,1280x577,NA,ITT Ratings,4,Remain,5,NA,NA,NA,ACCEPT,NA,NA,NA,NA,NA,NA,batch5_REM,batch5_REM,22,27,1,Screen 1,continueButton,response_rating_scale_likert_active,12128.600000023842,NA,NA,Somewhat Disagree,1,0,1,0,NA,NA,NA,NA,1,statements,EU Trade - the ability to trade with other counties within the EU.,1,5/4/22,5/4/22,R_1l0o1B0iCDpatcZ,YES,Remain (Against Brexit),Confident,NA,Somewhat Agree,NA,NA,NA,Neither Agree nor Disagree,Neither Agree nor Disagree,Somewhat Agree,NA,NA,NA,Neither Agree nor Disagree,Neither Agree nor Disagree,Neither Agree nor Disagree,A few times a year,Rarely,25,Female,NA,"Undergraduate degree (BSc, BA)",NA,44,1,Remain,Remain
30,1652090562331,09/05/2022 10:02:42,1652090562179,1,09/05/2022 11:02:42,87571,5,task-39lm,NA,21755583,6431825,NA,complete,NA,6278e5fe6b0b4a3a7a1abcf9,computer,Desktop or Laptop,Windows 10,Chrome 96.0.4664.45,1280x720,1280x577,NA,ITT Ratings,4,Remain,5,NA,NA,NA,ACCEPT,NA,NA,NA,NA,NA,NA,batch5_REM,batch5_REM,18,28,1,Screen 1,continueButton,response_rating_scale_likert_active,11154.800000071526,NA,NA,Somewhat Agree,1,0,1,0,NA,NA,NA,NA,1,statements,Trade deals keeping cost of living low,1,5/4/22,5/4/22,R_11Y0Ua8MWcGpcYP,YES,Remain (Against Brexit),Confident,NA,Somewhat Agree,NA,NA,NA,Somewhat Disagree,Somewhat Disagree,Somewhat Agree,NA,NA,NA,Somewhat Disagree,Somewhat Disagree,Disagree,Never,Rarely,30,Female,NA,"Postgraduate degree (MSc, MA, MPhil)",NA,43,3,Remain,Remain
31,1652090565064,09/05/2022 10:02:45,1652090564962,1,09/05/2022 11:02:44,87571,5,task-39lm,NA,21755583,6431825,NA,complete,NA,6278e5fe6b0b4a3a7a1abcf9,computer,Desktop or Laptop,Windows 10,Chrome 96.0.4664.45,1280x720,1280x577,NA,ITT Ratings,4,Remain,5,NA,NA,NA,ACCEPT,NA,NA,NA,NA,NA,NA,batch5_REM,batch5_REM,12,29,1,Screen 1,continueButton,response_rating_scale_likert_active,2765.899999976158,NA,NA,Disagree,1,0,1,0,NA,NA,NA,NA,1,statements,I didn't know what I wanted,1,5/4/22,5/4/22,R_1cY2f8b495jEyst,YES,Remain (Against Brexit),Undecided,NA,Somewhat Agree,NA,NA,NA,Neither Agree nor Disagree,Neither Agree nor Disagree,Neither Agree nor Disagree,NA,NA,NA,Neither Agree nor Disagree,Neither Agree nor Disagree,Neither Agree nor Disagree,Never,Never,35,Female,NA,"Undergraduate degree (BSc, BA)",NA,42,3,Remain,Remain
32,1652090568028,09/05/2022 10:02:48,1652090567762,1,09/05/2022 11:02:47,87571,5,task-39lm,NA,21755583,6431825,NA,complete,NA,6278e5fe6b0b4a3a7a1abcf9,computer,Desktop or Laptop,Windows 10,Chrome 96.0.4664.45,1280x720,1280x577,NA,ITT Ratings,4,Remain,5,NA,NA,NA,ACCEPT,NA,NA,NA,NA,NA,NA,batch5_REM,batch5_REM,55,30,1,Screen 1,continueButton,response_rating_scale_likert_active,2786.899999976158,NA,NA,Somewhat Disagree,1,0,1,0,NA,NA,NA,NA,1,statements,I'm worried about immigration and the effect it has on UK resources.,1,5/4/22,5/4/22,R_3meHA57NeKCm3q0,YES,Remain (Against Brexit),Very confident,NA,Disagree,NA,NA,NA,Somewhat Disagree,Disagree,Somewhat Agree,NA,NA,NA,Disagree,Disagree,Disagree,Rarely,Most months,40,Female,NA,"Undergraduate degree (BSc, BA)",NA,49,1,Remain,Leave
33,1652090570659,09/05/2022 10:02:50,1652090570611,1,09/05/2022 11:02:50,87571,5,task-39lm,NA,21755583,6431825,NA,complete,NA,6278e5fe6b0b4a3a7a1abcf9,computer,Desktop or Laptop,Windows 10,Chrome 96.0.4664.45,1280x720,1280x577,NA,ITT Ratings,4,Remain,5,NA,NA,NA,ACCEPT,NA,NA,NA,NA,NA,NA,batch5_REM,batch5_REM,43,31,1,Screen 1,continueButton,response_rating_scale_likert_active,2835.7000000476837,NA,NA,Disagree,1,0,1,0,NA,NA,NA,NA,1,statements,It will be better for our economy. We can run our own businesses etc.,1,5/4/22,5/4/22,R_5nkz1BlowolfJol,YES,Remain (Against Brexit),Undecided,NA,Disagree,NA,NA,NA,Strongly Disagree,Somewhat Agree,Somewhat Agree,NA,NA,NA,Strongly Disagree,Strongly Disagree,Strongly Disagree,Rarely,A few times a year,21,Female,NA,"Undergraduate degree (BSc, BA)",NA,47,1,Remain,Leave
34,1652090574568,09/05/2022 10:02:54,1652090574458,1,09/05/2022 11:02:54,87571,5,task-39lm,NA,21755583,6431825,NA,complete,NA,6278e5fe6b0b4a3a7a1abcf9,computer,Desktop or Laptop,Windows 10,Chrome 96.0.4664.45,1280x720,1280x577,NA,ITT Ratings,4,Remain,5,NA,NA,NA,ACCEPT,NA,NA,NA,NA,NA,NA,batch5_REM,batch5_REM,17,32,1,Screen 1,continueButton,response_rating_scale_likert_active,3835.100000023842,NA,NA,Neither Agree nor Disagree,1,0,1,0,NA,NA,NA,NA,1,statements,European laws that cover us beneficial,1,5/4/22,5/4/22,R_11Y0Ua8MWcGpcYP,YES,Remain (Against Brexit),Confident,NA,Somewhat Agree,NA,NA,NA,Somewhat Disagree,Somewhat Disagree,Somewhat Agree,NA,NA,NA,Somewhat Disagree,Somewhat Disagree,Disagree,Never,Rarely,30,Female,NA,"Postgraduate degree (MSc, MA, MPhil)",NA,43,2,Remain,Remain
35,1652090577118,09/05/2022 10:02:57,1652090576914,1,09/05/2022 11:02:56,87571,5,task-39lm,NA,21755583,6431825,NA,complete,NA,6278e5fe6b0b4a3a7a1abcf9,computer,Desktop or Laptop,Windows 10,Chrome 96.0.4664.45,1280x720,1280x577,NA,ITT Ratings,4,Remain,5,NA,NA,NA,ACCEPT,NA,NA,NA,NA,NA,NA,batch5_REM,batch5_REM,13,33,1,Screen 1,continueButton,response_rating_scale_likert_active,2442.899999976158,NA,NA,Somewhat Disagree,1,0,1,0,NA,NA,NA,NA,1,statements,I had personal reasons,1,5/4/22,5/4/22,R_1cY2f8b495jEyst,YES,Remain (Against Brexit),Undecided,NA,Somewhat Agree,NA,NA,NA,Neither Agree nor Disagree,Neither Agree nor Disagree,Neither Agree nor Disagree,NA,NA,NA,Neither Agree nor Disagree,Neither Agree nor Disagree,Neither Agree nor Disagree,Never,Never,35,Female,NA,"Undergraduate degree (BSc, BA)",NA,42,1,Remain,Leave
36,1652090586260,09/05/2022 10:03:06,1652090586163,1,09/05/2022 11:03:06,87571,5,task-39lm,NA,21755583,6431825,NA,complete,NA,6278e5fe6b0b4a3a7a1abcf9,computer,Desktop or Laptop,Windows 10,Chrome 96.0.4664.45,1280x720,1280x577,NA,ITT Ratings,4,Remain,5,NA,NA,NA,ACCEPT,NA,NA,NA,NA,NA,NA,batch5_REM,batch5_REM,28,34,1,Screen 1,continueButton,response_rating_scale_likert_active,9235.100000023842,NA,NA,Disagree,1,0,1,0,NA,NA,NA,NA,1,statements,I did not want things to change,1,5/4/22,5/4/22,R_1etaBZleKRYNeVh,YES,Remain (Against Brexit),Confident,NA,Somewhat Disagree,NA,NA,NA,Somewhat Agree,Somewhat Agree,Somewhat Agree,NA,NA,NA,Neither Agree nor Disagree,Somewhat Agree,Neither Agree nor Disagree,Rarely,Rarely,28,Male,NA,"Postgraduate degree (MSc, MA, MPhil)",NA,45,1,Remain,Remain
37,1652090592916,09/05/2022 10:03:12,1652090592667,1,09/05/2022 11:03:12,87571,5,task-39lm,NA,21755583,6431825,NA,complete,NA,6278e5fe6b0b4a3a7a1abcf9,computer,Desktop or Laptop,Windows 10,Chrome 96.0.4664.45,1280x720,1280x577,NA,ITT Ratings,4,Remain,5,NA,NA,NA,ACCEPT,NA,NA,NA,NA,NA,NA,batch5_REM,batch5_REM,45,35,1,Screen 1,continueButton,response_rating_scale_likert_active,6490.700000047684,NA,NA,Strongly Disagree,1,0,1,0,NA,NA,NA,NA,1,statements,Saves/protects U.K. money. Before we paid money into the eu any other countries. We don't have to do that now,1,5/4/22,5/4/22,R_5nkz1BlowolfJol,YES,Remain (Against Brexit),Undecided,NA,Disagree,NA,NA,NA,Strongly Disagree,Somewhat Agree,Somewhat Agree,NA,NA,NA,Strongly Disagree,Strongly Disagree,Strongly Disagree,Rarely,A few times a year,21,Female,NA,"Undergraduate degree (BSc, BA)",NA,47,3,Remain,Leave
38,1652090598436,09/05/2022 10:03:18,1652090598291,1,09/05/2022 11:03:18,87571,5,task-39lm,NA,21755583,6431825,NA,complete,NA,6278e5fe6b0b4a3a7a1abcf9,computer,Desktop or Laptop,Windows 10,Chrome 96.0.4664.45,1280x720,1280x577,NA,ITT Ratings,4,Remain,5,NA,NA,NA,ACCEPT,NA,NA,NA,NA,NA,NA,batch5_REM,batch5_REM,56,36,1,Screen 1,continueButton,response_rating_scale_likert_active,5609.600000023842,NA,NA,Somewhat Disagree,1,0,1,0,NA,NA,NA,NA,1,statements,They want control of our laws to be managed from Westminster.,1,5/4/22,5/4/22,R_3meHA57NeKCm3q0,YES,Remain (Against Brexit),Very confident,NA,Disagree,NA,NA,NA,Somewhat Disagree,Disagree,Somewhat Agree,NA,NA,NA,Disagree,Disagree,Disagree,Rarely,Most months,40,Female,NA,"Undergraduate degree (BSc, BA)",NA,49,2,Remain,Leave
39,1652090603098,09/05/2022 10:03:23,1652090602979,1,09/05/2022 11:03:22,87571,5,task-39lm,NA,21755583,6431825,NA,complete,NA,6278e5fe6b0b4a3a7a1abcf9,computer,Desktop or Laptop,Windows 10,Chrome 96.0.4664.45,1280x720,1280x577,NA,ITT Ratings,4,Remain,5,NA,NA,NA,ACCEPT,NA,NA,NA,NA,NA,NA,batch5_REM,batch5_REM,52,37,1,Screen 1,continueButton,response_rating_scale_likert_active,4672.699999928474,NA,NA,Somewhat Agree,1,0,1,0,NA,NA,NA,NA,1,statements,I value the trading block the EU offers,1,5/4/22,5/4/22,R_3meHA57NeKCm3q0,YES,Remain (Against Brexit),Very confident,NA,Disagree,NA,NA,NA,Somewhat Disagree,Disagree,Somewhat Agree,NA,NA,NA,Disagree,Disagree,Disagree,Rarely,Most months,40,Female,NA,"Undergraduate degree (BSc, BA)",NA,49,1,Remain,Remain
40,1652090605616,09/05/2022 10:03:25,1652090605523,1,09/05/2022 11:03:25,87571,5,task-39lm,NA,21755583,6431825,NA,complete,NA,6278e5fe6b0b4a3a7a1abcf9,computer,Desktop or Laptop,Windows 10,Chrome 96.0.4664.45,1280x720,1280x577,NA,ITT Ratings,4,Remain,5,NA,NA,NA,ACCEPT,NA,NA,NA,NA,NA,NA,batch5_REM,batch5_REM,61,38,1,Screen 1,continueButton,response_rating_scale_likert_active,2527.2999999523163,NA,NA,Disagree,1,0,1,0,NA,NA,NA,NA,1,statements,The UK pays too much to the EU - not financially profitable,1,5/4/22,5/4/22,R_D0RxpgPvJO2T9yF,YES,Remain (Against Brexit),Very confident,NA,Disagree,NA,NA,NA,Neither Agree nor Disagree,Neither Agree nor Disagree,Neither Agree nor Disagree,NA,NA,NA,Neither Agree nor Disagree,Neither Agree nor Disagree,Neither Agree nor Disagree,Rarely,Rarely,58,Female,NA,"Undergraduate degree (BSc, BA)",NA,50,1,Remain,Leave
41,1652090609290,09/05/2022 10:03:29,1652090609204,1,09/05/2022 11:03:29,87571,5,task-39lm,NA,21755583,6431825,NA,complete,NA,6278e5fe6b0b4a3a7a1abcf9,computer,Desktop or Laptop,Windows 10,Chrome 96.0.4664.45,1280x720,1280x577,NA,ITT Ratings,4,Remain,5,NA,NA,NA,ACCEPT,NA,NA,NA,NA,NA,NA,batch5_REM,batch5_REM,39,39,1,Screen 1,continueButton,response_rating_scale_likert_active,3666.899999976158,NA,NA,Neither Agree nor Disagree,1,0,1,0,NA,NA,NA,NA,1,statements,to allow us to trade with the whole world,1,5/4/22,5/4/22,R_2cnrY5mNhD3MwkK,YES,Remain (Against Brexit),Very confident,NA,Disagree,NA,NA,NA,Neither Agree nor Disagree,Agree,Somewhat Agree,NA,NA,NA,Somewhat Agree,Neither Agree nor Disagree,Somewhat Agree,Once or twice a year,A few times a year,27,Other,genderqueer,"Postgraduate degree (MSc, MA, MPhil)","after what has happened in the last few years, people who voted leave don't mention Brexit or the referendum at all. I suspect that nowadays some will even lie about how they voted. It's very frustrating.",46,3,Remain,Leave
42,1652090610971,09/05/2022 10:03:30,1652090610923,1,09/05/2022 11:03:30,87571,5,task-39lm,NA,21755583,6431825,NA,complete,NA,6278e5fe6b0b4a3a7a1abcf9,computer,Desktop or Laptop,Windows 10,Chrome 96.0.4664.45,1280x720,1280x577,NA,ITT Ratings,4,Remain,5,NA,NA,NA,ACCEPT,NA,NA,NA,NA,NA,NA,batch5_REM,batch5_REM,50,40,1,Screen 1,continueButton,response_rating_scale_likert_active,1705.600000023842,NA,NA,Neither Agree nor Disagree,1,0,1,0,NA,NA,NA,NA,1,statements,To regain independence from foreign powers and their interference.,1,5/4/22,5/4/22,R_2YxoWL19PyHfcHi,YES,Remain (Against Brexit),Very confident,NA,Disagree,NA,NA,NA,Neither Agree nor Disagree,Somewhat Agree,Somewhat Agree,NA,NA,NA,Neither Agree nor Disagree,Disagree,Neither Agree nor Disagree,Once or twice a year,Once or twice a year,63,Male,NA,"Postgraduate degree (MSc, MA, MPhil)",None - thank you.,48,2,Remain,Leave
43,1652090613331,09/05/2022 10:03:33,1652090613204,1,09/05/2022 11:03:33,87571,5,task-39lm,NA,21755583,6431825,NA,complete,NA,6278e5fe6b0b4a3a7a1abcf9,computer,Desktop or Laptop,Windows 10,Chrome 96.0.4664.45,1280x720,1280x577,NA,ITT Ratings,4,Remain,5,NA,NA,NA,ACCEPT,NA,NA,NA,NA,NA,NA,batch5_REM,batch5_REM,29,41,1,Screen 1,continueButton,response_rating_scale_likert_active,2268.1999999284744,NA,NA,Somewhat Agree,1,0,1,0,NA,NA,NA,NA,1,statements,I like the EU and want to continue being in it,1,5/4/22,5/4/22,R_1etaBZleKRYNeVh,YES,Remain (Against Brexit),Confident,NA,Somewhat Disagree,NA,NA,NA,Somewhat Agree,Somewhat Agree,Somewhat Agree,NA,NA,NA,Neither Agree nor Disagree,Somewhat Agree,Neither Agree nor Disagree,Rarely,Rarely,28,Male,NA,"Postgraduate degree (MSc, MA, MPhil)",NA,45,2,Remain,Remain
44,1652090615925,09/05/2022 10:03:35,1652090615811,1,09/05/2022 11:03:35,87571,5,task-39lm,NA,21755583,6431825,NA,complete,NA,6278e5fe6b0b4a3a7a1abcf9,computer,Desktop or Laptop,Windows 10,Chrome 96.0.4664.45,1280x720,1280x577,NA,ITT Ratings,4,Remain,5,NA,NA,NA,ACCEPT,NA,NA,NA,NA,NA,NA,batch5_REM,batch5_REM,8,42,1,Screen 1,continueButton,response_rating_scale_likert_active,2593.7999999523163,NA,NA,Somewhat Disagree,1,0,1,0,NA,NA,NA,NA,1,statements,the cost of remaining in the eu,1,5/4/22,5/4/22,R_1DAOsFtxfbfUhGa,YES,Remain (Against Brexit),Confident,NA,Disagree,NA,NA,NA,Somewhat Agree,Neither Agree nor Disagree,Agree,NA,NA,NA,Neither Agree nor Disagree,Neither Agree nor Disagree,Neither Agree nor Disagree,A few times a year,Once or twice a year,48,Female,NA,"Undergraduate degree (BSc, BA)",NA,41,2,Remain,Leave
45,1652090618318,09/05/2022 10:03:38,1652090618179,1,09/05/2022 11:03:38,87571,5,task-39lm,NA,21755583,6431825,NA,complete,NA,6278e5fe6b0b4a3a7a1abcf9,computer,Desktop or Laptop,Windows 10,Chrome 96.0.4664.45,1280x720,1280x577,NA,ITT Ratings,4,Remain,5,NA,NA,NA,ACCEPT,NA,NA,NA,NA,NA,NA,batch5_REM,batch5_REM,38,43,1,Screen 1,continueButton,response_rating_scale_likert_active,2354.600000023842,NA,NA,Somewhat Disagree,1,0,1,0,NA,NA,NA,NA,1,statements,to remove EU input from our legal system,1,5/4/22,5/4/22,R_2cnrY5mNhD3MwkK,YES,Remain (Against Brexit),Very confident,NA,Disagree,NA,NA,NA,Neither Agree nor Disagree,Agree,Somewhat Agree,NA,NA,NA,Somewhat Agree,Neither Agree nor Disagree,Somewhat Agree,Once or twice a year,A few times a year,27,Other,genderqueer,"Postgraduate degree (MSc, MA, MPhil)","after what has happened in the last few years, people who voted leave don't mention Brexit or the referendum at all. I suspect that nowadays some will even lie about how they voted. It's very frustrating.",46,2,Remain,Leave
46,1652090622060,09/05/2022 10:03:42,1652090621915,1,09/05/2022 11:03:41,87571,5,task-39lm,NA,21755583,6431825,NA,complete,NA,6278e5fe6b0b4a3a7a1abcf9,computer,Desktop or Laptop,Windows 10,Chrome 96.0.4664.45,1280x720,1280x577,NA,ITT Ratings,4,Remain,5,NA,NA,NA,ACCEPT,NA,NA,NA,NA,NA,NA,batch5_REM,batch5_REM,25,44,1,Screen 1,continueButton,response_rating_scale_likert_active,3721.299999952316,NA,NA,Disagree,1,0,1,0,NA,NA,NA,NA,1,statements,I want the UK to return to how it was before it joined the EU.,1,5/4/22,5/4/22,R_1l0o1B0iCDpatcZ,YES,Remain (Against Brexit),Confident,NA,Somewhat Agree,NA,NA,NA,Neither Agree nor Disagree,Neither Agree nor Disagree,Somewhat Agree,NA,NA,NA,Neither Agree nor Disagree,Neither Agree nor Disagree,Neither Agree nor Disagree,A few times a year,Rarely,25,Female,NA,"Undergraduate degree (BSc, BA)",NA,44,1,Remain,Leave
47,1652090623601,09/05/2022 10:03:43,1652090623499,1,09/05/2022 11:03:43,87571,5,task-39lm,NA,21755583,6431825,NA,complete,NA,6278e5fe6b0b4a3a7a1abcf9,computer,Desktop or Laptop,Windows 10,Chrome 96.0.4664.45,1280x720,1280x577,NA,ITT Ratings,4,Remain,5,NA,NA,NA,ACCEPT,NA,NA,NA,NA,NA,NA,batch5_REM,batch5_REM,19,45,1,Screen 1,continueButton,response_rating_scale_likert_active,1570.600000023842,NA,NA,Disagree,1,0,1,0,NA,NA,NA,NA,1,statements,Independence from European decisions,1,5/4/22,5/4/22,R_11Y0Ua8MWcGpcYP,YES,Remain (Against Brexit),Confident,NA,Somewhat Agree,NA,NA,NA,Somewhat Disagree,Somewhat Disagree,Somewhat Agree,NA,NA,NA,Somewhat Disagree,Somewhat Disagree,Disagree,Never,Rarely,30,Female,NA,"Postgraduate degree (MSc, MA, MPhil)",NA,43,1,Remain,Leave
48,1652090625116,09/05/2022 10:03:45,1652090624867,1,09/05/2022 11:03:44,87571,5,task-39lm,NA,21755583,6431825,NA,complete,NA,6278e5fe6b0b4a3a7a1abcf9,computer,Desktop or Laptop,Windows 10,Chrome 96.0.4664.45,1280x720,1280x577,NA,ITT Ratings,4,Remain,5,NA,NA,NA,ACCEPT,NA,NA,NA,NA,NA,NA,batch5_REM,batch5_REM,57,46,1,Screen 1,continueButton,response_rating_scale_likert_active,1352.899999976158,NA,NA,Disagree,1,0,1,0,NA,NA,NA,NA,1,statements,I'm sick of contributing to EU funds and would rather all money was spent at home.,1,5/4/22,5/4/22,R_3meHA57NeKCm3q0,YES,Remain (Against Brexit),Very confident,NA,Disagree,NA,NA,NA,Somewhat Disagree,Disagree,Somewhat Agree,NA,NA,NA,Disagree,Disagree,Disagree,Rarely,Most months,40,Female,NA,"Undergraduate degree (BSc, BA)",NA,49,3,Remain,Leave
49,1652090627968,09/05/2022 10:03:47,1652090627883,1,09/05/2022 11:03:47,87571,5,task-39lm,NA,21755583,6431825,NA,complete,NA,6278e5fe6b0b4a3a7a1abcf9,computer,Desktop or Laptop,Windows 10,Chrome 96.0.4664.45,1280x720,1280x577,NA,ITT Ratings,4,Remain,5,NA,NA,NA,ACCEPT,NA,NA,NA,NA,NA,NA,batch5_REM,batch5_REM,40,47,1,Screen 1,continueButton,response_rating_scale_likert_active,3001.8000000715256,NA,NA,Neither Agree nor Disagree,1,0,1,0,NA,NA,NA,NA,1,statements,Better for our economy and trade within Europe.,1,5/4/22,5/4/22,R_5nkz1BlowolfJol,YES,Remain (Against Brexit),Undecided,NA,Disagree,NA,NA,NA,Strongly Disagree,Somewhat Agree,Somewhat Agree,NA,NA,NA,Strongly Disagree,Strongly Disagree,Strongly Disagree,Rarely,A few times a year,21,Female,NA,"Undergraduate degree (BSc, BA)",NA,47,1,Remain,Remain
50,1652090631159,09/05/2022 10:03:51,1652090631035,1,09/05/2022 11:03:51,87571,5,task-39lm,NA,21755583,6431825,NA,complete,NA,6278e5fe6b0b4a3a7a1abcf9,computer,Desktop or Laptop,Windows 10,Chrome 96.0.4664.45,1280x720,1280x577,NA,ITT Ratings,4,Remain,5,NA,NA,NA,ACCEPT,NA,NA,NA,NA,NA,NA,batch5_REM,batch5_REM,27,48,1,Screen 1,continueButton,response_rating_scale_likert_active,3136.2999999523163,NA,NA,Somewhat Disagree,1,0,1,0,NA,NA,NA,NA,1,statements,I want the UK to be independent from other European countries. To determine its own rules and regulations.,1,5/4/22,5/4/22,R_1l0o1B0iCDpatcZ,YES,Remain (Against Brexit),Confident,NA,Somewhat Agree,NA,NA,NA,Neither Agree nor Disagree,Neither Agree nor Disagree,Somewhat Agree,NA,NA,NA,Neither Agree nor Disagree,Neither Agree nor Disagree,Neither Agree nor Disagree,A few times a year,Rarely,25,Female,NA,"Undergraduate degree (BSc, BA)",NA,44,3,Remain,Leave
51,1652090636082,09/05/2022 10:03:56,1652090635979,1,09/05/2022 11:03:55,87571,5,task-39lm,NA,21755583,6431825,NA,complete,NA,6278e5fe6b0b4a3a7a1abcf9,computer,Desktop or Laptop,Windows 10,Chrome 96.0.4664.45,1280x720,1280x577,NA,ITT Ratings,4,Remain,5,NA,NA,NA,ACCEPT,NA,NA,NA,NA,NA,NA,batch5_REM,batch5_REM,2,49,1,Screen 1,continueButton,response_rating_scale_likert_active,4931.199999928474,NA,NA,Somewhat Agree,1,0,1,0,NA,NA,NA,NA,1,statements,We would like to check you are reading each argument carefully. Please select 'Somewhat Agree' for this answer,1,NA,NA,NA,NA,NA,NA,NA,NA,NA,NA,NA,NA,NA,NA,NA,NA,NA,NA,NA,NA,NA,NA,NA,NA,NA,NA,NA,NA,check1,NA,NA
52,1652090638617,09/05/2022 10:03:58,1652090638515,1,09/05/2022 11:03:58,87571,5,task-39lm,NA,21755583,6431825,NA,complete,NA,6278e5fe6b0b4a3a7a1abcf9,computer,Desktop or Laptop,Windows 10,Chrome 96.0.4664.45,1280x720,1280x577,NA,ITT Ratings,4,Remain,5,NA,NA,NA,ACCEPT,NA,NA,NA,NA,NA,NA,batch5_REM,batch5_REM,30,50,1,Screen 1,continueButton,response_rating_scale_likert_active,2522.899999976158,NA,NA,Strongly Agree,1,0,1,0,NA,NA,NA,NA,1,statements,I enjoy travel and enjoy being able to do so around the EU,1,5/4/22,5/4/22,R_1etaBZleKRYNeVh,YES,Remain (Against Brexit),Confident,NA,Somewhat Disagree,NA,NA,NA,Somewhat Agree,Somewhat Agree,Somewhat Agree,NA,NA,NA,Neither Agree nor Disagree,Somewhat Agree,Neither Agree nor Disagree,Rarely,Rarely,28,Male,NA,"Postgraduate degree (MSc, MA, MPhil)",NA,45,3,Remain,Remain
53,1652090641142,09/05/2022 10:04:01,1652090641011,1,09/05/2022 11:04:01,87571,5,task-39lm,NA,21755583,6431825,NA,complete,NA,6278e5fe6b0b4a3a7a1abcf9,computer,Desktop or Laptop,Windows 10,Chrome 96.0.4664.45,1280x720,1280x577,NA,ITT Ratings,4,Remain,5,NA,NA,NA,ACCEPT,NA,NA,NA,NA,NA,NA,batch5_REM,batch5_REM,4,51,1,Screen 1,continueButton,response_rating_scale_likert_active,2483.2999999523163,NA,NA,Somewhat Disagree,1,0,1,0,NA,NA,NA,NA,1,statements,stop immigration and prevent immigrants landing on our shores,1,5/4/22,5/4/22,R_1DAOsFtxfbfUhGa,YES,Remain (Against Brexit),Confident,NA,Disagree,NA,NA,NA,Somewhat Agree,Neither Agree nor Disagree,Agree,NA,NA,NA,Neither Agree nor Disagree,Neither Agree nor Disagree,Neither Agree nor Disagree,A few times a year,Once or twice a year,48,Female,NA,"Undergraduate degree (BSc, BA)",NA,41,1,Remain,Remain
54,1652090643742,09/05/2022 10:04:03,1652090643603,1,09/05/2022 11:04:03,87571,5,task-39lm,NA,21755583,6431825,NA,complete,NA,6278e5fe6b0b4a3a7a1abcf9,computer,Desktop or Laptop,Windows 10,Chrome 96.0.4664.45,1280x720,1280x577,NA,ITT Ratings,4,Remain,5,NA,NA,NA,ACCEPT,NA,NA,NA,NA,NA,NA,batch5_REM,batch5_REM,21,52,1,Screen 1,continueButton,response_rating_scale_likert_active,2578.5,NA,NA,Somewhat Disagree,1,0,1,0,NA,NA,NA,NA,1,statements,Financial burden to be in EU,1,5/4/22,5/4/22,R_11Y0Ua8MWcGpcYP,YES,Remain (Against Brexit),Confident,NA,Somewhat Agree,NA,NA,NA,Somewhat Disagree,Somewhat Disagree,Somewhat Agree,NA,NA,NA,Somewhat Disagree,Somewhat Disagree,Disagree,Never,Rarely,30,Female,NA,"Postgraduate degree (MSc, MA, MPhil)",NA,43,3,Remain,Leave
