13,1652090778918,09/05/2022 10:06:18,1652090936299,1,09/05/2022 11:08:56,87571,5,task-39lm,NA,21756052,6431990,NA,complete,NA,6278e74a52e0482b2c5e38c3,computer,Desktop or Laptop,Windows 10,Chrome 101.0.4951.54,1536x864,1519x754,NA,ITT Ratings,4,Remain,5,NA,NA,NA,ACCEPT,NA,NA,NA,NA,NA,NA,batch5_REM,batch5_REM,39,11,1,Screen 1,continueButton,response_rating_scale_likert_active,1247.0999999996277,NA,NA,Agree,1,0,1,0,NA,NA,NA,NA,1,statements,to allow us to trade with the whole world,1,5/4/22,5/4/22,R_2cnrY5mNhD3MwkK,YES,Remain (Against Brexit),Very confident,NA,Disagree,NA,NA,NA,Neither Agree nor Disagree,Agree,Somewhat Agree,NA,NA,NA,Somewhat Agree,Neither Agree nor Disagree,Somewhat Agree,Once or twice a year,A few times a year,27,Other,genderqueer,"Postgraduate degree (MSc, MA, MPhil)","after what has happened in the last few years, people who voted leave don't mention Brexit or the referendum at all. I suspect that nowadays some will even lie about how they voted. It's very frustrating.",46,3,Remain,Leave
14,1652090784685,09/05/2022 10:06:24,1652090942062,1,09/05/2022 11:09:02,87571,5,task-39lm,NA,21756052,6431990,NA,complete,NA,6278e74a52e0482b2c5e38c3,computer,Desktop or Laptop,Windows 10,Chrome 101.0.4951.54,1536x864,1519x754,NA,ITT Ratings,4,Remain,5,NA,NA,NA,ACCEPT,NA,NA,NA,NA,NA,NA,batch5_REM,batch5_REM,26,12,1,Screen 1,continueButton,response_rating_scale_likert_active,5755.299999998882,NA,NA,Strongly Disagree,1,0,1,0,NA,NA,NA,NA,1,statements,I want more jobs to be available for UK citizens. Making it harder for immigrants to have the right to work in the UK.,1,5/4/22,5/4/22,R_1l0o1B0iCDpatcZ,YES,Remain (Against Brexit),Confident,NA,Somewhat Agree,NA,NA,NA,Neither Agree nor Disagree,Neither Agree nor Disagree,Somewhat Agree,NA,NA,NA,Neither Agree nor Disagree,Neither Agree nor Disagree,Neither Agree nor Disagree,A few times a year,Rarely,25,Female,NA,"Undergraduate degree (BSc, BA)",NA,44,2,Remain,Leave
15,1652090788125,09/05/2022 10:06:28,1652090945506,1,09/05/2022 11:09:05,87571,5,task-39lm,NA,21756052,6431990,NA,complete,NA,6278e74a52e0482b2c5e38c3,computer,Desktop or Laptop,Windows 10,Chrome 101.0.4951.54,1536x864,1519x754,NA,ITT Ratings,4,Remain,5,NA,NA,NA,ACCEPT,NA,NA,NA,NA,NA,NA,batch5_REM,batch5_REM,35,13,1,Screen 1,continueButton,response_rating_scale_likert_active,3434.300000000745,NA,NA,Agree,1,0,1,0,NA,NA,NA,NA,1,statements,"to remain a part of a democratic free market, where import and export costs are lower and the process is simpler than trading internationally",1,5/4/22,5/4/22,R_2cnrY5mNhD3MwkK,YES,Remain (Against Brexit),Very confident,NA,Disagree,NA,NA,NA,Neither Agree nor Disagree,Agree,Somewhat Agree,NA,NA,NA,Somewhat Agree,Neither Agree nor Disagree,Somewhat Agree,Once or twice a year,A few times a year,27,Other,genderqueer,"Postgraduate degree (MSc, MA, MPhil)","after what has happened in the last few years, people who voted leave don't mention Brexit or the referendum at all. I suspect that nowadays some will even lie about how they voted. It's very frustrating.",46,2,Remain,Remain
16,1652090791907,09/05/2022 10:06:31,1652090949284,1,09/05/2022 11:09:09,87571,5,task-39lm,NA,21756052,6431990,NA,complete,NA,6278e74a52e0482b2c5e38c3,computer,Desktop or Laptop,Windows 10,Chrome 101.0.4951.54,1536x864,1519x754,NA,ITT Ratings,4,Remain,5,NA,NA,NA,ACCEPT,NA,NA,NA,NA,NA,NA,batch5_REM,batch5_REM,10,14,1,Screen 1,continueButton,response_rating_scale_likert_active,3770.300000000745,NA,NA,Disagree,1,0,1,0,NA,NA,NA,NA,1,statements,I had personal reasons,1,5/4/22,5/4/22,R_1cY2f8b495jEyst,YES,Remain (Against Brexit),Undecided,NA,Somewhat Agree,NA,NA,NA,Neither Agree nor Disagree,Neither Agree nor Disagree,Neither Agree nor Disagree,NA,NA,NA,Neither Agree nor Disagree,Neither Agree nor Disagree,Neither Agree nor Disagree,Never,Never,35,Female,NA,"Undergraduate degree (BSc, BA)",NA,42,1,Remain,Remain
17,1652090793589,09/05/2022 10:06:33,1652090950963,1,09/05/2022 11:09:10,87571,5,task-39lm,NA,21756052,6431990,NA,complete,NA,6278e74a52e0482b2c5e38c3,computer,Desktop or Laptop,Windows 10,Chrome 101.0.4951.54,1536x864,1519x754,NA,ITT Ratings,4,Remain,5,NA,NA,NA,ACCEPT,NA,NA,NA,NA,NA,NA,batch5_REM,batch5_REM,58,15,1,Screen 1,continueButton,response_rating_scale_likert_active,1664.39999999851,NA,NA,Strongly Agree,1,0,1,0,NA,NA,NA,NA,1,statements,Freedom of movement,1,5/4/22,5/4/22,R_D0RxpgPvJO2T9yF,YES,Remain (Against Brexit),Very confident,NA,Disagree,NA,NA,NA,Neither Agree nor Disagree,Neither Agree nor Disagree,Neither Agree nor Disagree,NA,NA,NA,Neither Agree nor Disagree,Neither Agree nor Disagree,Neither Agree nor Disagree,Rarely,Rarely,58,Female,NA,"Undergraduate degree (BSc, BA)",NA,50,1,Remain,Remain
18,1652090795921,09/05/2022 10:06:35,1652090953301,1,09/05/2022 11:09:13,87571,5,task-39lm,NA,21756052,6431990,NA,complete,NA,6278e74a52e0482b2c5e38c3,computer,Desktop or Laptop,Windows 10,Chrome 101.0.4951.54,1536x864,1519x754,NA,ITT Ratings,4,Remain,5,NA,NA,NA,ACCEPT,NA,NA,NA,NA,NA,NA,batch5_REM,batch5_REM,59,16,1,Screen 1,continueButton,response_rating_scale_likert_active,2330.800000000745,NA,NA,Strongly Agree,1,0,1,0,NA,NA,NA,NA,1,statements,Better to be part of the European Community than separate from it,1,5/4/22,5/4/22,R_D0RxpgPvJO2T9yF,YES,Remain (Against Brexit),Very confident,NA,Disagree,NA,NA,NA,Neither Agree nor Disagree,Neither Agree nor Disagree,Neither Agree nor Disagree,NA,NA,NA,Neither Agree nor Disagree,Neither Agree nor Disagree,Neither Agree nor Disagree,Rarely,Rarely,58,Female,NA,"Undergraduate degree (BSc, BA)",NA,50,2,Remain,Remain
19,1652090801304,09/05/2022 10:06:41,1652090958681,1,09/05/2022 11:09:18,87571,5,task-39lm,NA,21756052,6431990,NA,complete,NA,6278e74a52e0482b2c5e38c3,computer,Desktop or Laptop,Windows 10,Chrome 101.0.4951.54,1536x864,1519x754,NA,ITT Ratings,4,Remain,5,NA,NA,NA,ACCEPT,NA,NA,NA,NA,NA,NA,batch5_REM,batch5_REM,2,17,1,Screen 1,continueButton,response_rating_scale_likert_active,5372.300000000745,NA,NA,Somewhat Agree,1,0,1,0,NA,NA,NA,NA,1,statements,We would like to check you are reading each argument carefully. Please select 'Somewhat Agree' for this answer,1,NA,NA,NA,NA,NA,NA,NA,NA,NA,NA,NA,NA,NA,NA,NA,NA,NA,NA,NA,NA,NA,NA,NA,NA,NA,NA,NA,NA,check1,NA,NA
20,1652090803464,09/05/2022 10:06:43,1652090960850,1,09/05/2022 11:09:20,87571,5,task-39lm,NA,21756052,6431990,NA,complete,NA,6278e74a52e0482b2c5e38c3,computer,Desktop or Laptop,Windows 10,Chrome 101.0.4951.54,1536x864,1519x754,NA,ITT Ratings,4,Remain,5,NA,NA,NA,ACCEPT,NA,NA,NA,NA,NA,NA,batch5_REM,batch5_REM,48,18,1,Screen 1,continueButton,response_rating_scale_likert_active,2162.199999999255,NA,NA,Strongly Agree,1,0,1,0,NA,NA,NA,NA,1,statements,"Ease of trade, travel, migration for work and education.",1,5/4/22,5/4/22,R_2YxoWL19PyHfcHi,YES,Remain (Against Brexit),Very confident,NA,Disagree,NA,NA,NA,Neither Agree nor Disagree,Somewhat Agree,Somewhat Agree,NA,NA,NA,Neither Agree nor Disagree,Disagree,Neither Agree nor Disagree,Once or twice a year,Once or twice a year,63,Male,NA,"Postgraduate degree (MSc, MA, MPhil)",None - thank you.,48,3,Remain,Remain
21,1652090807138,09/05/2022 10:06:47,1652090964520,1,09/05/2022 11:09:24,87571,5,task-39lm,NA,21756052,6431990,NA,complete,NA,6278e74a52e0482b2c5e38c3,computer,Desktop or Laptop,Windows 10,Chrome 101.0.4951.54,1536x864,1519x754,NA,ITT Ratings,4,Remain,5,NA,NA,NA,ACCEPT,NA,NA,NA,NA,NA,NA,batch5_REM,batch5_REM,5,19,1,Screen 1,continueButton,response_rating_scale_likert_active,3663.400000000373,NA,NA,Disagree,1,0,1,0,NA,NA,NA,NA,1,statements,how much it cost to remain in the EU,1,5/4/22,5/4/22,R_1DAOsFtxfbfUhGa,YES,Remain (Against Brexit),Confident,NA,Disagree,NA,NA,NA,Somewhat Agree,Neither Agree nor Disagree,Agree,NA,NA,NA,Neither Agree nor Disagree,Neither Agree nor Disagree,Neither Agree nor Disagree,A few times a year,Once or twice a year,48,Female,NA,"Undergraduate degree (BSc, BA)",NA,41,2,Remain,Remain
22,1652090809248,09/05/2022 10:06:49,1652090966624,1,09/05/2022 11:09:26,87571,5,task-39lm,NA,21756052,6431990,NA,complete,NA,6278e74a52e0482b2c5e38c3,computer,Desktop or Laptop,Windows 10,Chrome 101.0.4951.54,1536x864,1519x754,NA,ITT Ratings,4,Remain,5,NA,NA,NA,ACCEPT,NA,NA,NA,NA,NA,NA,batch5_REM,batch5_REM,33,20,1,Screen 1,continueButton,response_rating_scale_likert_active,2097.0999999996275,NA,NA,Strongly Disagree,1,0,1,0,NA,NA,NA,NA,1,statements,I wanted the foreigners to leave,1,5/4/22,5/4/22,R_1etaBZleKRYNeVh,YES,Remain (Against Brexit),Confident,NA,Somewhat Disagree,NA,NA,NA,Somewhat Agree,Somewhat Agree,Somewhat Agree,NA,NA,NA,Neither Agree nor Disagree,Somewhat Agree,Neither Agree nor Disagree,Rarely,Rarely,28,Male,NA,"Postgraduate degree (MSc, MA, MPhil)",NA,45,3,Remain,Leave
23,1652090813525,09/05/2022 10:06:53,1652090970906,1,09/05/2022 11:09:30,87571,5,task-39lm,NA,21756052,6431990,NA,complete,NA,6278e74a52e0482b2c5e38c3,computer,Desktop or Laptop,Windows 10,Chrome 101.0.4951.54,1536x864,1519x754,NA,ITT Ratings,4,Remain,5,NA,NA,NA,ACCEPT,NA,NA,NA,NA,NA,NA,batch5_REM,batch5_REM,34,21,1,Screen 1,continueButton,response_rating_scale_likert_active,4275.10000000149,NA,NA,Strongly Agree,1,0,1,0,NA,NA,NA,NA,1,statements,to keep our status as EU citizens allowing freedom of movement,1,5/4/22,5/4/22,R_2cnrY5mNhD3MwkK,YES,Remain (Against Brexit),Very confident,NA,Disagree,NA,NA,NA,Neither Agree nor Disagree,Agree,Somewhat Agree,NA,NA,NA,Somewhat Agree,Neither Agree nor Disagree,Somewhat Agree,Once or twice a year,A few times a year,27,Other,genderqueer,"Postgraduate degree (MSc, MA, MPhil)","after what has happened in the last few years, people who voted leave don't mention Brexit or the referendum at all. I suspect that nowadays some will even lie about how they voted. It's very frustrating.",46,1,Remain,Remain
24,1652090817770,09/05/2022 10:06:57,1652090975152,1,09/05/2022 11:09:35,87571,5,task-39lm,NA,21756052,6431990,NA,complete,NA,6278e74a52e0482b2c5e38c3,computer,Desktop or Laptop,Windows 10,Chrome 101.0.4951.54,1536x864,1519x754,NA,ITT Ratings,4,Remain,5,NA,NA,NA,ACCEPT,NA,NA,NA,NA,NA,NA,batch5_REM,batch5_REM,18,22,1,Screen 1,continueButton,response_rating_scale_likert_active,4239.9000000003725,NA,NA,Strongly Agree,1,0,1,0,NA,NA,NA,NA,1,statements,Trade deals keeping cost of living low,1,5/4/22,5/4/22,R_11Y0Ua8MWcGpcYP,YES,Remain (Against Brexit),Confident,NA,Somewhat Agree,NA,NA,NA,Somewhat Disagree,Somewhat Disagree,Somewhat Agree,NA,NA,NA,Somewhat Disagree,Somewhat Disagree,Disagree,Never,Rarely,30,Female,NA,"Postgraduate degree (MSc, MA, MPhil)",NA,43,3,Remain,Remain
25,1652090821269,09/05/2022 10:07:01,1652090978659,1,09/05/2022 11:09:38,87571,5,task-39lm,NA,21756052,6431990,NA,complete,NA,6278e74a52e0482b2c5e38c3,computer,Desktop or Laptop,Windows 10,Chrome 101.0.4951.54,1536x864,1519x754,NA,ITT Ratings,4,Remain,5,NA,NA,NA,ACCEPT,NA,NA,NA,NA,NA,NA,batch5_REM,batch5_REM,27,23,1,Screen 1,continueButton,response_rating_scale_likert_active,3499,NA,NA,Strongly Disagree,1,0,1,0,NA,NA,NA,NA,1,statements,I want the UK to be independent from other European countries. To determine its own rules and regulations.,1,5/4/22,5/4/22,R_1l0o1B0iCDpatcZ,YES,Remain (Against Brexit),Confident,NA,Somewhat Agree,NA,NA,NA,Neither Agree nor Disagree,Neither Agree nor Disagree,Somewhat Agree,NA,NA,NA,Neither Agree nor Disagree,Neither Agree nor Disagree,Neither Agree nor Disagree,A few times a year,Rarely,25,Female,NA,"Undergraduate degree (BSc, BA)",NA,44,3,Remain,Leave
26,1652090823700,09/05/2022 10:07:03,1652090981080,1,09/05/2022 11:09:41,87571,5,task-39lm,NA,21756052,6431990,NA,complete,NA,6278e74a52e0482b2c5e38c3,computer,Desktop or Laptop,Windows 10,Chrome 101.0.4951.54,1536x864,1519x754,NA,ITT Ratings,4,Remain,5,NA,NA,NA,ACCEPT,NA,NA,NA,NA,NA,NA,batch5_REM,batch5_REM,8,24,1,Screen 1,continueButton,response_rating_scale_likert_active,2414.800000000745,NA,NA,Strongly Disagree,1,0,1,0,NA,NA,NA,NA,1,statements,the cost of remaining in the eu,1,5/4/22,5/4/22,R_1DAOsFtxfbfUhGa,YES,Remain (Against Brexit),Confident,NA,Disagree,NA,NA,NA,Somewhat Agree,Neither Agree nor Disagree,Agree,NA,NA,NA,Neither Agree nor Disagree,Neither Agree nor Disagree,Neither Agree nor Disagree,A few times a year,Once or twice a year,48,Female,NA,"Undergraduate degree (BSc, BA)",NA,41,2,Remain,Leave
27,1652090826641,09/05/2022 10:07:06,1652090984014,1,09/05/2022 11:09:44,87571,5,task-39lm,NA,21756052,6431990,NA,complete,NA,6278e74a52e0482b2c5e38c3,computer,Desktop or Laptop,Windows 10,Chrome 101.0.4951.54,1536x864,1519x754,NA,ITT Ratings,4,Remain,5,NA,NA,NA,ACCEPT,NA,NA,NA,NA,NA,NA,batch5_REM,batch5_REM,63,25,1,Screen 1,continueButton,response_rating_scale_likert_active,2926,NA,NA,Somewhat Agree,1,0,1,0,NA,NA,NA,NA,1,statements,Having more say in economic affairs,1,5/4/22,5/4/22,R_D0RxpgPvJO2T9yF,YES,Remain (Against Brexit),Very confident,NA,Disagree,NA,NA,NA,Neither Agree nor Disagree,Neither Agree nor Disagree,Neither Agree nor Disagree,NA,NA,NA,Neither Agree nor Disagree,Neither Agree nor Disagree,Neither Agree nor Disagree,Rarely,Rarely,58,Female,NA,"Undergraduate degree (BSc, BA)",NA,50,3,Remain,Leave
28,1652090830289,09/05/2022 10:07:10,1652090987670,1,09/05/2022 11:09:47,87571,5,task-39lm,NA,21756052,6431990,NA,complete,NA,6278e74a52e0482b2c5e38c3,computer,Desktop or Laptop,Windows 10,Chrome 101.0.4951.54,1536x864,1519x754,NA,ITT Ratings,4,Remain,5,NA,NA,NA,ACCEPT,NA,NA,NA,NA,NA,NA,batch5_REM,batch5_REM,56,26,1,Screen 1,continueButton,response_rating_scale_likert_active,3648.599999999627,NA,NA,Strongly Disagree,1,0,1,0,NA,NA,NA,NA,1,statements,They want control of our laws to be managed from Westminster.,1,5/4/22,5/4/22,R_3meHA57NeKCm3q0,YES,Remain (Against Brexit),Very confident,NA,Disagree,NA,NA,NA,Somewhat Disagree,Disagree,Somewhat Agree,NA,NA,NA,Disagree,Disagree,Disagree,Rarely,Most months,40,Female,NA,"Undergraduate degree (BSc, BA)",NA,49,2,Remain,Leave
29,1652090833410,09/05/2022 10:07:13,1652090990787,1,09/05/2022 11:09:50,87571,5,task-39lm,NA,21756052,6431990,NA,complete,NA,6278e74a52e0482b2c5e38c3,computer,Desktop or Laptop,Windows 10,Chrome 101.0.4951.54,1536x864,1519x754,NA,ITT Ratings,4,Remain,5,NA,NA,NA,ACCEPT,NA,NA,NA,NA,NA,NA,batch5_REM,batch5_REM,16,27,1,Screen 1,continueButton,response_rating_scale_likert_active,3109.2999999988824,NA,NA,Agree,1,0,1,0,NA,NA,NA,NA,1,statements,"Security and ""having each others backs""",1,5/4/22,5/4/22,R_11Y0Ua8MWcGpcYP,YES,Remain (Against Brexit),Confident,NA,Somewhat Agree,NA,NA,NA,Somewhat Disagree,Somewhat Disagree,Somewhat Agree,NA,NA,NA,Somewhat Disagree,Somewhat Disagree,Disagree,Never,Rarely,30,Female,NA,"Postgraduate degree (MSc, MA, MPhil)",NA,43,1,Remain,Remain
30,1652090834580,09/05/2022 10:07:14,1652090991956,1,09/05/2022 11:09:51,87571,5,task-39lm,NA,21756052,6431990,NA,complete,NA,6278e74a52e0482b2c5e38c3,computer,Desktop or Laptop,Windows 10,Chrome 101.0.4951.54,1536x864,1519x754,NA,ITT Ratings,4,Remain,5,NA,NA,NA,ACCEPT,NA,NA,NA,NA,NA,NA,batch5_REM,batch5_REM,46,28,1,Screen 1,continueButton,response_rating_scale_likert_active,1162.2999999988824,NA,NA,Agree,1,0,1,0,NA,NA,NA,NA,1,statements,To maintain our European identity.,1,5/4/22,5/4/22,R_2YxoWL19PyHfcHi,YES,Remain (Against Brexit),Very confident,NA,Disagree,NA,NA,NA,Neither Agree nor Disagree,Somewhat Agree,Somewhat Agree,NA,NA,NA,Neither Agree nor Disagree,Disagree,Neither Agree nor Disagree,Once or twice a year,Once or twice a year,63,Male,NA,"Postgraduate degree (MSc, MA, MPhil)",None - thank you.,48,1,Remain,Remain
31,1652090837338,09/05/2022 10:07:17,1652090994712,1,09/05/2022 11:09:54,87571,5,task-39lm,NA,21756052,6431990,NA,complete,NA,6278e74a52e0482b2c5e38c3,computer,Desktop or Laptop,Windows 10,Chrome 101.0.4951.54,1536x864,1519x754,NA,ITT Ratings,4,Remain,5,NA,NA,NA,ACCEPT,NA,NA,NA,NA,NA,NA,batch5_REM,batch5_REM,57,29,1,Screen 1,continueButton,response_rating_scale_likert_active,2749.0999999996275,NA,NA,Strongly Disagree,1,0,1,0,NA,NA,NA,NA,1,statements,I'm sick of contributing to EU funds and would rather all money was spent at home.,1,5/4/22,5/4/22,R_3meHA57NeKCm3q0,YES,Remain (Against Brexit),Very confident,NA,Disagree,NA,NA,NA,Somewhat Disagree,Disagree,Somewhat Agree,NA,NA,NA,Disagree,Disagree,Disagree,Rarely,Most months,40,Female,NA,"Undergraduate degree (BSc, BA)",NA,49,3,Remain,Leave
32,1652090839153,09/05/2022 10:07:19,1652090996539,1,09/05/2022 11:09:56,87571,5,task-39lm,NA,21756052,6431990,NA,complete,NA,6278e74a52e0482b2c5e38c3,computer,Desktop or Laptop,Windows 10,Chrome 101.0.4951.54,1536x864,1519x754,NA,ITT Ratings,4,Remain,5,NA,NA,NA,ACCEPT,NA,NA,NA,NA,NA,NA,batch5_REM,batch5_REM,38,30,1,Screen 1,continueButton,response_rating_scale_likert_active,1820.9000000003723,NA,NA,Strongly Disagree,1,0,1,0,NA,NA,NA,NA,1,statements,to remove EU input from our legal system,1,5/4/22,5/4/22,R_2cnrY5mNhD3MwkK,YES,Remain (Against Brexit),Very confident,NA,Disagree,NA,NA,NA,Neither Agree nor Disagree,Agree,Somewhat Agree,NA,NA,NA,Somewhat Agree,Neither Agree nor Disagree,Somewhat Agree,Once or twice a year,A few times a year,27,Other,genderqueer,"Postgraduate degree (MSc, MA, MPhil)","after what has happened in the last few years, people who voted leave don't mention Brexit or the referendum at all. I suspect that nowadays some will even lie about how they voted. It's very frustrating.",46,2,Remain,Leave
33,1652090840840,09/05/2022 10:07:20,1652090998225,1,09/05/2022 11:09:58,87571,5,task-39lm,NA,21756052,6431990,NA,complete,NA,6278e74a52e0482b2c5e38c3,computer,Desktop or Laptop,Windows 10,Chrome 101.0.4951.54,1536x864,1519x754,NA,ITT Ratings,4,Remain,5,NA,NA,NA,ACCEPT,NA,NA,NA,NA,NA,NA,batch5_REM,batch5_REM,55,31,1,Screen 1,continueButton,response_rating_scale_likert_active,1679.7000000011176,NA,NA,Strongly Disagree,1,0,1,0,NA,NA,NA,NA,1,statements,I'm worried about immigration and the effect it has on UK resources.,1,5/4/22,5/4/22,R_3meHA57NeKCm3q0,YES,Remain (Against Brexit),Very confident,NA,Disagree,NA,NA,NA,Somewhat Disagree,Disagree,Somewhat Agree,NA,NA,NA,Disagree,Disagree,Disagree,Rarely,Most months,40,Female,NA,"Undergraduate degree (BSc, BA)",NA,49,1,Remain,Leave
34,1652090843116,09/05/2022 10:07:23,1652091000506,1,09/05/2022 11:10:00,87571,5,task-39lm,NA,21756052,6431990,NA,complete,NA,6278e74a52e0482b2c5e38c3,computer,Desktop or Laptop,Windows 10,Chrome 101.0.4951.54,1536x864,1519x754,NA,ITT Ratings,4,Remain,5,NA,NA,NA,ACCEPT,NA,NA,NA,NA,NA,NA,batch5_REM,batch5_REM,44,32,1,Screen 1,continueButton,response_rating_scale_likert_active,2274.0999999996275,NA,NA,Strongly Disagree,1,0,1,0,NA,NA,NA,NA,1,statements,More choice over our borders. Allowing less people to come into the country,1,5/4/22,5/4/22,R_5nkz1BlowolfJol,YES,Remain (Against Brexit),Undecided,NA,Disagree,NA,NA,NA,Strongly Disagree,Somewhat Agree,Somewhat Agree,NA,NA,NA,Strongly Disagree,Strongly Disagree,Strongly Disagree,Rarely,A few times a year,21,Female,NA,"Undergraduate degree (BSc, BA)",NA,47,2,Remain,Leave
35,1652090844646,09/05/2022 10:07:24,1652091002037,1,09/05/2022 11:10:02,87571,5,task-39lm,NA,21756052,6431990,NA,complete,NA,6278e74a52e0482b2c5e38c3,computer,Desktop or Laptop,Windows 10,Chrome 101.0.4951.54,1536x864,1519x754,NA,ITT Ratings,4,Remain,5,NA,NA,NA,ACCEPT,NA,NA,NA,NA,NA,NA,batch5_REM,batch5_REM,14,33,1,Screen 1,continueButton,response_rating_scale_likert_active,1523,NA,NA,Strongly Disagree,1,0,1,0,NA,NA,NA,NA,1,statements,I just wanted change,1,5/4/22,5/4/22,R_1cY2f8b495jEyst,YES,Remain (Against Brexit),Undecided,NA,Somewhat Agree,NA,NA,NA,Neither Agree nor Disagree,Neither Agree nor Disagree,Neither Agree nor Disagree,NA,NA,NA,Neither Agree nor Disagree,Neither Agree nor Disagree,Neither Agree nor Disagree,Never,Never,35,Female,NA,"Undergraduate degree (BSc, BA)",NA,42,2,Remain,Leave
36,1652090846325,09/05/2022 10:07:26,1652091003710,1,09/05/2022 11:10:03,87571,5,task-39lm,NA,21756052,6431990,NA,complete,NA,6278e74a52e0482b2c5e38c3,computer,Desktop or Laptop,Windows 10,Chrome 101.0.4951.54,1536x864,1519x754,NA,ITT Ratings,4,Remain,5,NA,NA,NA,ACCEPT,NA,NA,NA,NA,NA,NA,batch5_REM,batch5_REM,7,34,1,Screen 1,continueButton,response_rating_scale_likert_active,1666.2999999988824,NA,NA,Strongly Disagree,1,0,1,0,NA,NA,NA,NA,1,statements,to prevent immigrants coming and staying in the uk,1,5/4/22,5/4/22,R_1DAOsFtxfbfUhGa,YES,Remain (Against Brexit),Confident,NA,Disagree,NA,NA,NA,Somewhat Agree,Neither Agree nor Disagree,Agree,NA,NA,NA,Neither Agree nor Disagree,Neither Agree nor Disagree,Neither Agree nor Disagree,A few times a year,Once or twice a year,48,Female,NA,"Undergraduate degree (BSc, BA)",NA,41,1,Remain,Leave
37,1652090848934,09/05/2022 10:07:28,1652091006331,1,09/05/2022 11:10:06,87571,5,task-39lm,NA,21756052,6431990,NA,complete,NA,6278e74a52e0482b2c5e38c3,computer,Desktop or Laptop,Windows 10,Chrome 101.0.4951.54,1536x864,1519x754,NA,ITT Ratings,4,Remain,5,NA,NA,NA,ACCEPT,NA,NA,NA,NA,NA,NA,batch5_REM,batch5_REM,49,35,1,Screen 1,continueButton,response_rating_scale_likert_active,2614.7000000011176,NA,NA,Disagree,1,0,1,0,NA,NA,NA,NA,1,statements,To regain our pride and sovereignty.,1,5/4/22,5/4/22,R_2YxoWL19PyHfcHi,YES,Remain (Against Brexit),Very confident,NA,Disagree,NA,NA,NA,Neither Agree nor Disagree,Somewhat Agree,Somewhat Agree,NA,NA,NA,Neither Agree nor Disagree,Disagree,Neither Agree nor Disagree,Once or twice a year,Once or twice a year,63,Male,NA,"Postgraduate degree (MSc, MA, MPhil)",None - thank you.,48,1,Remain,Leave
38,1652090851107,09/05/2022 10:07:31,1652091008480,1,09/05/2022 11:10:08,87571,5,task-39lm,NA,21756052,6431990,NA,complete,NA,6278e74a52e0482b2c5e38c3,computer,Desktop or Laptop,Windows 10,Chrome 101.0.4951.54,1536x864,1519x754,NA,ITT Ratings,4,Remain,5,NA,NA,NA,ACCEPT,NA,NA,NA,NA,NA,NA,batch5_REM,batch5_REM,51,36,1,Screen 1,continueButton,response_rating_scale_likert_active,2143,NA,NA,Strongly Disagree,1,0,1,0,NA,NA,NA,NA,1,statements,To never again be subject to foreign policies and laws.,1,5/4/22,5/4/22,R_2YxoWL19PyHfcHi,YES,Remain (Against Brexit),Very confident,NA,Disagree,NA,NA,NA,Neither Agree nor Disagree,Somewhat Agree,Somewhat Agree,NA,NA,NA,Neither Agree nor Disagree,Disagree,Neither Agree nor Disagree,Once or twice a year,Once or twice a year,63,Male,NA,"Postgraduate degree (MSc, MA, MPhil)",None - thank you.,48,3,Remain,Leave
39,1652090852419,09/05/2022 10:07:32,1652091009805,1,09/05/2022 11:10:09,87571,5,task-39lm,NA,21756052,6431990,NA,complete,NA,6278e74a52e0482b2c5e38c3,computer,Desktop or Laptop,Windows 10,Chrome 101.0.4951.54,1536x864,1519x754,NA,ITT Ratings,4,Remain,5,NA,NA,NA,ACCEPT,NA,NA,NA,NA,NA,NA,batch5_REM,batch5_REM,9,37,1,Screen 1,continueButton,response_rating_scale_likert_active,1316.89999999851,NA,NA,Strongly Disagree,1,0,1,0,NA,NA,NA,NA,1,statements,we shouldnt be ruled by the eu,1,5/4/22,5/4/22,R_1DAOsFtxfbfUhGa,YES,Remain (Against Brexit),Confident,NA,Disagree,NA,NA,NA,Somewhat Agree,Neither Agree nor Disagree,Agree,NA,NA,NA,Neither Agree nor Disagree,Neither Agree nor Disagree,Neither Agree nor Disagree,A few times a year,Once or twice a year,48,Female,NA,"Undergraduate degree (BSc, BA)",NA,41,3,Remain,Leave
40,1652090855633,09/05/2022 10:07:35,1652091013015,1,09/05/2022 11:10:13,87571,5,task-39lm,NA,21756052,6431990,NA,complete,NA,6278e74a52e0482b2c5e38c3,computer,Desktop or Laptop,Windows 10,Chrome 101.0.4951.54,1536x864,1519x754,NA,ITT Ratings,4,Remain,5,NA,NA,NA,ACCEPT,NA,NA,NA,NA,NA,NA,batch5_REM,batch5_REM,28,38,1,Screen 1,continueButton,response_rating_scale_likert_active,3203.10000000149,NA,NA,Somewhat Disagree,1,0,1,0,NA,NA,NA,NA,1,statements,I did not want things to change,1,5/4/22,5/4/22,R_1etaBZleKRYNeVh,YES,Remain (Against Brexit),Confident,NA,Somewhat Disagree,NA,NA,NA,Somewhat Agree,Somewhat Agree,Somewhat Agree,NA,NA,NA,Neither Agree nor Disagree,Somewhat Agree,Neither Agree nor Disagree,Rarely,Rarely,28,Male,NA,"Postgraduate degree (MSc, MA, MPhil)",NA,45,1,Remain,Remain
41,1652090858794,09/05/2022 10:07:38,1652091016181,1,09/05/2022 11:10:16,87571,5,task-39lm,NA,21756052,6431990,NA,complete,NA,6278e74a52e0482b2c5e38c3,computer,Desktop or Laptop,Windows 10,Chrome 101.0.4951.54,1536x864,1519x754,NA,ITT Ratings,4,Remain,5,NA,NA,NA,ACCEPT,NA,NA,NA,NA,NA,NA,batch5_REM,batch5_REM,29,39,1,Screen 1,continueButton,response_rating_scale_likert_active,3158.300000000745,NA,NA,Agree,1,0,1,0,NA,NA,NA,NA,1,statements,I like the EU and want to continue being in it,1,5/4/22,5/4/22,R_1etaBZleKRYNeVh,YES,Remain (Against Brexit),Confident,NA,Somewhat Disagree,NA,NA,NA,Somewhat Agree,Somewhat Agree,Somewhat Agree,NA,NA,NA,Neither Agree nor Disagree,Somewhat Agree,Neither Agree nor Disagree,Rarely,Rarely,28,Male,NA,"Postgraduate degree (MSc, MA, MPhil)",NA,45,2,Remain,Remain
42,1652090861356,09/05/2022 10:07:41,1652091018733,1,09/05/2022 11:10:18,87571,5,task-39lm,NA,21756052,6431990,NA,complete,NA,6278e74a52e0482b2c5e38c3,computer,Desktop or Laptop,Windows 10,Chrome 101.0.4951.54,1536x864,1519x754,NA,ITT Ratings,4,Remain,5,NA,NA,NA,ACCEPT,NA,NA,NA,NA,NA,NA,batch5_REM,batch5_REM,42,40,1,Screen 1,continueButton,response_rating_scale_likert_active,2544.800000000745,NA,NA,Agree,1,0,1,0,NA,NA,NA,NA,1,statements,Supply chains are a lot easier. Much of our items are sourced from neighbouring European countries and we have made it harder for ourselves to get items over here.,1,5/4/22,5/4/22,R_5nkz1BlowolfJol,YES,Remain (Against Brexit),Undecided,NA,Disagree,NA,NA,NA,Strongly Disagree,Somewhat Agree,Somewhat Agree,NA,NA,NA,Strongly Disagree,Strongly Disagree,Strongly Disagree,Rarely,A few times a year,21,Female,NA,"Undergraduate degree (BSc, BA)",NA,47,3,Remain,Remain
