60,1652090000000,09/05/2022 09:58,1652090000000,1,09/05/2022 10:58,87571,5,task-ogmx,NA,21755147,6431651,NA,complete,NA,6278e40a803931d7cb9d7752,mobile,Google Pixel 3a,Android 12,Chrome 101.0.4951.41,950x463,902x383,NA,ITT Ratings,4,Remain,8,NA,NA,NA,NA,NA,NA,ACCEPT,NA,NA,NA,batch8__REM,batch8__REM,22,58,1,Screen 1,continueButton,response_rating_scale_likert_active,6191.1,NA,NA,Agree,1,0,1,0,NA,NA,NA,NA,1,statements,They want their children to keep the ability to work across the entire continent and study abroad under the erasmus scheme,1,05/04/2022,05/04/2022,R_2WHa0mJTUe9Z0c0,YES,Remain (Against Brexit),Very confident,NA,Somewhat Disagree,NA,NA,NA,Somewhat Disagree,Neither Agree nor Disagree,Neither Agree nor Disagree,NA,NA,NA,Disagree,Somewhat Disagree,Disagree,A few times a year,Most months,42,Female,NA,A levels,"Well phrased, your questions provide a nice separation between the personal and the reasoning",74,1,Remain,Remain
61,1652090000000,09/05/2022 09:58,1652090000000,1,09/05/2022 10:58,87571,5,task-ogmx,NA,21755147,6431651,NA,complete,NA,6278e40a803931d7cb9d7752,mobile,Google Pixel 3a,Android 12,Chrome 101.0.4951.41,950x463,902x383,NA,ITT Ratings,4,Remain,8,NA,NA,NA,NA,NA,NA,ACCEPT,NA,NA,NA,batch8__REM,batch8__REM,26,59,1,Screen 1,continueButton,response_rating_scale_likert_active,7118.6,NA,NA,Somewhat Agree,1,0,1,0,NA,NA,NA,NA,1,statements,"I have concerns about immigration, and believe that leaving will lead to less immigration",1,05/04/2022,05/04/2022,R_2WHa0mJTUe9Z0c0,YES,Remain (Against Brexit),Very confident,NA,Somewhat Disagree,NA,NA,NA,Somewhat Disagree,Neither Agree nor Disagree,Neither Agree nor Disagree,NA,NA,NA,Disagree,Somewhat Disagree,Disagree,A few times a year,Most months,42,Female,NA,A levels,"Well phrased, your questions provide a nice separation between the personal and the reasoning",74,2,Remain,Leave
62,1652090000000,09/05/2022 09:58,1652090000000,1,09/05/2022 10:58,87571,5,task-ogmx,NA,21755147,6431651,NA,complete,NA,6278e40a803931d7cb9d7752,mobile,Google Pixel 3a,Android 12,Chrome 101.0.4951.41,950x463,902x383,NA,ITT Ratings,4,Remain,8,NA,NA,NA,NA,NA,NA,ACCEPT,NA,NA,NA,batch8__REM,batch8__REM,28,60,1,Screen 1,continueButton,response_rating_scale_likert_active,2490.3,NA,NA,Somewhat Agree,1,0,1,0,NA,NA,NA,NA,1,statements,Maintain peace in Europe,1,05/04/2022,05/04/2022,R_2qf1Vgmjn4MWxT6,YES,Remain (Against Brexit),Very confident,NA,Strongly Disagree,NA,NA,NA,Disagree,Agree,Strongly Agree,NA,NA,NA,Strongly Agree,Strongly Agree,Neither Agree nor Disagree,A few times a year,A few times a year,42,Female,NA,"Postgraduate degree (MSc, MA, MPhil)",NA,75,1,Remain,Remain
63,1652090000000,09/05/2022 09:58,1652090000000,1,09/05/2022 10:58,87571,5,task-ogmx,NA,21755147,6431651,NA,complete,NA,6278e40a803931d7cb9d7752,mobile,Google Pixel 3a,Android 12,Chrome 101.0.4951.41,950x463,902x383,NA,ITT Ratings,4,Remain,8,NA,NA,NA,NA,NA,NA,ACCEPT,NA,NA,NA,batch8__REM,batch8__REM,29,61,1,Screen 1,continueButton,response_rating_scale_likert_active,4351.9,NA,NA,Strongly Agree,1,0,1,0,NA,NA,NA,NA,1,statements,Allow EU nationals to continue living in the UK,1,05/04/2022,05/04/2022,R_2qf1Vgmjn4MWxT6,YES,Remain (Against Brexit),Very confident,NA,Strongly Disagree,NA,NA,NA,Disagree,Agree,Strongly Agree,NA,NA,NA,Strongly Agree,Strongly Agree,Neither Agree nor Disagree,A few times a year,A few times a year,42,Female,NA,"Postgraduate degree (MSc, MA, MPhil)",NA,75,2,Remain,Remain
64,1652090000000,09/05/2022 09:58,1652090000000,1,09/05/2022 10:58,87571,5,task-ogmx,NA,21755147,6431651,NA,complete,NA,6278e40a803931d7cb9d7752,mobile,Google Pixel 3a,Android 12,Chrome 101.0.4951.41,950x463,902x383,NA,ITT Ratings,4,Remain,8,NA,NA,NA,NA,NA,NA,ACCEPT,NA,NA,NA,batch8__REM,batch8__REM,25,62,1,Screen 1,continueButton,response_rating_scale_likert_active,14241.7,NA,NA,Neither Agree nor Disagree,1,0,1,0,NA,NA,NA,NA,1,statements,"They value the idea that British laws are made only by British politicians in westminster, and distrust the European political system",1,05/04/2022,05/04/2022,R_2WHa0mJTUe9Z0c0,YES,Remain (Against Brexit),Very confident,NA,Somewhat Disagree,NA,NA,NA,Somewhat Disagree,Neither Agree nor Disagree,Neither Agree nor Disagree,NA,NA,NA,Disagree,Somewhat Disagree,Disagree,A few times a year,Most months,42,Female,NA,A levels,"Well phrased, your questions provide a nice separation between the personal and the reasoning",74,1,Remain,Leave
65,1652090000000,09/05/2022 09:58,1652090000000,1,09/05/2022 10:58,87571,5,task-ogmx,NA,21755147,6431651,NA,complete,NA,6278e40a803931d7cb9d7752,mobile,Google Pixel 3a,Android 12,Chrome 101.0.4951.41,950x463,902x383,NA,ITT Ratings,4,Remain,8,NA,NA,NA,NA,NA,NA,ACCEPT,NA,NA,NA,batch8__REM,NA,NA,END TASK,NA,NA,NA,NA,368233,NA,NA,NA,NA,0,1,0,NA,NA,NA,NA,NA,NA,NA,NA,NA,NA,NA,NA,NA,NA,NA,NA,NA,NA,NA,NA,NA,NA,NA,NA,NA,NA,NA,NA,NA,NA,NA,NA,NA,NA,NA,NA,NA,NA,NA
1,1652090000000,09/05/2022 09:53,1652090000000,1,09/05/2022 10:53,87571,5,task-ogmx,NA,21755211,6431687,NA,complete,NA,6278e46ba923a496f26aa8bf,computer,Desktop or Laptop,Mac OS 10.11.6,Chrome 100.0.4896.127,1280x800,1231x635,NA,ITT Ratings,4,Remain,8,NA,NA,NA,NA,NA,NA,ACCEPT,NA,NA,NA,batch8__REM,NA,NA,BEGIN TASK,NA,NA,NA,NA,NA,NA,NA,NA,NA,0,1,0,NA,NA,NA,NA,NA,NA,NA,NA,NA,NA,NA,NA,NA,NA,NA,NA,NA,NA,NA,NA,NA,NA,NA,NA,NA,NA,NA,NA,NA,NA,NA,NA,NA,NA,NA,NA,NA,NA,NA
2,1652090000000,09/05/2022 09:53,1652090000000,1,09/05/2022 10:53,87571,5,task-ogmx,NA,21755211,6431687,NA,complete,NA,6278e46ba923a496f26aa8bf,computer,Desktop or Laptop,Mac OS 10.11.6,Chrome 100.0.4896.127,1280x800,1231x635,NA,ITT Ratings,4,Remain,8,NA,NA,NA,NA,NA,NA,ACCEPT,NA,NA,NA,batch8__REM,batch8__REM,1,1,1,Screen 1,advancementZone,continue_button,5846.6,NA,NA,NA,NA,0,1,0,NA,NA,NA,NA,NA,instructions,NA,NA,NA,NA,NA,NA,NA,NA,NA,NA,NA,NA,NA,NA,NA,NA,NA,NA,NA,NA,NA,NA,NA,NA,NA,NA,NA,NA,NA,NA,NA,NA,NA
3,1652090000000,09/05/2022 09:53,1652090000000,1,09/05/2022 10:53,87571,5,task-ogmx,NA,21755211,6431687,NA,complete,NA,6278e46ba923a496f26aa8bf,computer,Desktop or Laptop,Mac OS 10.11.6,Chrome 100.0.4896.127,1280x800,1231x635,NA,ITT Ratings,4,Remain,8,NA,NA,NA,NA,NA,NA,ACCEPT,NA,NA,NA,batch8__REM,batch8__REM,47,1,1,Screen 1,continueButton,response_rating_scale_likert_active,6479.5,NA,NA,Somewhat Agree,1,0,1,0,NA,NA,NA,NA,1,statements,"Business and enterprise opportunity, trade flow, common regulations",1,05/04/2022,05/04/2022,R_1ODjpeXZT2x8dHs,YES,Remain (Against Brexit),Confident,NA,Agree,NA,NA,NA,Neither Agree nor Disagree,Neither Agree nor Disagree,Neither Agree nor Disagree,NA,NA,NA,Neither Agree nor Disagree,Neither Agree nor Disagree,Neither Agree nor Disagree,Rarely,Rarely,49,Other,I don't identify with a gender. I am female,"Undergraduate degree (BSc, BA)",NA,78,2,Remain,Remain
4,1652090000000,09/05/2022 09:53,1652090000000,1,09/05/2022 10:53,87571,5,task-ogmx,NA,21755211,6431687,NA,complete,NA,6278e46ba923a496f26aa8bf,computer,Desktop or Laptop,Mac OS 10.11.6,Chrome 100.0.4896.127,1280x800,1231x635,NA,ITT Ratings,4,Remain,8,NA,NA,NA,NA,NA,NA,ACCEPT,NA,NA,NA,batch8__REM,batch8__REM,41,2,1,Screen 1,continueButton,response_rating_scale_likert_active,5041,NA,NA,Agree,1,0,1,0,NA,NA,NA,NA,1,statements,better trade deals and easier travel,1,05/04/2022,05/04/2022,R_2SJ1sFgfejqsqiQ,YES,Remain (Against Brexit),Very confident,NA,Neither Agree nor Disagree,NA,NA,NA,Neither Agree nor Disagree,Neither Agree nor Disagree,Somewhat Agree,NA,NA,NA,Neither Agree nor Disagree,Neither Agree nor Disagree,Neither Agree nor Disagree,Rarely,Most months,57,Female,NA,Vocational Training / Apprenticeship,NA,77,2,Remain,Remain
5,1652090000000,09/05/2022 09:53,1652090000000,1,09/05/2022 10:53,87571,5,task-ogmx,NA,21755211,6431687,NA,complete,NA,6278e46ba923a496f26aa8bf,computer,Desktop or Laptop,Mac OS 10.11.6,Chrome 100.0.4896.127,1280x800,1231x635,NA,ITT Ratings,4,Remain,8,NA,NA,NA,NA,NA,NA,ACCEPT,NA,NA,NA,batch8__REM,batch8__REM,46,3,1,Screen 1,continueButton,response_rating_scale_likert_active,3409.8,NA,NA,Strongly Agree,1,0,1,0,NA,NA,NA,NA,1,statements,Strength of union - stronger together,1,05/04/2022,05/04/2022,R_1ODjpeXZT2x8dHs,YES,Remain (Against Brexit),Confident,NA,Agree,NA,NA,NA,Neither Agree nor Disagree,Neither Agree nor Disagree,Neither Agree nor Disagree,NA,NA,NA,Neither Agree nor Disagree,Neither Agree nor Disagree,Neither Agree nor Disagree,Rarely,Rarely,49,Other,I don't identify with a gender. I am female,"Undergraduate degree (BSc, BA)",NA,78,1,Remain,Remain
6,1652090000000,09/05/2022 09:53,1652090000000,1,09/05/2022 10:53,87571,5,task-ogmx,NA,21755211,6431687,NA,complete,NA,6278e46ba923a496f26aa8bf,computer,Desktop or Laptop,Mac OS 10.11.6,Chrome 100.0.4896.127,1280x800,1231x635,NA,ITT Ratings,4,Remain,8,NA,NA,NA,NA,NA,NA,ACCEPT,NA,NA,NA,batch8__REM,batch8__REM,35,4,1,Screen 1,continueButton,response_rating_scale_likert_active,1563.1,NA,NA,Strongly Agree,1,0,1,0,NA,NA,NA,NA,1,statements,easy travel within europe,1,05/04/2022,05/04/2022,R_3hxZbOmrVJWCEp1,YES,Remain (Against Brexit),Confident,NA,Somewhat Disagree,NA,NA,NA,Disagree,Disagree,Somewhat Disagree,NA,NA,NA,Disagree,Disagree,Disagree,Rarely,A few times a year,60,Male,NA,Doctorate (PhD),NA,76,2,Remain,Remain
7,1652090000000,09/05/2022 09:53,1652090000000,1,09/05/2022 10:53,87571,5,task-ogmx,NA,21755211,6431687,NA,complete,NA,6278e46ba923a496f26aa8bf,computer,Desktop or Laptop,Mac OS 10.11.6,Chrome 100.0.4896.127,1280x800,1231x635,NA,ITT Ratings,4,Remain,8,NA,NA,NA,NA,NA,NA,ACCEPT,NA,NA,NA,batch8__REM,batch8__REM,14,5,1,Screen 1,continueButton,response_rating_scale_likert_active,3890.1,NA,NA,Neither Agree nor Disagree,1,0,1,0,NA,NA,NA,NA,1,statements,They think that it would reduce the number of people moving to the UK.,1,05/04/2022,05/04/2022,R_SWeN7xPGVK3qNEt,YES,Remain (Against Brexit),Confident,NA,Neither Agree nor Disagree,NA,NA,NA,Disagree,Disagree,Disagree,NA,NA,NA,Disagree,Disagree,Disagree,Rarely,Rarely,32,Female,NA,"Postgraduate degree (MSc, MA, MPhil)","Perhaps have a reference to time on the questions about how much you talk about it/read about it - for instance, since COVID it has not really been on my radar, whereas around the referendum it was more on my mind/part of discussions.",72,2,Remain,Leave
8,1652090000000,09/05/2022 09:53,1652090000000,1,09/05/2022 10:53,87571,5,task-ogmx,NA,21755211,6431687,NA,complete,NA,6278e46ba923a496f26aa8bf,computer,Desktop or Laptop,Mac OS 10.11.6,Chrome 100.0.4896.127,1280x800,1231x635,NA,ITT Ratings,4,Remain,8,NA,NA,NA,NA,NA,NA,ACCEPT,NA,NA,NA,batch8__REM,batch8__REM,43,6,1,Screen 1,continueButton,response_rating_scale_likert_active,4032.2,NA,NA,Somewhat Agree,1,0,1,0,NA,NA,NA,NA,1,statements,to stop immigration into UK,1,05/04/2022,05/04/2022,R_2SJ1sFgfejqsqiQ,YES,Remain (Against Brexit),Very confident,NA,Neither Agree nor Disagree,NA,NA,NA,Neither Agree nor Disagree,Neither Agree nor Disagree,Somewhat Agree,NA,NA,NA,Neither Agree nor Disagree,Neither Agree nor Disagree,Neither Agree nor Disagree,Rarely,Most months,57,Female,NA,Vocational Training / Apprenticeship,NA,77,1,Remain,Leave
9,1652090000000,09/05/2022 09:53,1652090000000,1,09/05/2022 10:53,87571,5,task-ogmx,NA,21755211,6431687,NA,complete,NA,6278e46ba923a496f26aa8bf,computer,Desktop or Laptop,Mac OS 10.11.6,Chrome 100.0.4896.127,1280x800,1231x635,NA,ITT Ratings,4,Remain,8,NA,NA,NA,NA,NA,NA,ACCEPT,NA,NA,NA,batch8__REM,batch8__REM,28,7,1,Screen 1,continueButton,response_rating_scale_likert_active,2183.9,NA,NA,Agree,1,0,1,0,NA,NA,NA,NA,1,statements,Maintain peace in Europe,1,05/04/2022,05/04/2022,R_2qf1Vgmjn4MWxT6,YES,Remain (Against Brexit),Very confident,NA,Strongly Disagree,NA,NA,NA,Disagree,Agree,Strongly Agree,NA,NA,NA,Strongly Agree,Strongly Agree,Neither Agree nor Disagree,A few times a year,A few times a year,42,Female,NA,"Postgraduate degree (MSc, MA, MPhil)",NA,75,1,Remain,Remain
10,1652090000000,09/05/2022 09:53,1652090000000,1,09/05/2022 10:53,87571,5,task-ogmx,NA,21755211,6431687,NA,complete,NA,6278e46ba923a496f26aa8bf,computer,Desktop or Laptop,Mac OS 10.11.6,Chrome 100.0.4896.127,1280x800,1231x635,NA,ITT Ratings,4,Remain,8,NA,NA,NA,NA,NA,NA,ACCEPT,NA,NA,NA,batch8__REM,batch8__REM,21,8,1,Screen 1,continueButton,response_rating_scale_likert_active,2474.9,NA,NA,Disagree,1,0,1,0,NA,NA,NA,NA,1,statements,We will have more freedom away from EU laws.,1,05/04/2022,05/04/2022,R_1dzzVp5jsORg8gm,YES,Remain (Against Brexit),Very confident,NA,Disagree,NA,NA,NA,Somewhat Agree,Neither Agree nor Disagree,Somewhat Agree,NA,NA,NA,Somewhat Agree,Somewhat Agree,Somewhat Agree,Most weeks,Most months,56,Female,NA,"Undergraduate degree (BSc, BA)",NA,73,3,Remain,Leave
11,1652090000000,09/05/2022 09:53,1652090000000,1,09/05/2022 10:53,87571,5,task-ogmx,NA,21755211,6431687,NA,complete,NA,6278e46ba923a496f26aa8bf,computer,Desktop or Laptop,Mac OS 10.11.6,Chrome 100.0.4896.127,1280x800,1231x635,NA,ITT Ratings,4,Remain,8,NA,NA,NA,NA,NA,NA,ACCEPT,NA,NA,NA,batch8__REM,batch8__REM,2,9,1,Screen 1,continueButton,response_rating_scale_likert_active,2071.7,NA,NA,Somewhat Agree,1,0,1,0,NA,NA,NA,NA,1,statements,We would like to check you are reading each argument carefully. Please select 'Somewhat Agree' for this answer,1,NA,NA,NA,NA,NA,NA,NA,NA,NA,NA,NA,NA,NA,NA,NA,NA,NA,NA,NA,NA,NA,NA,NA,NA,NA,NA,NA,NA,check1,NA,NA
12,1652090000000,09/05/2022 09:53,1652090000000,1,09/05/2022 10:53,87571,5,task-ogmx,NA,21755211,6431687,NA,complete,NA,6278e46ba923a496f26aa8bf,computer,Desktop or Laptop,Mac OS 10.11.6,Chrome 100.0.4896.127,1280x800,1231x635,NA,ITT Ratings,4,Remain,8,NA,NA,NA,NA,NA,NA,ACCEPT,NA,NA,NA,batch8__REM,batch8__REM,17,10,1,Screen 1,continueButton,response_rating_scale_likert_active,3252.7,NA,NA,Strongly Agree,1,0,1,0,NA,NA,NA,NA,1,statements,European Union rules are better thought out and considered and therefore benefit us as a whole.,1,05/04/2022,05/04/2022,R_1dzzVp5jsORg8gm,YES,Remain (Against Brexit),Very confident,NA,Disagree,NA,NA,NA,Somewhat Agree,Neither Agree nor Disagree,Somewhat Agree,NA,NA,NA,Somewhat Agree,Somewhat Agree,Somewhat Agree,Most weeks,Most months,56,Female,NA,"Undergraduate degree (BSc, BA)",NA,73,2,Remain,Remain
13,1652090000000,09/05/2022 09:53,1652090000000,1,09/05/2022 10:53,87571,5,task-ogmx,NA,21755211,6431687,NA,complete,NA,6278e46ba923a496f26aa8bf,computer,Desktop or Laptop,Mac OS 10.11.6,Chrome 100.0.4896.127,1280x800,1231x635,NA,ITT Ratings,4,Remain,8,NA,NA,NA,NA,NA,NA,ACCEPT,NA,NA,NA,batch8__REM,batch8__REM,56,11,1,Screen 1,continueButton,response_rating_scale_likert_active,1810,NA,NA,Disagree,1,0,1,0,NA,NA,NA,NA,1,statements,we are strong enough on our own,1,05/04/2022,05/04/2022,R_3Rz6L8l6KvNvrbT,YES,Remain (Against Brexit),Confident,NA,Somewhat Agree,NA,NA,NA,Disagree,Somewhat Disagree,Somewhat Disagree,NA,NA,NA,Neither Agree nor Disagree,Somewhat Disagree,Neither Agree nor Disagree,Most months,A few times a year,NA,Female,NA,"Undergraduate degree (BSc, BA)",NA,79,2,Remain,Leave
14,1652090000000,09/05/2022 09:53,1652090000000,1,09/05/2022 10:53,87571,5,task-ogmx,NA,21755211,6431687,NA,complete,NA,6278e46ba923a496f26aa8bf,computer,Desktop or Laptop,Mac OS 10.11.6,Chrome 100.0.4896.127,1280x800,1231x635,NA,ITT Ratings,4,Remain,8,NA,NA,NA,NA,NA,NA,ACCEPT,NA,NA,NA,batch8__REM,batch8__REM,49,12,1,Screen 1,continueButton,response_rating_scale_likert_active,2099.5,NA,NA,Disagree,1,0,1,0,NA,NA,NA,NA,1,statements,Look after and prioritise own interests,1,05/04/2022,05/04/2022,R_1ODjpeXZT2x8dHs,YES,Remain (Against Brexit),Confident,NA,Agree,NA,NA,NA,Neither Agree nor Disagree,Neither Agree nor Disagree,Neither Agree nor Disagree,NA,NA,NA,Neither Agree nor Disagree,Neither Agree nor Disagree,Neither Agree nor Disagree,Rarely,Rarely,49,Other,I don't identify with a gender. I am female,"Undergraduate degree (BSc, BA)",NA,78,1,Remain,Leave
15,1652090000000,09/05/2022 09:53,1652090000000,1,09/05/2022 10:53,87571,5,task-ogmx,NA,21755211,6431687,NA,complete,NA,6278e46ba923a496f26aa8bf,computer,Desktop or Laptop,Mac OS 10.11.6,Chrome 100.0.4896.127,1280x800,1231x635,NA,ITT Ratings,4,Remain,8,NA,NA,NA,NA,NA,NA,ACCEPT,NA,NA,NA,batch8__REM,batch8__REM,25,13,1,Screen 1,continueButton,response_rating_scale_likert_active,5755,NA,NA,Somewhat Agree,1,0,1,0,NA,NA,NA,NA,1,statements,"They value the idea that British laws are made only by British politicians in westminster, and distrust the European political system",1,05/04/2022,05/04/2022,R_2WHa0mJTUe9Z0c0,YES,Remain (Against Brexit),Very confident,NA,Somewhat Disagree,NA,NA,NA,Somewhat Disagree,Neither Agree nor Disagree,Neither Agree nor Disagree,NA,NA,NA,Disagree,Somewhat Disagree,Disagree,A few times a year,Most months,42,Female,NA,A levels,"Well phrased, your questions provide a nice separation between the personal and the reasoning",74,1,Remain,Leave
16,1652090000000,09/05/2022 09:53,1652090000000,1,09/05/2022 10:53,87571,5,task-ogmx,NA,21755211,6431687,NA,complete,NA,6278e46ba923a496f26aa8bf,computer,Desktop or Laptop,Mac OS 10.11.6,Chrome 100.0.4896.127,1280x800,1231x635,NA,ITT Ratings,4,Remain,8,NA,NA,NA,NA,NA,NA,ACCEPT,NA,NA,NA,batch8__REM,batch8__REM,11,14,1,Screen 1,continueButton,response_rating_scale_likert_active,2644.5,NA,NA,Disagree,1,0,1,0,NA,NA,NA,NA,1,statements,Being outward-looking rather than insular.,1,05/04/2022,05/04/2022,R_SWeN7xPGVK3qNEt,YES,Remain (Against Brexit),Confident,NA,Neither Agree nor Disagree,NA,NA,NA,Disagree,Disagree,Disagree,NA,NA,NA,Disagree,Disagree,Disagree,Rarely,Rarely,32,Female,NA,"Postgraduate degree (MSc, MA, MPhil)","Perhaps have a reference to time on the questions about how much you talk about it/read about it - for instance, since COVID it has not really been on my radar, whereas around the referendum it was more on my mind/part of discussions.",72,2,Remain,Remain
17,1652090000000,09/05/2022 09:54,1652090000000,1,09/05/2022 10:54,87571,5,task-ogmx,NA,21755211,6431687,NA,complete,NA,6278e46ba923a496f26aa8bf,computer,Desktop or Laptop,Mac OS 10.11.6,Chrome 100.0.4896.127,1280x800,1231x635,NA,ITT Ratings,4,Remain,8,NA,NA,NA,NA,NA,NA,ACCEPT,NA,NA,NA,batch8__REM,batch8__REM,8,15,1,Screen 1,continueButton,response_rating_scale_likert_active,2253.4,NA,NA,Neither Agree nor Disagree,1,0,1,0,NA,NA,NA,NA,1,statements,Get the foreigners out!,1,05/04/2022,05/04/2022,R_3O1GYbeNCWPy6RT,YES,Remain (Against Brexit),Very confident,NA,Strongly Disagree,NA,NA,NA,Somewhat Disagree,Neither Agree nor Disagree,Somewhat Agree,NA,NA,NA,Somewhat Disagree,Somewhat Disagree,Somewhat Agree,Once or twice a year,Most months,35,Female,NA,"Undergraduate degree (BSc, BA)",NA,71,2,Remain,Leave
18,1652090000000,09/05/2022 09:54,1652090000000,1,09/05/2022 10:54,87571,5,task-ogmx,NA,21755211,6431687,NA,complete,NA,6278e46ba923a496f26aa8bf,computer,Desktop or Laptop,Mac OS 10.11.6,Chrome 100.0.4896.127,1280x800,1231x635,NA,ITT Ratings,4,Remain,8,NA,NA,NA,NA,NA,NA,ACCEPT,NA,NA,NA,batch8__REM,batch8__REM,45,16,1,Screen 1,continueButton,response_rating_scale_likert_active,2235.1,NA,NA,Neither Agree nor Disagree,1,0,1,0,NA,NA,NA,NA,1,statements,to spend money on the NHS,1,05/04/2022,05/04/2022,R_2SJ1sFgfejqsqiQ,YES,Remain (Against Brexit),Very confident,NA,Neither Agree nor Disagree,NA,NA,NA,Neither Agree nor Disagree,Neither Agree nor Disagree,Somewhat Agree,NA,NA,NA,Neither Agree nor Disagree,Neither Agree nor Disagree,Neither Agree nor Disagree,Rarely,Most months,57,Female,NA,Vocational Training / Apprenticeship,NA,77,3,Remain,Leave
19,1652090000000,09/05/2022 09:54,1652090000000,1,09/05/2022 10:54,87571,5,task-ogmx,NA,21755211,6431687,NA,complete,NA,6278e46ba923a496f26aa8bf,computer,Desktop or Laptop,Mac OS 10.11.6,Chrome 100.0.4896.127,1280x800,1231x635,NA,ITT Ratings,4,Remain,8,NA,NA,NA,NA,NA,NA,ACCEPT,NA,NA,NA,batch8__REM,batch8__REM,42,17,1,Screen 1,continueButton,response_rating_scale_likert_active,1711,NA,NA,Strongly Agree,1,0,1,0,NA,NA,NA,NA,1,statements,support from allies when needed,1,05/04/2022,05/04/2022,R_2SJ1sFgfejqsqiQ,YES,Remain (Against Brexit),Very confident,NA,Neither Agree nor Disagree,NA,NA,NA,Neither Agree nor Disagree,Neither Agree nor Disagree,Somewhat Agree,NA,NA,NA,Neither Agree nor Disagree,Neither Agree nor Disagree,Neither Agree nor Disagree,Rarely,Most months,57,Female,NA,Vocational Training / Apprenticeship,NA,77,3,Remain,Remain
20,1652090000000,09/05/2022 09:54,1652090000000,1,09/05/2022 10:54,87571,5,task-ogmx,NA,21755211,6431687,NA,complete,NA,6278e46ba923a496f26aa8bf,computer,Desktop or Laptop,Mac OS 10.11.6,Chrome 100.0.4896.127,1280x800,1231x635,NA,ITT Ratings,4,Remain,8,NA,NA,NA,NA,NA,NA,ACCEPT,NA,NA,NA,batch8__REM,batch8__REM,26,18,1,Screen 1,continueButton,response_rating_scale_likert_active,4151.4,NA,NA,Strongly Disagree,1,0,1,0,NA,NA,NA,NA,1,statements,"I have concerns about immigration, and believe that leaving will lead to less immigration",1,05/04/2022,05/04/2022,R_2WHa0mJTUe9Z0c0,YES,Remain (Against Brexit),Very confident,NA,Somewhat Disagree,NA,NA,NA,Somewhat Disagree,Neither Agree nor Disagree,Neither Agree nor Disagree,NA,NA,NA,Disagree,Somewhat Disagree,Disagree,A few times a year,Most months,42,Female,NA,A levels,"Well phrased, your questions provide a nice separation between the personal and the reasoning",74,2,Remain,Leave
21,1652090000000,09/05/2022 09:54,1652090000000,1,09/05/2022 10:54,87571,5,task-ogmx,NA,21755211,6431687,NA,complete,NA,6278e46ba923a496f26aa8bf,computer,Desktop or Laptop,Mac OS 10.11.6,Chrome 100.0.4896.127,1280x800,1231x635,NA,ITT Ratings,4,Remain,8,NA,NA,NA,NA,NA,NA,ACCEPT,NA,NA,NA,batch8__REM,batch8__REM,13,19,1,Screen 1,continueButton,response_rating_scale_likert_active,3854.1,NA,NA,Somewhat Disagree,1,0,1,0,NA,NA,NA,NA,1,statements,"They think it would make the UK more independent, or regain power.",1,05/04/2022,05/04/2022,R_SWeN7xPGVK3qNEt,YES,Remain (Against Brexit),Confident,NA,Neither Agree nor Disagree,NA,NA,NA,Disagree,Disagree,Disagree,NA,NA,NA,Disagree,Disagree,Disagree,Rarely,Rarely,32,Female,NA,"Postgraduate degree (MSc, MA, MPhil)","Perhaps have a reference to time on the questions about how much you talk about it/read about it - for instance, since COVID it has not really been on my radar, whereas around the referendum it was more on my mind/part of discussions.",72,1,Remain,Leave
22,1652090000000,09/05/2022 09:54,1652090000000,1,09/05/2022 10:54,87571,5,task-ogmx,NA,21755211,6431687,NA,complete,NA,6278e46ba923a496f26aa8bf,computer,Desktop or Laptop,Mac OS 10.11.6,Chrome 100.0.4896.127,1280x800,1231x635,NA,ITT Ratings,4,Remain,8,NA,NA,NA,NA,NA,NA,ACCEPT,NA,NA,NA,batch8__REM,batch8__REM,10,20,1,Screen 1,continueButton,response_rating_scale_likert_active,3217.9,NA,NA,Strongly Agree,1,0,1,0,NA,NA,NA,NA,1,statements,"Free movement between countries, including being able to work and live there.",1,05/04/2022,05/04/2022,R_SWeN7xPGVK3qNEt,YES,Remain (Against Brexit),Confident,NA,Neither Agree nor Disagree,NA,NA,NA,Disagree,Disagree,Disagree,NA,NA,NA,Disagree,Disagree,Disagree,Rarely,Rarely,32,Female,NA,"Postgraduate degree (MSc, MA, MPhil)","Perhaps have a reference to time on the questions about how much you talk about it/read about it - for instance, since COVID it has not really been on my radar, whereas around the referendum it was more on my mind/part of discussions.",72,1,Remain,Remain
23,1652090000000,09/05/2022 09:54,1652090000000,1,09/05/2022 10:54,87571,5,task-ogmx,NA,21755211,6431687,NA,complete,NA,6278e46ba923a496f26aa8bf,computer,Desktop or Laptop,Mac OS 10.11.6,Chrome 100.0.4896.127,1280x800,1231x635,NA,ITT Ratings,4,Remain,8,NA,NA,NA,NA,NA,NA,ACCEPT,NA,NA,NA,batch8__REM,batch8__REM,34,21,1,Screen 1,continueButton,response_rating_scale_likert_active,2274.7,NA,NA,Somewhat Agree,1,0,1,0,NA,NA,NA,NA,1,statements,continuation of free trade,1,05/04/2022,05/04/2022,R_3hxZbOmrVJWCEp1,YES,Remain (Against Brexit),Confident,NA,Somewhat Disagree,NA,NA,NA,Disagree,Disagree,Somewhat Disagree,NA,NA,NA,Disagree,Disagree,Disagree,Rarely,A few times a year,60,Male,NA,Doctorate (PhD),NA,76,1,Remain,Remain
24,1652090000000,09/05/2022 09:54,1652090000000,1,09/05/2022 10:54,87571,5,task-ogmx,NA,21755211,6431687,NA,complete,NA,6278e46ba923a496f26aa8bf,computer,Desktop or Laptop,Mac OS 10.11.6,Chrome 100.0.4896.127,1280x800,1231x635,NA,ITT Ratings,4,Remain,8,NA,NA,NA,NA,NA,NA,ACCEPT,NA,NA,NA,batch8__REM,batch8__REM,32,22,1,Screen 1,continueButton,response_rating_scale_likert_active,2901.7,NA,NA,Strongly Disagree,1,0,1,0,NA,NA,NA,NA,1,statements,Not liking it when people speak languages other than English in the UK,1,05/04/2022,05/04/2022,R_2qf1Vgmjn4MWxT6,YES,Remain (Against Brexit),Very confident,NA,Strongly Disagree,NA,NA,NA,Disagree,Agree,Strongly Agree,NA,NA,NA,Strongly Agree,Strongly Agree,Neither Agree nor Disagree,A few times a year,A few times a year,42,Female,NA,"Postgraduate degree (MSc, MA, MPhil)",NA,75,2,Remain,Leave
25,1652090000000,09/05/2022 09:54,1652090000000,1,09/05/2022 10:54,87571,5,task-ogmx,NA,21755211,6431687,NA,complete,NA,6278e46ba923a496f26aa8bf,computer,Desktop or Laptop,Mac OS 10.11.6,Chrome 100.0.4896.127,1280x800,1231x635,NA,ITT Ratings,4,Remain,8,NA,NA,NA,NA,NA,NA,ACCEPT,NA,NA,NA,batch8__REM,batch8__REM,38,23,1,Screen 1,continueButton,response_rating_scale_likert_active,4223.7,NA,NA,Disagree,1,0,1,0,NA,NA,NA,NA,1,statements,pay less to european union,1,05/04/2022,05/04/2022,R_3hxZbOmrVJWCEp1,YES,Remain (Against Brexit),Confident,NA,Somewhat Disagree,NA,NA,NA,Disagree,Disagree,Somewhat Disagree,NA,NA,NA,Disagree,Disagree,Disagree,Rarely,A few times a year,60,Male,NA,Doctorate (PhD),NA,76,2,Remain,Leave
