62,1651854963585,06/05/2022 16:36:03,1651854962790,1,06/05/2022 17:36:02,87571,2,task-l3ey,NA,21720067,6421629,NA,complete,NA,62754d4de7c8cc24a7fc5fc3,computer,Desktop or Laptop,Windows 10,Edge 101.0.1210.32,1231x692,1172x622,NA,ITT Ratings,3,Leave,10,NA,NA,NA,NA,NA,NA,NA,NA,ACCEPT,NA,batch10_REM,batch10_REM,55,60,1,Screen 1,continueButton,response_rating_scale_likert_active,3749.199999999255,NA,NA,Neither Agree nor Disagree,1,0,1,0,NA,NA,NA,NA,1,statements,They're taking our jobs,1,5/4/22,5/4/22,R_3090zRXcgf2gFrE,YES,Remain (Against Brexit),Very confident,NA,Disagree,NA,NA,NA,Disagree,Agree,Agree,NA,NA,NA,Neither Agree nor Disagree,Neither Agree nor Disagree,Neither Agree nor Disagree,Rarely,A few times a year,30,Male,NA,"GCSEs,Vocational Training / Apprenticeship",NA,99,1,Remain,Leave
63,1651854967454,06/05/2022 16:36:07,1651854966666,1,06/05/2022 17:36:06,87571,2,task-l3ey,NA,21720067,6421629,NA,complete,NA,62754d4de7c8cc24a7fc5fc3,computer,Desktop or Laptop,Windows 10,Edge 101.0.1210.32,1231x692,1172x622,NA,ITT Ratings,3,Leave,10,NA,NA,NA,NA,NA,NA,NA,NA,ACCEPT,NA,batch10_REM,batch10_REM,12,61,1,Screen 1,continueButton,response_rating_scale_likert_active,3856.599999997765,NA,NA,Disagree,1,0,1,0,NA,NA,NA,NA,1,statements,"Trading with the EU has been to our benefit, to cut ourselves off from that is going to hurt us and our economy.",1,5/4/22,5/4/22,R_28CdLh75b5SHpU6,YES,Remain (Against Brexit),Very confident,NA,Strongly Disagree,NA,NA,NA,Agree,Somewhat Agree,Agree,NA,NA,NA,Neither Agree nor Disagree,Somewhat Agree,Neither Agree nor Disagree,Rarely,A few times a year,29,Female,NA,A levels,NA,92,3,Remain,Remain
64,1651854970875,06/05/2022 16:36:10,1651854970067,1,06/05/2022 17:36:10,87571,2,task-l3ey,NA,21720067,6421629,NA,complete,NA,62754d4de7c8cc24a7fc5fc3,computer,Desktop or Laptop,Windows 10,Edge 101.0.1210.32,1231x692,1172x622,NA,ITT Ratings,3,Leave,10,NA,NA,NA,NA,NA,NA,NA,NA,ACCEPT,NA,batch10_REM,batch10_REM,57,62,1,Screen 1,continueButton,response_rating_scale_likert_active,3383,NA,NA,Somewhat Disagree,1,0,1,0,NA,NA,NA,NA,1,statements,i dont like immigrants,1,5/4/22,5/4/22,R_3090zRXcgf2gFrE,YES,Remain (Against Brexit),Very confident,NA,Disagree,NA,NA,NA,Disagree,Agree,Agree,NA,NA,NA,Neither Agree nor Disagree,Neither Agree nor Disagree,Neither Agree nor Disagree,Rarely,A few times a year,30,Male,NA,"GCSEs,Vocational Training / Apprenticeship",NA,99,3,Remain,Leave
65,1651854970955,06/05/2022 16:36:10,1651854970077,1,06/05/2022 17:36:10,87571,2,task-l3ey,NA,21720067,6421629,NA,complete,NA,62754d4de7c8cc24a7fc5fc3,computer,Desktop or Laptop,Windows 10,Edge 101.0.1210.32,1231x692,1172x622,NA,ITT Ratings,3,Leave,10,NA,NA,NA,NA,NA,NA,NA,NA,ACCEPT,NA,batch10_REM,NA,NA,END TASK,NA,NA,NA,NA,264809,NA,NA,NA,NA,0,1,0,NA,NA,NA,NA,NA,NA,NA,NA,NA,NA,NA,NA,NA,NA,NA,NA,NA,NA,NA,NA,NA,NA,NA,NA,NA,NA,NA,NA,NA,NA,NA,NA,NA,NA,NA,NA,NA,NA,NA
1,1651854759988,06/05/2022 16:32:39,1651854759547,1,06/05/2022 17:32:39,87571,2,task-l3ey,NA,21720112,6421640,NA,complete,NA,62754d5827a54c0ff193ac0e,computer,Desktop or Laptop,Windows 10,Edge 101.0.1210.32,1536x864,1536x746,NA,ITT Ratings,3,Leave,10,NA,NA,NA,NA,NA,NA,NA,NA,ACCEPT,NA,batch10_REM,NA,NA,BEGIN TASK,NA,NA,NA,NA,NA,NA,NA,NA,NA,0,1,0,NA,NA,NA,NA,NA,NA,NA,NA,NA,NA,NA,NA,NA,NA,NA,NA,NA,NA,NA,NA,NA,NA,NA,NA,NA,NA,NA,NA,NA,NA,NA,NA,NA,NA,NA,NA,NA,NA,NA
2,1651854762709,06/05/2022 16:32:42,1651854762333,1,06/05/2022 17:32:42,87571,2,task-l3ey,NA,21720112,6421640,NA,complete,NA,62754d5827a54c0ff193ac0e,computer,Desktop or Laptop,Windows 10,Edge 101.0.1210.32,1536x864,1519x746,NA,ITT Ratings,3,Leave,10,NA,NA,NA,NA,NA,NA,NA,NA,ACCEPT,NA,batch10_REM,batch10_REM,1,1,1,Screen 1,advancementZone,continue_button,2744.800000190735,NA,NA,NA,NA,0,1,0,NA,NA,NA,NA,NA,instructions,NA,NA,NA,NA,NA,NA,NA,NA,NA,NA,NA,NA,NA,NA,NA,NA,NA,NA,NA,NA,NA,NA,NA,NA,NA,NA,NA,NA,NA,NA,NA,NA,NA
3,1651854774845,06/05/2022 16:32:54,1651854774469,1,06/05/2022 17:32:54,87571,2,task-l3ey,NA,21720112,6421640,NA,complete,NA,62754d5827a54c0ff193ac0e,computer,Desktop or Laptop,Windows 10,Edge 101.0.1210.32,1536x864,1519x746,NA,ITT Ratings,3,Leave,10,NA,NA,NA,NA,NA,NA,NA,NA,ACCEPT,NA,batch10_REM,batch10_REM,62,1,1,Screen 1,continueButton,response_rating_scale_likert_active,12114.599999904633,NA,NA,Agree,1,0,1,0,NA,NA,NA,NA,1,statements,So that the country doesn't have to follow EU rules and regulations,1,5/4/22,5/4/22,R_2A126Q1TOCo5HJ5,YES,Remain (Against Brexit),Very confident,NA,Somewhat Agree,NA,NA,NA,Disagree,Somewhat Agree,Somewhat Disagree,NA,NA,NA,Somewhat Disagree,Somewhat Disagree,Somewhat Agree,Rarely,Once or twice a year,32,Female,NA,"Postgraduate degree (MSc, MA, MPhil)",NA,100,2,Remain,Leave
4,1651854778879,06/05/2022 16:32:58,1651854778504,1,06/05/2022 17:32:58,87571,2,task-l3ey,NA,21720112,6421640,NA,complete,NA,62754d5827a54c0ff193ac0e,computer,Desktop or Laptop,Windows 10,Edge 101.0.1210.32,1536x864,1519x746,NA,ITT Ratings,3,Leave,10,NA,NA,NA,NA,NA,NA,NA,NA,ACCEPT,NA,batch10_REM,batch10_REM,55,2,1,Screen 1,continueButton,response_rating_scale_likert_active,4006.299999952316,NA,NA,Agree,1,0,1,0,NA,NA,NA,NA,1,statements,They're taking our jobs,1,5/4/22,5/4/22,R_3090zRXcgf2gFrE,YES,Remain (Against Brexit),Very confident,NA,Disagree,NA,NA,NA,Disagree,Agree,Agree,NA,NA,NA,Neither Agree nor Disagree,Neither Agree nor Disagree,Neither Agree nor Disagree,Rarely,A few times a year,30,Male,NA,"GCSEs,Vocational Training / Apprenticeship",NA,99,1,Remain,Leave
5,1651854782645,06/05/2022 16:33:02,1651854782255,1,06/05/2022 17:33:02,87571,2,task-l3ey,NA,21720112,6421640,NA,complete,NA,62754d5827a54c0ff193ac0e,computer,Desktop or Laptop,Windows 10,Edge 101.0.1210.32,1536x864,1519x746,NA,ITT Ratings,3,Leave,10,NA,NA,NA,NA,NA,NA,NA,NA,ACCEPT,NA,batch10_REM,batch10_REM,58,3,1,Screen 1,continueButton,response_rating_scale_likert_active,3736.400000095367,NA,NA,Disagree,1,0,1,0,NA,NA,NA,NA,1,statements,More safety in the eu,1,5/4/22,5/4/22,R_2A126Q1TOCo5HJ5,YES,Remain (Against Brexit),Very confident,NA,Somewhat Agree,NA,NA,NA,Disagree,Somewhat Agree,Somewhat Disagree,NA,NA,NA,Somewhat Disagree,Somewhat Disagree,Somewhat Agree,Rarely,Once or twice a year,32,Female,NA,"Postgraduate degree (MSc, MA, MPhil)",NA,100,1,Remain,Remain
6,1651854820395,06/05/2022 16:33:40,1651854820012,1,06/05/2022 17:33:40,87571,2,task-l3ey,NA,21720112,6421640,NA,complete,NA,62754d5827a54c0ff193ac0e,computer,Desktop or Laptop,Windows 10,Edge 101.0.1210.32,1536x864,1519x746,NA,ITT Ratings,3,Leave,10,NA,NA,NA,NA,NA,NA,NA,NA,ACCEPT,NA,batch10_REM,batch10_REM,4,4,1,Screen 1,continueButton,response_rating_scale_likert_active,37741.39999985695,NA,NA,Agree,1,0,1,0,NA,NA,NA,NA,1,statements,economic benefits such as trade.,1,5/4/22,5/4/22,R_2rDDppxPgHGQAEp,YES,Remain (Against Brexit),Very confident,NA,Disagree,NA,NA,NA,Somewhat Agree,Neither Agree nor Disagree,Somewhat Agree,NA,NA,NA,Neither Agree nor Disagree,Neither Agree nor Disagree,Neither Agree nor Disagree,Rarely,Rarely,31,Female,NA,"Undergraduate degree (BSc, BA)",NA,91,1,Remain,Remain
7,1651854894336,06/05/2022 16:34:54,1651854893966,1,06/05/2022 17:34:53,87571,2,task-l3ey,NA,21720112,6421640,NA,complete,NA,62754d5827a54c0ff193ac0e,computer,Desktop or Laptop,Windows 10,Edge 101.0.1210.32,1536x864,1519x746,NA,ITT Ratings,3,Leave,10,NA,NA,NA,NA,NA,NA,NA,NA,ACCEPT,NA,batch10_REM,batch10_REM,16,5,1,Screen 1,continueButton,response_rating_scale_likert_active,73924.79999995232,NA,NA,Agree,1,0,1,0,NA,NA,NA,NA,1,statements,Easier trading with our closest geographic neighbours.,1,5/4/22,5/4/22,R_3PBMe3j9V4zzDzA,YES,Remain (Against Brexit),Very confident,NA,Somewhat Agree,NA,NA,NA,Disagree,Somewhat Disagree,Somewhat Disagree,NA,NA,NA,Strongly Disagree,Strongly Disagree,Strongly Disagree,Rarely,A few times a year,58,Female,NA,"Undergraduate degree (BSc, BA)",No specific feedback except that I wish we hadn't left but I also wish the dialogue between the two sides was less bitter.,93,1,Remain,Remain
8,1651854897239,06/05/2022 16:34:57,1651854896863,1,06/05/2022 17:34:56,87571,2,task-l3ey,NA,21720112,6421640,NA,complete,NA,62754d5827a54c0ff193ac0e,computer,Desktop or Laptop,Windows 10,Edge 101.0.1210.32,1536x864,1519x746,NA,ITT Ratings,3,Leave,10,NA,NA,NA,NA,NA,NA,NA,NA,ACCEPT,NA,batch10_REM,batch10_REM,43,6,1,Screen 1,continueButton,response_rating_scale_likert_active,2882,NA,NA,Disagree,1,0,1,0,NA,NA,NA,NA,1,statements,Immigration is out of control,1,5/4/22,5/4/22,R_2978MEunsk8Bqb7,YES,Remain (Against Brexit),Confident,NA,Disagree,NA,NA,NA,Disagree,Disagree,Disagree,NA,NA,NA,Disagree,Disagree,Disagree,Never,Most months,64,Female,NA,"Undergraduate degree (BSc, BA)",N/A,97,1,Remain,Leave
9,1651854903759,06/05/2022 16:35:03,1651854903377,1,06/05/2022 17:35:03,87571,2,task-l3ey,NA,21720112,6421640,NA,complete,NA,62754d5827a54c0ff193ac0e,computer,Desktop or Laptop,Windows 10,Edge 101.0.1210.32,1536x864,1519x746,NA,ITT Ratings,3,Leave,10,NA,NA,NA,NA,NA,NA,NA,NA,ACCEPT,NA,batch10_REM,batch10_REM,36,7,1,Screen 1,continueButton,response_rating_scale_likert_active,6496.700000047684,NA,NA,Agree,1,0,1,0,NA,NA,NA,NA,1,statements,"The arguments put forward by the Leave campaign (e.g. the hateful and inaccurate ""LOOK AT ALL THESE SCARY IMMIGRANTS"" posters) were so awful that, frankly, opposing them felt right in itself.",1,5/4/22,5/4/22,R_32VBarFINVzl5jr,YES,Remain (Against Brexit),Very confident,NA,Disagree,NA,NA,NA,Neither Agree nor Disagree,Neither Agree nor Disagree,Somewhat Agree,NA,NA,NA,Neither Agree nor Disagree,Neither Agree nor Disagree,Neither Agree nor Disagree,Once or twice a year,A few times a year,31,Female,NA,"Undergraduate degree (BSc, BA)",NA,96,3,Remain,Remain
10,1651854905742,06/05/2022 16:35:05,1651854905372,1,06/05/2022 17:35:05,87571,2,task-l3ey,NA,21720112,6421640,NA,complete,NA,62754d5827a54c0ff193ac0e,computer,Desktop or Laptop,Windows 10,Edge 101.0.1210.32,1536x864,1519x746,NA,ITT Ratings,3,Leave,10,NA,NA,NA,NA,NA,NA,NA,NA,ACCEPT,NA,batch10_REM,batch10_REM,9,8,1,Screen 1,continueButton,response_rating_scale_likert_active,1981.3000001907349,NA,NA,Agree,1,0,1,0,NA,NA,NA,NA,1,statements,Economic control over country's finances and jobs,1,5/4/22,5/4/22,R_2rDDppxPgHGQAEp,YES,Remain (Against Brexit),Very confident,NA,Disagree,NA,NA,NA,Somewhat Agree,Neither Agree nor Disagree,Somewhat Agree,NA,NA,NA,Neither Agree nor Disagree,Neither Agree nor Disagree,Neither Agree nor Disagree,Rarely,Rarely,31,Female,NA,"Undergraduate degree (BSc, BA)",NA,91,3,Remain,Leave
11,1651854911640,06/05/2022 16:35:11,1651854911277,1,06/05/2022 17:35:11,87571,2,task-l3ey,NA,21720112,6421640,NA,complete,NA,62754d5827a54c0ff193ac0e,computer,Desktop or Laptop,Windows 10,Edge 101.0.1210.32,1536x864,1519x746,NA,ITT Ratings,3,Leave,10,NA,NA,NA,NA,NA,NA,NA,NA,ACCEPT,NA,batch10_REM,batch10_REM,42,9,1,Screen 1,continueButton,response_rating_scale_likert_active,5836.299999952316,NA,NA,Agree,1,0,1,0,NA,NA,NA,NA,1,statements,"You now have to join huge queues at border control at city airports, as you have to go in the ‘rest of the world’ section and not the short European queue.",1,5/4/22,5/4/22,R_2978MEunsk8Bqb7,YES,Remain (Against Brexit),Confident,NA,Disagree,NA,NA,NA,Disagree,Disagree,Disagree,NA,NA,NA,Disagree,Disagree,Disagree,Never,Most months,64,Female,NA,"Undergraduate degree (BSc, BA)",N/A,97,3,Remain,Remain
12,1651854939962,06/05/2022 16:35:39,1651854939349,1,06/05/2022 17:35:39,87571,2,task-l3ey,NA,21720112,6421640,NA,complete,NA,62754d5827a54c0ff193ac0e,computer,Desktop or Laptop,Windows 10,Edge 101.0.1210.32,1536x864,1519x746,NA,ITT Ratings,3,Leave,10,NA,NA,NA,NA,NA,NA,NA,NA,ACCEPT,NA,batch10_REM,batch10_REM,24,10,1,Screen 1,continueButton,response_rating_scale_likert_active,28054.599999904633,NA,NA,Agree,1,0,1,0,NA,NA,NA,NA,1,statements,We have more in common culturally with our EU neighbours than that which divides us,1,5/4/22,5/4/22,R_2cc4hvh2YdbJwRo,YES,Remain (Against Brexit),Confident,NA,Agree,NA,NA,NA,Disagree,Disagree,Disagree,NA,NA,NA,Disagree,Disagree,Disagree,Most weeks,Most weeks,54,Female,NA,"Undergraduate degree (BSc, BA)","I think that some of the answers on offer were a little simplistic. For example, I don't characterise a leave voter as ignorant just because they have a different persepective from me. I appreciate that they may have different concerns. I welcome their freedom to have a different opinion and however much I may disagree with it, I think categorizing either side as somehow more ignorant than one's own, is dangerous because it doesn't leave much room for healthy respectful debate. It is only by being open to the opposing view that we can really heal our differences. None of which lessens the fact that I enjoyed this study very much, thank you!",94,3,Remain,Remain
13,1651854941150,06/05/2022 16:35:41,1651854940776,1,06/05/2022 17:35:40,87571,2,task-l3ey,NA,21720112,6421640,NA,complete,NA,62754d5827a54c0ff193ac0e,computer,Desktop or Laptop,Windows 10,Edge 101.0.1210.32,1536x864,1519x746,NA,ITT Ratings,3,Leave,10,NA,NA,NA,NA,NA,NA,NA,NA,ACCEPT,NA,batch10_REM,batch10_REM,48,11,1,Screen 1,continueButton,response_rating_scale_likert_active,1412.5,NA,NA,Agree,1,0,1,0,NA,NA,NA,NA,1,statements,I don't like change,1,5/4/22,5/4/22,R_DkFtm34BTsS10dP,YES,Remain (Against Brexit),Confident,NA,Somewhat Agree,NA,NA,NA,Somewhat Disagree,Somewhat Disagree,Somewhat Agree,NA,NA,NA,Neither Agree nor Disagree,Somewhat Agree,Somewhat Disagree,A few times a year,Once or twice a year,25,Female,NA,"Postgraduate degree (MSc, MA, MPhil)",NA,98,3,Remain,Remain
14,1651854952853,06/05/2022 16:35:52,1651854952483,1,06/05/2022 17:35:52,87571,2,task-l3ey,NA,21720112,6421640,NA,complete,NA,62754d5827a54c0ff193ac0e,computer,Desktop or Laptop,Windows 10,Edge 101.0.1210.32,1536x864,1519x746,NA,ITT Ratings,3,Leave,10,NA,NA,NA,NA,NA,NA,NA,NA,ACCEPT,NA,batch10_REM,batch10_REM,15,12,1,Screen 1,continueButton,response_rating_scale_likert_active,11692.099999904633,NA,NA,Agree,1,0,1,0,NA,NA,NA,NA,1,statements,Control of our own democracy and laws for ourselves instead of having to listen to the EU.,1,5/4/22,5/4/22,R_28CdLh75b5SHpU6,YES,Remain (Against Brexit),Very confident,NA,Strongly Disagree,NA,NA,NA,Agree,Somewhat Agree,Agree,NA,NA,NA,Neither Agree nor Disagree,Somewhat Agree,Neither Agree nor Disagree,Rarely,A few times a year,29,Female,NA,A levels,NA,92,3,Remain,Leave
15,1651854954170,06/05/2022 16:35:54,1651854953797,1,06/05/2022 17:35:53,87571,2,task-l3ey,NA,21720112,6421640,NA,complete,NA,62754d5827a54c0ff193ac0e,computer,Desktop or Laptop,Windows 10,Edge 101.0.1210.32,1536x864,1519x746,NA,ITT Ratings,3,Leave,10,NA,NA,NA,NA,NA,NA,NA,NA,ACCEPT,NA,batch10_REM,batch10_REM,31,13,1,Screen 1,continueButton,response_rating_scale_likert_active,1298.8999998569489,NA,NA,Agree,1,0,1,0,NA,NA,NA,NA,1,statements,No trade bureaucracy,1,5/4/22,5/4/22,R_1FzudSUEz3wVbYB,YES,Remain (Against Brexit),Somewhat Confident,NA,Neither Agree nor Disagree,NA,NA,NA,Neither Agree nor Disagree,Neither Agree nor Disagree,Somewhat Agree,NA,NA,NA,Somewhat Agree,Somewhat Disagree,Neither Agree nor Disagree,Never,Once or twice a year,39,Female,NA,"Undergraduate degree (BSc, BA)",NA,95,1,Remain,Leave
16,1651854960881,06/05/2022 16:36:00,1651854960511,1,06/05/2022 17:36:00,87571,2,task-l3ey,NA,21720112,6421640,NA,complete,NA,62754d5827a54c0ff193ac0e,computer,Desktop or Laptop,Windows 10,Edge 101.0.1210.32,1536x864,1519x746,NA,ITT Ratings,3,Leave,10,NA,NA,NA,NA,NA,NA,NA,NA,ACCEPT,NA,batch10_REM,batch10_REM,38,14,1,Screen 1,continueButton,response_rating_scale_likert_active,6699.400000095367,NA,NA,Agree,1,0,1,0,NA,NA,NA,NA,1,statements,I fear the effects of immigration (or immigrants themselves) and think leaving the EU will slow or prevent immigration.,1,5/4/22,5/4/22,R_32VBarFINVzl5jr,YES,Remain (Against Brexit),Very confident,NA,Disagree,NA,NA,NA,Neither Agree nor Disagree,Neither Agree nor Disagree,Somewhat Agree,NA,NA,NA,Neither Agree nor Disagree,Neither Agree nor Disagree,Neither Agree nor Disagree,Once or twice a year,A few times a year,31,Female,NA,"Undergraduate degree (BSc, BA)",NA,96,2,Remain,Leave
17,1651854968341,06/05/2022 16:36:08,1651854967966,1,06/05/2022 17:36:07,87571,2,task-l3ey,NA,21720112,6421640,NA,complete,NA,62754d5827a54c0ff193ac0e,computer,Desktop or Laptop,Windows 10,Edge 101.0.1210.32,1536x864,1519x746,NA,ITT Ratings,3,Leave,10,NA,NA,NA,NA,NA,NA,NA,NA,ACCEPT,NA,batch10_REM,batch10_REM,37,15,1,Screen 1,continueButton,response_rating_scale_likert_active,7439.899999856949,NA,NA,Agree,1,0,1,0,NA,NA,NA,NA,1,statements,"I value ""British identity"" and consider membership of the EU to be incompatible with that.",1,5/4/22,5/4/22,R_32VBarFINVzl5jr,YES,Remain (Against Brexit),Very confident,NA,Disagree,NA,NA,NA,Neither Agree nor Disagree,Neither Agree nor Disagree,Somewhat Agree,NA,NA,NA,Neither Agree nor Disagree,Neither Agree nor Disagree,Neither Agree nor Disagree,Once or twice a year,A few times a year,31,Female,NA,"Undergraduate degree (BSc, BA)",NA,96,1,Remain,Leave
18,1651854972472,06/05/2022 16:36:12,1651854972107,1,06/05/2022 17:36:12,87571,2,task-l3ey,NA,21720112,6421640,NA,complete,NA,62754d5827a54c0ff193ac0e,computer,Desktop or Laptop,Windows 10,Edge 101.0.1210.32,1536x864,1519x746,NA,ITT Ratings,3,Leave,10,NA,NA,NA,NA,NA,NA,NA,NA,ACCEPT,NA,batch10_REM,batch10_REM,5,16,1,Screen 1,continueButton,response_rating_scale_likert_active,4124.899999856949,NA,NA,Agree,1,0,1,0,NA,NA,NA,NA,1,statements,Freedom of movement between European countries and immigration,1,5/4/22,5/4/22,R_2rDDppxPgHGQAEp,YES,Remain (Against Brexit),Very confident,NA,Disagree,NA,NA,NA,Somewhat Agree,Neither Agree nor Disagree,Somewhat Agree,NA,NA,NA,Neither Agree nor Disagree,Neither Agree nor Disagree,Neither Agree nor Disagree,Rarely,Rarely,31,Female,NA,"Undergraduate degree (BSc, BA)",NA,91,2,Remain,Remain
19,1651854974848,06/05/2022 16:36:14,1651854974487,1,06/05/2022 17:36:14,87571,2,task-l3ey,NA,21720112,6421640,NA,complete,NA,62754d5827a54c0ff193ac0e,computer,Desktop or Laptop,Windows 10,Edge 101.0.1210.32,1536x864,1519x746,NA,ITT Ratings,3,Leave,10,NA,NA,NA,NA,NA,NA,NA,NA,ACCEPT,NA,batch10_REM,batch10_REM,6,17,1,Screen 1,continueButton,response_rating_scale_likert_active,2362.600000143051,NA,NA,Agree,1,0,1,0,NA,NA,NA,NA,1,statements,International influence and political sway,1,5/4/22,5/4/22,R_2rDDppxPgHGQAEp,YES,Remain (Against Brexit),Very confident,NA,Disagree,NA,NA,NA,Somewhat Agree,Neither Agree nor Disagree,Somewhat Agree,NA,NA,NA,Neither Agree nor Disagree,Neither Agree nor Disagree,Neither Agree nor Disagree,Rarely,Rarely,31,Female,NA,"Undergraduate degree (BSc, BA)",NA,91,3,Remain,Remain
20,1651854983665,06/05/2022 16:36:23,1651854983297,1,06/05/2022 17:36:23,87571,2,task-l3ey,NA,21720112,6421640,NA,complete,NA,62754d5827a54c0ff193ac0e,computer,Desktop or Laptop,Windows 10,Edge 101.0.1210.32,1536x864,1519x746,NA,ITT Ratings,3,Leave,10,NA,NA,NA,NA,NA,NA,NA,NA,ACCEPT,NA,batch10_REM,batch10_REM,19,18,1,Screen 1,continueButton,response_rating_scale_likert_active,8796.5,NA,NA,Agree,1,0,1,0,NA,NA,NA,NA,1,statements,Sovereignty. Certain media and politicians have been telling us all for years that Brussels is trying to lord it over us and deprive us of our sovereignty.,1,5/4/22,5/4/22,R_3PBMe3j9V4zzDzA,YES,Remain (Against Brexit),Very confident,NA,Somewhat Agree,NA,NA,NA,Disagree,Somewhat Disagree,Somewhat Disagree,NA,NA,NA,Strongly Disagree,Strongly Disagree,Strongly Disagree,Rarely,A few times a year,58,Female,NA,"Undergraduate degree (BSc, BA)",No specific feedback except that I wish we hadn't left but I also wish the dialogue between the two sides was less bitter.,93,1,Remain,Leave
21,1651854988758,06/05/2022 16:36:28,1651854988391,1,06/05/2022 17:36:28,87571,2,task-l3ey,NA,21720112,6421640,NA,complete,NA,62754d5827a54c0ff193ac0e,computer,Desktop or Laptop,Windows 10,Edge 101.0.1210.32,1536x864,1519x746,NA,ITT Ratings,3,Leave,10,NA,NA,NA,NA,NA,NA,NA,NA,ACCEPT,NA,batch10_REM,batch10_REM,50,19,1,Screen 1,continueButton,response_rating_scale_likert_active,5077,NA,NA,Agree,1,0,1,0,NA,NA,NA,NA,1,statements,we would be better off financially if we didn't have to pay money to other countries.,1,5/4/22,5/4/22,R_DkFtm34BTsS10dP,YES,Remain (Against Brexit),Confident,NA,Somewhat Agree,NA,NA,NA,Somewhat Disagree,Somewhat Disagree,Somewhat Agree,NA,NA,NA,Neither Agree nor Disagree,Somewhat Agree,Somewhat Disagree,A few times a year,Once or twice a year,25,Female,NA,"Postgraduate degree (MSc, MA, MPhil)",NA,98,2,Remain,Leave
22,1651854991018,06/05/2022 16:36:31,1651854990656,1,06/05/2022 17:36:30,87571,2,task-l3ey,NA,21720112,6421640,NA,complete,NA,62754d5827a54c0ff193ac0e,computer,Desktop or Laptop,Windows 10,Edge 101.0.1210.32,1536x864,1519x746,NA,ITT Ratings,3,Leave,10,NA,NA,NA,NA,NA,NA,NA,NA,ACCEPT,NA,batch10_REM,batch10_REM,28,20,1,Screen 1,continueButton,response_rating_scale_likert_active,2254.400000095367,NA,NA,Agree,1,0,1,0,NA,NA,NA,NA,1,statements,UK's borrowing would increase,1,5/4/22,5/4/22,R_1FzudSUEz3wVbYB,YES,Remain (Against Brexit),Somewhat Confident,NA,Neither Agree nor Disagree,NA,NA,NA,Neither Agree nor Disagree,Neither Agree nor Disagree,Somewhat Agree,NA,NA,NA,Somewhat Agree,Somewhat Disagree,Neither Agree nor Disagree,Never,Once or twice a year,39,Female,NA,"Undergraduate degree (BSc, BA)",NA,95,1,Remain,Remain
23,1651854994505,06/05/2022 16:36:34,1651854994136,1,06/05/2022 17:36:34,87571,2,task-l3ey,NA,21720112,6421640,NA,complete,NA,62754d5827a54c0ff193ac0e,computer,Desktop or Laptop,Windows 10,Edge 101.0.1210.32,1536x864,1519x746,NA,ITT Ratings,3,Leave,10,NA,NA,NA,NA,NA,NA,NA,NA,ACCEPT,NA,batch10_REM,batch10_REM,11,21,1,Screen 1,continueButton,response_rating_scale_likert_active,3463.7000000476837,NA,NA,Agree,1,0,1,0,NA,NA,NA,NA,1,statements,"EU regulations are some of the best in the world, especially their human rights. It would be a shame to lose this for the UK.",1,5/4/22,5/4/22,R_28CdLh75b5SHpU6,YES,Remain (Against Brexit),Very confident,NA,Strongly Disagree,NA,NA,NA,Agree,Somewhat Agree,Agree,NA,NA,NA,Neither Agree nor Disagree,Somewhat Agree,Neither Agree nor Disagree,Rarely,A few times a year,29,Female,NA,A levels,NA,92,2,Remain,Remain
24,1651855000348,06/05/2022 16:36:40,1651854999981,1,06/05/2022 17:36:39,87571,2,task-l3ey,NA,21720112,6421640,NA,complete,NA,62754d5827a54c0ff193ac0e,computer,Desktop or Laptop,Windows 10,Edge 101.0.1210.32,1536x864,1519x746,NA,ITT Ratings,3,Leave,10,NA,NA,NA,NA,NA,NA,NA,NA,ACCEPT,NA,batch10_REM,batch10_REM,34,22,1,Screen 1,continueButton,response_rating_scale_likert_active,5831.599999904633,NA,NA,Agree,1,0,1,0,NA,NA,NA,NA,1,statements,Being part of the EU had more benefits than costs for the UK,1,5/4/22,5/4/22,R_32VBarFINVzl5jr,YES,Remain (Against Brexit),Very confident,NA,Disagree,NA,NA,NA,Neither Agree nor Disagree,Neither Agree nor Disagree,Somewhat Agree,NA,NA,NA,Neither Agree nor Disagree,Neither Agree nor Disagree,Neither Agree nor Disagree,Once or twice a year,A few times a year,31,Female,NA,"Undergraduate degree (BSc, BA)",NA,96,1,Remain,Remain
25,1651855003119,06/05/2022 16:36:43,1651855002753,1,06/05/2022 17:36:42,87571,2,task-l3ey,NA,21720112,6421640,NA,complete,NA,62754d5827a54c0ff193ac0e,computer,Desktop or Laptop,Windows 10,Edge 101.0.1210.32,1536x864,1519x746,NA,ITT Ratings,3,Leave,10,NA,NA,NA,NA,NA,NA,NA,NA,ACCEPT,NA,batch10_REM,batch10_REM,32,23,1,Screen 1,continueButton,response_rating_scale_likert_active,2758.399999856949,NA,NA,Agree,1,0,1,0,NA,NA,NA,NA,1,statements,The uk will take back control of fisheries,1,5/4/22,5/4/22,R_1FzudSUEz3wVbYB,YES,Remain (Against Brexit),Somewhat Confident,NA,Neither Agree nor Disagree,NA,NA,NA,Neither Agree nor Disagree,Neither Agree nor Disagree,Somewhat Agree,NA,NA,NA,Somewhat Agree,Somewhat Disagree,Neither Agree nor Disagree,Never,Once or twice a year,39,Female,NA,"Undergraduate degree (BSc, BA)",NA,95,2,Remain,Leave
26,1651855013954,06/05/2022 16:36:53,1651855013589,1,06/05/2022 17:36:53,87571,2,task-l3ey,NA,21720112,6421640,NA,complete,NA,62754d5827a54c0ff193ac0e,computer,Desktop or Laptop,Windows 10,Edge 101.0.1210.32,1536x864,1519x746,NA,ITT Ratings,3,Leave,10,NA,NA,NA,NA,NA,NA,NA,NA,ACCEPT,NA,batch10_REM,batch10_REM,52,24,1,Screen 1,continueButton,response_rating_scale_likert_active,10822.400000095367,NA,NA,Agree,1,0,1,0,NA,NA,NA,NA,1,statements,Being an extension of countries where citizens can freely relocate and work,1,5/4/22,5/4/22,R_3090zRXcgf2gFrE,YES,Remain (Against Brexit),Very confident,NA,Disagree,NA,NA,NA,Disagree,Agree,Agree,NA,NA,NA,Neither Agree nor Disagree,Neither Agree nor Disagree,Neither Agree nor Disagree,Rarely,A few times a year,30,Male,NA,"GCSEs,Vocational Training / Apprenticeship",NA,99,1,Remain,Remain
27,1651855015215,06/05/2022 16:36:55,1651855014846,1,06/05/2022 17:36:54,87571,2,task-l3ey,NA,21720112,6421640,NA,complete,NA,62754d5827a54c0ff193ac0e,computer,Desktop or Laptop,Windows 10,Edge 101.0.1210.32,1536x864,1519x746,NA,ITT Ratings,3,Leave,10,NA,NA,NA,NA,NA,NA,NA,NA,ACCEPT,NA,batch10_REM,batch10_REM,59,25,1,Screen 1,continueButton,response_rating_scale_likert_active,1239.7999999523165,NA,NA,Agree,1,0,1,0,NA,NA,NA,NA,1,statements,Protect peace in Northern Ireland,1,5/4/22,5/4/22,R_2A126Q1TOCo5HJ5,YES,Remain (Against Brexit),Very confident,NA,Somewhat Agree,NA,NA,NA,Disagree,Somewhat Agree,Somewhat Disagree,NA,NA,NA,Somewhat Disagree,Somewhat Disagree,Somewhat Agree,Rarely,Once or twice a year,32,Female,NA,"Postgraduate degree (MSc, MA, MPhil)",NA,100,2,Remain,Remain
