45,1651854322283,06/05/2022 16:25:22,1651854323579,1,06/05/2022 17:25:23,87571,2,task-l3ey,NA,21719568,6421486,NA,complete,NA,62754a30927bfb14ec4bcaef,computer,Desktop or Laptop,Windows 10,Chrome 101.0.4951.54,1280x720,1280x577,NA,ITT Ratings,3,Leave,10,NA,NA,NA,NA,NA,NA,NA,NA,ACCEPT,NA,batch10_REM,batch10_REM,28,43,1,Screen 1,continueButton,response_rating_scale_likert_active,5961.099999904633,NA,NA,Somewhat Disagree,1,0,1,0,NA,NA,NA,NA,1,statements,UK's borrowing would increase,1,5/4/22,5/4/22,R_1FzudSUEz3wVbYB,YES,Remain (Against Brexit),Somewhat Confident,NA,Neither Agree nor Disagree,NA,NA,NA,Neither Agree nor Disagree,Neither Agree nor Disagree,Somewhat Agree,NA,NA,NA,Somewhat Agree,Somewhat Disagree,Neither Agree nor Disagree,Never,Once or twice a year,39,Female,NA,"Undergraduate degree (BSc, BA)",NA,95,1,Remain,Remain
46,1651854326121,06/05/2022 16:25:26,1651854327365,1,06/05/2022 17:25:27,87571,2,task-l3ey,NA,21719568,6421486,NA,complete,NA,62754a30927bfb14ec4bcaef,computer,Desktop or Laptop,Windows 10,Chrome 101.0.4951.54,1280x720,1280x577,NA,ITT Ratings,3,Leave,10,NA,NA,NA,NA,NA,NA,NA,NA,ACCEPT,NA,batch10_REM,batch10_REM,18,44,1,Screen 1,continueButton,response_rating_scale_likert_active,3750.099999904633,NA,NA,Strongly Disagree,1,0,1,0,NA,NA,NA,NA,1,statements,We are stronger as part of a larger community. On our own we are small and now rather pathetic.,1,5/4/22,5/4/22,R_3PBMe3j9V4zzDzA,YES,Remain (Against Brexit),Very confident,NA,Somewhat Agree,NA,NA,NA,Disagree,Somewhat Disagree,Somewhat Disagree,NA,NA,NA,Strongly Disagree,Strongly Disagree,Strongly Disagree,Rarely,A few times a year,58,Female,NA,"Undergraduate degree (BSc, BA)",No specific feedback except that I wish we hadn't left but I also wish the dialogue between the two sides was less bitter.,93,3,Remain,Remain
47,1651854348772,06/05/2022 16:25:48,1651854349997,1,06/05/2022 17:25:49,87571,2,task-l3ey,NA,21719568,6421486,NA,complete,NA,62754a30927bfb14ec4bcaef,computer,Desktop or Laptop,Windows 10,Chrome 101.0.4951.54,1280x720,1280x577,NA,ITT Ratings,3,Leave,10,NA,NA,NA,NA,NA,NA,NA,NA,ACCEPT,NA,batch10_REM,batch10_REM,53,45,1,Screen 1,continueButton,response_rating_scale_likert_active,22595.799999952316,NA,NA,Strongly Agree,1,0,1,0,NA,NA,NA,NA,1,statements,"Stronger economy, guaranteed set of human rights for its citizens",1,5/4/22,5/4/22,R_3090zRXcgf2gFrE,YES,Remain (Against Brexit),Very confident,NA,Disagree,NA,NA,NA,Disagree,Agree,Agree,NA,NA,NA,Neither Agree nor Disagree,Neither Agree nor Disagree,Neither Agree nor Disagree,Rarely,A few times a year,30,Male,NA,"GCSEs,Vocational Training / Apprenticeship",NA,99,2,Remain,Remain
48,1651854351015,06/05/2022 16:25:51,1651854352295,1,06/05/2022 17:25:52,87571,2,task-l3ey,NA,21719568,6421486,NA,complete,NA,62754a30927bfb14ec4bcaef,computer,Desktop or Laptop,Windows 10,Chrome 101.0.4951.54,1280x720,1280x577,NA,ITT Ratings,3,Leave,10,NA,NA,NA,NA,NA,NA,NA,NA,ACCEPT,NA,batch10_REM,batch10_REM,48,46,1,Screen 1,continueButton,response_rating_scale_likert_active,2253.300000190735,NA,NA,Strongly Disagree,1,0,1,0,NA,NA,NA,NA,1,statements,I don't like change,1,5/4/22,5/4/22,R_DkFtm34BTsS10dP,YES,Remain (Against Brexit),Confident,NA,Somewhat Agree,NA,NA,NA,Somewhat Disagree,Somewhat Disagree,Somewhat Agree,NA,NA,NA,Neither Agree nor Disagree,Somewhat Agree,Somewhat Disagree,A few times a year,Once or twice a year,25,Female,NA,"Postgraduate degree (MSc, MA, MPhil)",NA,98,3,Remain,Remain
49,1651854353554,06/05/2022 16:25:53,1651854354844,1,06/05/2022 17:25:54,87571,2,task-l3ey,NA,21719568,6421486,NA,complete,NA,62754a30927bfb14ec4bcaef,computer,Desktop or Laptop,Windows 10,Chrome 101.0.4951.54,1280x720,1280x577,NA,ITT Ratings,3,Leave,10,NA,NA,NA,NA,NA,NA,NA,NA,ACCEPT,NA,batch10_REM,batch10_REM,45,47,1,Screen 1,continueButton,response_rating_scale_likert_active,2514.2000000476837,NA,NA,Strongly Agree,1,0,1,0,NA,NA,NA,NA,1,statements,We give Europe too much money.,1,5/4/22,5/4/22,R_2978MEunsk8Bqb7,YES,Remain (Against Brexit),Confident,NA,Disagree,NA,NA,NA,Disagree,Disagree,Disagree,NA,NA,NA,Disagree,Disagree,Disagree,Never,Most months,64,Female,NA,"Undergraduate degree (BSc, BA)",N/A,97,3,Remain,Leave
50,1651854368668,06/05/2022 16:26:08,1651854369895,1,06/05/2022 17:26:09,87571,2,task-l3ey,NA,21719568,6421486,NA,complete,NA,62754a30927bfb14ec4bcaef,computer,Desktop or Laptop,Windows 10,Chrome 101.0.4951.54,1280x720,1280x577,NA,ITT Ratings,3,Leave,10,NA,NA,NA,NA,NA,NA,NA,NA,ACCEPT,NA,batch10_REM,batch10_REM,27,48,1,Screen 1,continueButton,response_rating_scale_likert_active,15017.5,NA,NA,Somewhat Agree,1,0,1,0,NA,NA,NA,NA,1,statements,Other Eu countries have greater power and influence within the EU trading bloc,1,5/4/22,5/4/22,R_2cc4hvh2YdbJwRo,YES,Remain (Against Brexit),Confident,NA,Agree,NA,NA,NA,Disagree,Disagree,Disagree,NA,NA,NA,Disagree,Disagree,Disagree,Most weeks,Most weeks,54,Female,NA,"Undergraduate degree (BSc, BA)","I think that some of the answers on offer were a little simplistic. For example, I don't characterise a leave voter as ignorant just because they have a different persepective from me. I appreciate that they may have different concerns. I welcome their freedom to have a different opinion and however much I may disagree with it, I think categorizing either side as somehow more ignorant than one's own, is dangerous because it doesn't leave much room for healthy respectful debate. It is only by being open to the opposing view that we can really heal our differences. None of which lessens the fact that I enjoyed this study very much, thank you!",94,3,Remain,Leave
51,1651854370372,06/05/2022 16:26:10,1651854371624,1,06/05/2022 17:26:11,87571,2,task-l3ey,NA,21719568,6421486,NA,complete,NA,62754a30927bfb14ec4bcaef,computer,Desktop or Laptop,Windows 10,Chrome 101.0.4951.54,1280x720,1280x577,NA,ITT Ratings,3,Leave,10,NA,NA,NA,NA,NA,NA,NA,NA,ACCEPT,NA,batch10_REM,batch10_REM,9,49,1,Screen 1,continueButton,response_rating_scale_likert_active,1709.5999999046326,NA,NA,Somewhat Agree,1,0,1,0,NA,NA,NA,NA,1,statements,Economic control over country's finances and jobs,1,5/4/22,5/4/22,R_2rDDppxPgHGQAEp,YES,Remain (Against Brexit),Very confident,NA,Disagree,NA,NA,NA,Somewhat Agree,Neither Agree nor Disagree,Somewhat Agree,NA,NA,NA,Neither Agree nor Disagree,Neither Agree nor Disagree,Neither Agree nor Disagree,Rarely,Rarely,31,Female,NA,"Undergraduate degree (BSc, BA)",NA,91,3,Remain,Leave
52,1651854377574,06/05/2022 16:26:17,1651854378814,1,06/05/2022 17:26:18,87571,2,task-l3ey,NA,21719568,6421486,NA,complete,NA,62754a30927bfb14ec4bcaef,computer,Desktop or Laptop,Windows 10,Chrome 101.0.4951.54,1280x720,1280x577,NA,ITT Ratings,3,Leave,10,NA,NA,NA,NA,NA,NA,NA,NA,ACCEPT,NA,batch10_REM,batch10_REM,16,50,1,Screen 1,continueButton,response_rating_scale_likert_active,7164.399999856949,NA,NA,Somewhat Disagree,1,0,1,0,NA,NA,NA,NA,1,statements,Easier trading with our closest geographic neighbours.,1,5/4/22,5/4/22,R_3PBMe3j9V4zzDzA,YES,Remain (Against Brexit),Very confident,NA,Somewhat Agree,NA,NA,NA,Disagree,Somewhat Disagree,Somewhat Disagree,NA,NA,NA,Strongly Disagree,Strongly Disagree,Strongly Disagree,Rarely,A few times a year,58,Female,NA,"Undergraduate degree (BSc, BA)",No specific feedback except that I wish we hadn't left but I also wish the dialogue between the two sides was less bitter.,93,1,Remain,Remain
53,1651854381073,06/05/2022 16:26:21,1651854382362,1,06/05/2022 17:26:22,87571,2,task-l3ey,NA,21719568,6421486,NA,complete,NA,62754a30927bfb14ec4bcaef,computer,Desktop or Laptop,Windows 10,Chrome 101.0.4951.54,1280x720,1280x577,NA,ITT Ratings,3,Leave,10,NA,NA,NA,NA,NA,NA,NA,NA,ACCEPT,NA,batch10_REM,batch10_REM,57,51,1,Screen 1,continueButton,response_rating_scale_likert_active,3513.5,NA,NA,Strongly Disagree,1,0,1,0,NA,NA,NA,NA,1,statements,i dont like immigrants,1,5/4/22,5/4/22,R_3090zRXcgf2gFrE,YES,Remain (Against Brexit),Very confident,NA,Disagree,NA,NA,NA,Disagree,Agree,Agree,NA,NA,NA,Neither Agree nor Disagree,Neither Agree nor Disagree,Neither Agree nor Disagree,Rarely,A few times a year,30,Male,NA,"GCSEs,Vocational Training / Apprenticeship",NA,99,3,Remain,Leave
54,1651854384698,06/05/2022 16:26:24,1651854385957,1,06/05/2022 17:26:25,87571,2,task-l3ey,NA,21719568,6421486,NA,complete,NA,62754a30927bfb14ec4bcaef,computer,Desktop or Laptop,Windows 10,Chrome 101.0.4951.54,1280x720,1280x577,NA,ITT Ratings,3,Leave,10,NA,NA,NA,NA,NA,NA,NA,NA,ACCEPT,NA,batch10_REM,batch10_REM,2,52,1,Screen 1,continueButton,response_rating_scale_likert_active,3553.5,NA,NA,Somewhat Agree,1,0,1,0,NA,NA,NA,NA,1,statements,We would like to check you are reading each argument carefully. Please select 'Somewhat Agree' for this answer,1,NA,NA,NA,NA,NA,NA,NA,NA,NA,NA,NA,NA,NA,NA,NA,NA,NA,NA,NA,NA,NA,NA,NA,NA,NA,NA,NA,NA,check1,NA,NA
55,1651854390591,06/05/2022 16:26:30,1651854391885,1,06/05/2022 17:26:31,87571,2,task-l3ey,NA,21719568,6421486,NA,complete,NA,62754a30927bfb14ec4bcaef,computer,Desktop or Laptop,Windows 10,Chrome 101.0.4951.54,1280x720,1280x577,NA,ITT Ratings,3,Leave,10,NA,NA,NA,NA,NA,NA,NA,NA,ACCEPT,NA,batch10_REM,batch10_REM,56,53,1,Screen 1,continueButton,response_rating_scale_likert_active,5897.799999952316,NA,NA,Agree,1,0,1,0,NA,NA,NA,NA,1,statements,Brtiain just isn't like it was in the good old days,1,5/4/22,5/4/22,R_3090zRXcgf2gFrE,YES,Remain (Against Brexit),Very confident,NA,Disagree,NA,NA,NA,Disagree,Agree,Agree,NA,NA,NA,Neither Agree nor Disagree,Neither Agree nor Disagree,Neither Agree nor Disagree,Rarely,A few times a year,30,Male,NA,"GCSEs,Vocational Training / Apprenticeship",NA,99,2,Remain,Leave
56,1651854394128,06/05/2022 16:26:34,1651854395426,1,06/05/2022 17:26:35,87571,2,task-l3ey,NA,21719568,6421486,NA,complete,NA,62754a30927bfb14ec4bcaef,computer,Desktop or Laptop,Windows 10,Chrome 101.0.4951.54,1280x720,1280x577,NA,ITT Ratings,3,Leave,10,NA,NA,NA,NA,NA,NA,NA,NA,ACCEPT,NA,batch10_REM,batch10_REM,50,54,1,Screen 1,continueButton,response_rating_scale_likert_active,3499.2999999523163,NA,NA,Strongly Agree,1,0,1,0,NA,NA,NA,NA,1,statements,we would be better off financially if we didn't have to pay money to other countries.,1,5/4/22,5/4/22,R_DkFtm34BTsS10dP,YES,Remain (Against Brexit),Confident,NA,Somewhat Agree,NA,NA,NA,Somewhat Disagree,Somewhat Disagree,Somewhat Agree,NA,NA,NA,Neither Agree nor Disagree,Somewhat Agree,Somewhat Disagree,A few times a year,Once or twice a year,25,Female,NA,"Postgraduate degree (MSc, MA, MPhil)",NA,98,2,Remain,Leave
57,1651854398133,06/05/2022 16:26:38,1651854399377,1,06/05/2022 17:26:39,87571,2,task-l3ey,NA,21719568,6421486,NA,complete,NA,62754a30927bfb14ec4bcaef,computer,Desktop or Laptop,Windows 10,Chrome 101.0.4951.54,1280x720,1280x577,NA,ITT Ratings,3,Leave,10,NA,NA,NA,NA,NA,NA,NA,NA,ACCEPT,NA,batch10_REM,batch10_REM,6,55,1,Screen 1,continueButton,response_rating_scale_likert_active,3937.300000190735,NA,NA,Strongly Agree,1,0,1,0,NA,NA,NA,NA,1,statements,International influence and political sway,1,5/4/22,5/4/22,R_2rDDppxPgHGQAEp,YES,Remain (Against Brexit),Very confident,NA,Disagree,NA,NA,NA,Somewhat Agree,Neither Agree nor Disagree,Somewhat Agree,NA,NA,NA,Neither Agree nor Disagree,Neither Agree nor Disagree,Neither Agree nor Disagree,Rarely,Rarely,31,Female,NA,"Undergraduate degree (BSc, BA)",NA,91,3,Remain,Remain
58,1651854400964,06/05/2022 16:26:40,1651854402250,1,06/05/2022 17:26:42,87571,2,task-l3ey,NA,21719568,6421486,NA,complete,NA,62754a30927bfb14ec4bcaef,computer,Desktop or Laptop,Windows 10,Chrome 101.0.4951.54,1280x720,1280x577,NA,ITT Ratings,3,Leave,10,NA,NA,NA,NA,NA,NA,NA,NA,ACCEPT,NA,batch10_REM,batch10_REM,61,56,1,Screen 1,continueButton,response_rating_scale_likert_active,2836.599999904633,NA,NA,Strongly Agree,1,0,1,0,NA,NA,NA,NA,1,statements,i think it would be better,1,5/4/22,5/4/22,R_2A126Q1TOCo5HJ5,YES,Remain (Against Brexit),Very confident,NA,Somewhat Agree,NA,NA,NA,Disagree,Somewhat Agree,Somewhat Disagree,NA,NA,NA,Somewhat Disagree,Somewhat Disagree,Somewhat Agree,Rarely,Once or twice a year,32,Female,NA,"Postgraduate degree (MSc, MA, MPhil)",NA,100,1,Remain,Leave
59,1651854404647,06/05/2022 16:26:44,1651854405930,1,06/05/2022 17:26:45,87571,2,task-l3ey,NA,21719568,6421486,NA,complete,NA,62754a30927bfb14ec4bcaef,computer,Desktop or Laptop,Windows 10,Chrome 101.0.4951.54,1280x720,1280x577,NA,ITT Ratings,3,Leave,10,NA,NA,NA,NA,NA,NA,NA,NA,ACCEPT,NA,batch10_REM,batch10_REM,25,57,1,Screen 1,continueButton,response_rating_scale_likert_active,3648.100000143051,NA,NA,Somewhat Disagree,1,0,1,0,NA,NA,NA,NA,1,statements,Worry about competition for jobs,1,5/4/22,5/4/22,R_2cc4hvh2YdbJwRo,YES,Remain (Against Brexit),Confident,NA,Agree,NA,NA,NA,Disagree,Disagree,Disagree,NA,NA,NA,Disagree,Disagree,Disagree,Most weeks,Most weeks,54,Female,NA,"Undergraduate degree (BSc, BA)","I think that some of the answers on offer were a little simplistic. For example, I don't characterise a leave voter as ignorant just because they have a different persepective from me. I appreciate that they may have different concerns. I welcome their freedom to have a different opinion and however much I may disagree with it, I think categorizing either side as somehow more ignorant than one's own, is dangerous because it doesn't leave much room for healthy respectful debate. It is only by being open to the opposing view that we can really heal our differences. None of which lessens the fact that I enjoyed this study very much, thank you!",94,1,Remain,Leave
60,1651854409047,06/05/2022 16:26:49,1651854410264,1,06/05/2022 17:26:50,87571,2,task-l3ey,NA,21719568,6421486,NA,complete,NA,62754a30927bfb14ec4bcaef,computer,Desktop or Laptop,Windows 10,Chrome 101.0.4951.54,1280x720,1280x577,NA,ITT Ratings,3,Leave,10,NA,NA,NA,NA,NA,NA,NA,NA,ACCEPT,NA,batch10_REM,batch10_REM,34,58,1,Screen 1,continueButton,response_rating_scale_likert_active,4298.099999904633,NA,NA,Strongly Disagree,1,0,1,0,NA,NA,NA,NA,1,statements,Being part of the EU had more benefits than costs for the UK,1,5/4/22,5/4/22,R_32VBarFINVzl5jr,YES,Remain (Against Brexit),Very confident,NA,Disagree,NA,NA,NA,Neither Agree nor Disagree,Neither Agree nor Disagree,Somewhat Agree,NA,NA,NA,Neither Agree nor Disagree,Neither Agree nor Disagree,Neither Agree nor Disagree,Once or twice a year,A few times a year,31,Female,NA,"Undergraduate degree (BSc, BA)",NA,96,1,Remain,Remain
61,1651854412461,06/05/2022 16:26:52,1651854413750,1,06/05/2022 17:26:53,87571,2,task-l3ey,NA,21719568,6421486,NA,complete,NA,62754a30927bfb14ec4bcaef,computer,Desktop or Laptop,Windows 10,Chrome 101.0.4951.54,1280x720,1280x577,NA,ITT Ratings,3,Leave,10,NA,NA,NA,NA,NA,NA,NA,NA,ACCEPT,NA,batch10_REM,batch10_REM,62,59,1,Screen 1,continueButton,response_rating_scale_likert_active,3454.099999904633,NA,NA,Strongly Agree,1,0,1,0,NA,NA,NA,NA,1,statements,So that the country doesn't have to follow EU rules and regulations,1,5/4/22,5/4/22,R_2A126Q1TOCo5HJ5,YES,Remain (Against Brexit),Very confident,NA,Somewhat Agree,NA,NA,NA,Disagree,Somewhat Agree,Somewhat Disagree,NA,NA,NA,Somewhat Disagree,Somewhat Disagree,Somewhat Agree,Rarely,Once or twice a year,32,Female,NA,"Postgraduate degree (MSc, MA, MPhil)",NA,100,2,Remain,Leave
62,1651854417436,06/05/2022 16:26:57,1651854418676,1,06/05/2022 17:26:58,87571,2,task-l3ey,NA,21719568,6421486,NA,complete,NA,62754a30927bfb14ec4bcaef,computer,Desktop or Laptop,Windows 10,Chrome 101.0.4951.54,1280x720,1280x577,NA,ITT Ratings,3,Leave,10,NA,NA,NA,NA,NA,NA,NA,NA,ACCEPT,NA,batch10_REM,batch10_REM,58,60,1,Screen 1,continueButton,response_rating_scale_likert_active,4897.700000047684,NA,NA,Somewhat Disagree,1,0,1,0,NA,NA,NA,NA,1,statements,More safety in the eu,1,5/4/22,5/4/22,R_2A126Q1TOCo5HJ5,YES,Remain (Against Brexit),Very confident,NA,Somewhat Agree,NA,NA,NA,Disagree,Somewhat Agree,Somewhat Disagree,NA,NA,NA,Somewhat Disagree,Somewhat Disagree,Somewhat Agree,Rarely,Once or twice a year,32,Female,NA,"Postgraduate degree (MSc, MA, MPhil)",NA,100,1,Remain,Remain
63,1651854425170,06/05/2022 16:27:05,1651854426400,1,06/05/2022 17:27:06,87571,2,task-l3ey,NA,21719568,6421486,NA,complete,NA,62754a30927bfb14ec4bcaef,computer,Desktop or Laptop,Windows 10,Chrome 101.0.4951.54,1280x720,1280x577,NA,ITT Ratings,3,Leave,10,NA,NA,NA,NA,NA,NA,NA,NA,ACCEPT,NA,batch10_REM,batch10_REM,38,61,1,Screen 1,continueButton,response_rating_scale_likert_active,7692.200000047684,NA,NA,Strongly Disagree,1,0,1,0,NA,NA,NA,NA,1,statements,I fear the effects of immigration (or immigrants themselves) and think leaving the EU will slow or prevent immigration.,1,5/4/22,5/4/22,R_32VBarFINVzl5jr,YES,Remain (Against Brexit),Very confident,NA,Disagree,NA,NA,NA,Neither Agree nor Disagree,Neither Agree nor Disagree,Somewhat Agree,NA,NA,NA,Neither Agree nor Disagree,Neither Agree nor Disagree,Neither Agree nor Disagree,Once or twice a year,A few times a year,31,Female,NA,"Undergraduate degree (BSc, BA)",NA,96,2,Remain,Leave
64,1651854427636,06/05/2022 16:27:07,1651854428922,1,06/05/2022 17:27:08,87571,2,task-l3ey,NA,21719568,6421486,NA,complete,NA,62754a30927bfb14ec4bcaef,computer,Desktop or Laptop,Windows 10,Chrome 101.0.4951.54,1280x720,1280x577,NA,ITT Ratings,3,Leave,10,NA,NA,NA,NA,NA,NA,NA,NA,ACCEPT,NA,batch10_REM,batch10_REM,30,62,1,Screen 1,continueButton,response_rating_scale_likert_active,2507.400000095367,NA,NA,Strongly Agree,1,0,1,0,NA,NA,NA,NA,1,statements,Restriction on immigration,1,5/4/22,5/4/22,R_1FzudSUEz3wVbYB,YES,Remain (Against Brexit),Somewhat Confident,NA,Neither Agree nor Disagree,NA,NA,NA,Neither Agree nor Disagree,Neither Agree nor Disagree,Somewhat Agree,NA,NA,NA,Somewhat Agree,Somewhat Disagree,Neither Agree nor Disagree,Never,Once or twice a year,39,Female,NA,"Undergraduate degree (BSc, BA)",NA,95,3,Remain,Remain
65,1651854427714,06/05/2022 16:27:07,1651854428942,1,06/05/2022 17:27:08,87571,2,task-l3ey,NA,21719568,6421486,NA,complete,NA,62754a30927bfb14ec4bcaef,computer,Desktop or Laptop,Windows 10,Chrome 101.0.4951.54,1280x720,1280x577,NA,ITT Ratings,3,Leave,10,NA,NA,NA,NA,NA,NA,NA,NA,ACCEPT,NA,batch10_REM,NA,NA,END TASK,NA,NA,NA,NA,485412,NA,NA,NA,NA,0,1,0,NA,NA,NA,NA,NA,NA,NA,NA,NA,NA,NA,NA,NA,NA,NA,NA,NA,NA,NA,NA,NA,NA,NA,NA,NA,NA,NA,NA,NA,NA,NA,NA,NA,NA,NA,NA,NA,NA,NA
1,1651854206204,06/05/2022 16:23:26,1651854206093,1,06/05/2022 17:23:26,87571,2,task-l3ey,NA,21719705,6421536,NA,complete,NA,62754b544a747f639f947f94,mobile,Apple iPhone,iOS 15.4,Chrome 101.0.4951.44,375x812,712x319,NA,ITT Ratings,3,Leave,10,NA,NA,NA,NA,NA,NA,NA,NA,ACCEPT,NA,batch10_REM,NA,NA,BEGIN TASK,NA,NA,NA,NA,NA,NA,NA,NA,NA,0,1,0,NA,NA,NA,NA,NA,NA,NA,NA,NA,NA,NA,NA,NA,NA,NA,NA,NA,NA,NA,NA,NA,NA,NA,NA,NA,NA,NA,NA,NA,NA,NA,NA,NA,NA,NA,NA,NA,NA,NA
2,1651854207561,06/05/2022 16:23:27,1651854207511,1,06/05/2022 17:23:27,87571,2,task-l3ey,NA,21719705,6421536,NA,complete,NA,62754b544a747f639f947f94,mobile,Apple iPhone,iOS 15.4,Chrome 101.0.4951.44,375x812,712x319,NA,ITT Ratings,3,Leave,10,NA,NA,NA,NA,NA,NA,NA,NA,ACCEPT,NA,batch10_REM,batch10_REM,1,1,1,Screen 1,advancementZone,continue_button,1378,NA,NA,NA,NA,0,1,0,NA,NA,NA,NA,NA,instructions,NA,NA,NA,NA,NA,NA,NA,NA,NA,NA,NA,NA,NA,NA,NA,NA,NA,NA,NA,NA,NA,NA,NA,NA,NA,NA,NA,NA,NA,NA,NA,NA,NA
3,1651854216146,06/05/2022 16:23:36,1651854216088,1,06/05/2022 17:23:36,87571,2,task-l3ey,NA,21719705,6421536,NA,complete,NA,62754b544a747f639f947f94,mobile,Apple iPhone,iOS 15.4,Chrome 101.0.4951.44,375x812,712x319,NA,ITT Ratings,3,Leave,10,NA,NA,NA,NA,NA,NA,NA,NA,ACCEPT,NA,batch10_REM,batch10_REM,33,1,1,Screen 1,continueButton,response_rating_scale_likert_active,8555,NA,NA,Agree,1,0,1,0,NA,NA,NA,NA,1,statements,More money sent directly back into the nhs rather than to the eu,1,5/4/22,5/4/22,R_1FzudSUEz3wVbYB,YES,Remain (Against Brexit),Somewhat Confident,NA,Neither Agree nor Disagree,NA,NA,NA,Neither Agree nor Disagree,Neither Agree nor Disagree,Somewhat Agree,NA,NA,NA,Somewhat Agree,Somewhat Disagree,Neither Agree nor Disagree,Never,Once or twice a year,39,Female,NA,"Undergraduate degree (BSc, BA)",NA,95,3,Remain,Leave
4,1651854224588,06/05/2022 16:23:44,1651854224525,1,06/05/2022 17:23:44,87571,2,task-l3ey,NA,21719705,6421536,NA,complete,NA,62754b544a747f639f947f94,mobile,Apple iPhone,iOS 15.4,Chrome 101.0.4951.44,375x812,712x319,NA,ITT Ratings,3,Leave,10,NA,NA,NA,NA,NA,NA,NA,NA,ACCEPT,NA,batch10_REM,batch10_REM,20,2,1,Screen 1,continueButton,response_rating_scale_likert_active,8421,NA,NA,Neither Agree nor Disagree,1,0,1,0,NA,NA,NA,NA,1,statements,"Fish. The suggestion was that Brexit would give us back our local waters and reduce competition from Europe, making our local fishing boats and companies richer.",1,5/4/22,5/4/22,R_3PBMe3j9V4zzDzA,YES,Remain (Against Brexit),Very confident,NA,Somewhat Agree,NA,NA,NA,Disagree,Somewhat Disagree,Somewhat Disagree,NA,NA,NA,Strongly Disagree,Strongly Disagree,Strongly Disagree,Rarely,A few times a year,58,Female,NA,"Undergraduate degree (BSc, BA)",No specific feedback except that I wish we hadn't left but I also wish the dialogue between the two sides was less bitter.,93,2,Remain,Leave
5,1651854227983,06/05/2022 16:23:47,1651854227959,1,06/05/2022 17:23:47,87571,2,task-l3ey,NA,21719705,6421536,NA,complete,NA,62754b544a747f639f947f94,mobile,Apple iPhone,iOS 15.4,Chrome 101.0.4951.44,375x812,712x319,NA,ITT Ratings,3,Leave,10,NA,NA,NA,NA,NA,NA,NA,NA,ACCEPT,NA,batch10_REM,batch10_REM,53,3,1,Screen 1,continueButton,response_rating_scale_likert_active,3408.0000000000036,NA,NA,Somewhat Agree,1,0,1,0,NA,NA,NA,NA,1,statements,"Stronger economy, guaranteed set of human rights for its citizens",1,5/4/22,5/4/22,R_3090zRXcgf2gFrE,YES,Remain (Against Brexit),Very confident,NA,Disagree,NA,NA,NA,Disagree,Agree,Agree,NA,NA,NA,Neither Agree nor Disagree,Neither Agree nor Disagree,Neither Agree nor Disagree,Rarely,A few times a year,30,Male,NA,"GCSEs,Vocational Training / Apprenticeship",NA,99,2,Remain,Remain
6,1651854229924,06/05/2022 16:23:49,1651854229890,1,06/05/2022 17:23:49,87571,2,task-l3ey,NA,21719705,6421536,NA,complete,NA,62754b544a747f639f947f94,mobile,Apple iPhone,iOS 15.4,Chrome 101.0.4951.44,375x812,712x319,NA,ITT Ratings,3,Leave,10,NA,NA,NA,NA,NA,NA,NA,NA,ACCEPT,NA,batch10_REM,batch10_REM,58,4,1,Screen 1,continueButton,response_rating_scale_likert_active,1907.9999999999964,NA,NA,Somewhat Agree,1,0,1,0,NA,NA,NA,NA,1,statements,More safety in the eu,1,5/4/22,5/4/22,R_2A126Q1TOCo5HJ5,YES,Remain (Against Brexit),Very confident,NA,Somewhat Agree,NA,NA,NA,Disagree,Somewhat Agree,Somewhat Disagree,NA,NA,NA,Somewhat Disagree,Somewhat Disagree,Somewhat Agree,Rarely,Once or twice a year,32,Female,NA,"Postgraduate degree (MSc, MA, MPhil)",NA,100,1,Remain,Remain
7,1651854239183,06/05/2022 16:23:59,1651854239155,1,06/05/2022 17:23:59,87571,2,task-l3ey,NA,21719705,6421536,NA,complete,NA,62754b544a747f639f947f94,mobile,Apple iPhone,iOS 15.4,Chrome 101.0.4951.44,375x812,712x319,NA,ITT Ratings,3,Leave,10,NA,NA,NA,NA,NA,NA,NA,NA,ACCEPT,NA,batch10_REM,batch10_REM,18,5,1,Screen 1,continueButton,response_rating_scale_likert_active,9244.000000000007,NA,NA,Disagree,1,0,1,0,NA,NA,NA,NA,1,statements,We are stronger as part of a larger community. On our own we are small and now rather pathetic.,1,5/4/22,5/4/22,R_3PBMe3j9V4zzDzA,YES,Remain (Against Brexit),Very confident,NA,Somewhat Agree,NA,NA,NA,Disagree,Somewhat Disagree,Somewhat Disagree,NA,NA,NA,Strongly Disagree,Strongly Disagree,Strongly Disagree,Rarely,A few times a year,58,Female,NA,"Undergraduate degree (BSc, BA)",No specific feedback except that I wish we hadn't left but I also wish the dialogue between the two sides was less bitter.,93,3,Remain,Remain
8,1651854244662,06/05/2022 16:24:04,1651854244620,1,06/05/2022 17:24:04,87571,2,task-l3ey,NA,21719705,6421536,NA,complete,NA,62754b544a747f639f947f94,mobile,Apple iPhone,iOS 15.4,Chrome 101.0.4951.44,375x812,712x319,NA,ITT Ratings,3,Leave,10,NA,NA,NA,NA,NA,NA,NA,NA,ACCEPT,NA,batch10_REM,batch10_REM,21,6,1,Screen 1,continueButton,response_rating_scale_likert_active,5445,NA,NA,Agree,1,0,1,0,NA,NA,NA,NA,1,statements,There was the suggestion that we were paying too much to be members and if we took back that money we could spend it on the NHS.,1,5/4/22,5/4/22,R_3PBMe3j9V4zzDzA,YES,Remain (Against Brexit),Very confident,NA,Somewhat Agree,NA,NA,NA,Disagree,Somewhat Disagree,Somewhat Disagree,NA,NA,NA,Strongly Disagree,Strongly Disagree,Strongly Disagree,Rarely,A few times a year,58,Female,NA,"Undergraduate degree (BSc, BA)",No specific feedback except that I wish we hadn't left but I also wish the dialogue between the two sides was less bitter.,93,3,Remain,Leave
9,1651854246584,06/05/2022 16:24:06,1651854246553,1,06/05/2022 17:24:06,87571,2,task-l3ey,NA,21719705,6421536,NA,complete,NA,62754b544a747f639f947f94,mobile,Apple iPhone,iOS 15.4,Chrome 101.0.4951.44,375x812,712x319,NA,ITT Ratings,3,Leave,10,NA,NA,NA,NA,NA,NA,NA,NA,ACCEPT,NA,batch10_REM,batch10_REM,15,7,1,Screen 1,continueButton,response_rating_scale_likert_active,1915,NA,NA,Agree,1,0,1,0,NA,NA,NA,NA,1,statements,Control of our own democracy and laws for ourselves instead of having to listen to the EU.,1,5/4/22,5/4/22,R_28CdLh75b5SHpU6,YES,Remain (Against Brexit),Very confident,NA,Strongly Disagree,NA,NA,NA,Agree,Somewhat Agree,Agree,NA,NA,NA,Neither Agree nor Disagree,Somewhat Agree,Neither Agree nor Disagree,Rarely,A few times a year,29,Female,NA,A levels,NA,92,3,Remain,Leave
