15,1651855244184,06/05/2022 16:40:44,1651855244008,1,06/05/2022 17:40:44,87571,2,task-l3ey,NA,21720415,6421723,NA,complete,NA,62754ee4e472c9f47831775e,mobile,undefined M2101K6G,Android 12,Chrome 98.0.4758.101,873x393,792x255,NA,ITT Ratings,3,Leave,10,NA,NA,NA,NA,NA,NA,NA,NA,ACCEPT,NA,batch10_REM,batch10_REM,60,13,1,Screen 1,continueButton,response_rating_scale_likert_active,2309.399999976158,NA,NA,Somewhat Disagree,1,0,1,0,NA,NA,NA,NA,1,statements,To avoid problems with borders,1,5/4/22,5/4/22,R_2A126Q1TOCo5HJ5,YES,Remain (Against Brexit),Very confident,NA,Somewhat Agree,NA,NA,NA,Disagree,Somewhat Agree,Somewhat Disagree,NA,NA,NA,Somewhat Disagree,Somewhat Disagree,Somewhat Agree,Rarely,Once or twice a year,32,Female,NA,"Postgraduate degree (MSc, MA, MPhil)",NA,100,3,Remain,Remain
16,1651855248284,06/05/2022 16:40:48,1651855248164,1,06/05/2022 17:40:48,87571,2,task-l3ey,NA,21720415,6421723,NA,complete,NA,62754ee4e472c9f47831775e,mobile,undefined M2101K6G,Android 12,Chrome 98.0.4758.101,873x393,792x255,NA,ITT Ratings,3,Leave,10,NA,NA,NA,NA,NA,NA,NA,NA,ACCEPT,NA,batch10_REM,batch10_REM,59,14,1,Screen 1,continueButton,response_rating_scale_likert_active,4100.899999976158,NA,NA,Somewhat Disagree,1,0,1,0,NA,NA,NA,NA,1,statements,Protect peace in Northern Ireland,1,5/4/22,5/4/22,R_2A126Q1TOCo5HJ5,YES,Remain (Against Brexit),Very confident,NA,Somewhat Agree,NA,NA,NA,Disagree,Somewhat Agree,Somewhat Disagree,NA,NA,NA,Somewhat Disagree,Somewhat Disagree,Somewhat Agree,Rarely,Once or twice a year,32,Female,NA,"Postgraduate degree (MSc, MA, MPhil)",NA,100,2,Remain,Remain
17,1651855256309,06/05/2022 16:40:56,1651855256138,1,06/05/2022 17:40:56,87571,2,task-l3ey,NA,21720415,6421723,NA,complete,NA,62754ee4e472c9f47831775e,mobile,undefined M2101K6G,Android 12,Chrome 98.0.4758.101,873x393,792x255,NA,ITT Ratings,3,Leave,10,NA,NA,NA,NA,NA,NA,NA,NA,ACCEPT,NA,batch10_REM,batch10_REM,27,15,1,Screen 1,continueButton,response_rating_scale_likert_active,7917.100000023842,NA,NA,Somewhat Disagree,1,0,1,0,NA,NA,NA,NA,1,statements,Other Eu countries have greater power and influence within the EU trading bloc,1,5/4/22,5/4/22,R_2cc4hvh2YdbJwRo,YES,Remain (Against Brexit),Confident,NA,Agree,NA,NA,NA,Disagree,Disagree,Disagree,NA,NA,NA,Disagree,Disagree,Disagree,Most weeks,Most weeks,54,Female,NA,"Undergraduate degree (BSc, BA)","I think that some of the answers on offer were a little simplistic. For example, I don't characterise a leave voter as ignorant just because they have a different persepective from me. I appreciate that they may have different concerns. I welcome their freedom to have a different opinion and however much I may disagree with it, I think categorizing either side as somehow more ignorant than one's own, is dangerous because it doesn't leave much room for healthy respectful debate. It is only by being open to the opposing view that we can really heal our differences. None of which lessens the fact that I enjoyed this study very much, thank you!",94,3,Remain,Leave
18,1651855261808,06/05/2022 16:41:01,1651855261672,1,06/05/2022 17:41:01,87571,2,task-l3ey,NA,21720415,6421723,NA,complete,NA,62754ee4e472c9f47831775e,mobile,undefined M2101K6G,Android 12,Chrome 98.0.4758.101,393x873,393x688,NA,ITT Ratings,3,Leave,10,NA,NA,NA,NA,NA,NA,NA,NA,ACCEPT,NA,batch10_REM,batch10_REM,15,16,1,Screen 1,continueButton,response_rating_scale_likert_active,5473.700000047684,NA,NA,Agree,1,0,1,0,NA,NA,NA,NA,1,statements,Control of our own democracy and laws for ourselves instead of having to listen to the EU.,1,5/4/22,5/4/22,R_28CdLh75b5SHpU6,YES,Remain (Against Brexit),Very confident,NA,Strongly Disagree,NA,NA,NA,Agree,Somewhat Agree,Agree,NA,NA,NA,Neither Agree nor Disagree,Somewhat Agree,Neither Agree nor Disagree,Rarely,A few times a year,29,Female,NA,A levels,NA,92,3,Remain,Leave
19,1651855267812,06/05/2022 16:41:07,1651855267636,1,06/05/2022 17:41:07,87571,2,task-l3ey,NA,21720415,6421723,NA,complete,NA,62754ee4e472c9f47831775e,mobile,undefined M2101K6G,Android 12,Chrome 98.0.4758.101,873x393,792x255,NA,ITT Ratings,3,Leave,10,NA,NA,NA,NA,NA,NA,NA,NA,ACCEPT,NA,batch10_REM,batch10_REM,20,17,1,Screen 1,continueButton,response_rating_scale_likert_active,4397,NA,NA,Disagree,1,0,1,0,NA,NA,NA,NA,1,statements,"Fish. The suggestion was that Brexit would give us back our local waters and reduce competition from Europe, making our local fishing boats and companies richer.",1,5/4/22,5/4/22,R_3PBMe3j9V4zzDzA,YES,Remain (Against Brexit),Very confident,NA,Somewhat Agree,NA,NA,NA,Disagree,Somewhat Disagree,Somewhat Disagree,NA,NA,NA,Strongly Disagree,Strongly Disagree,Strongly Disagree,Rarely,A few times a year,58,Female,NA,"Undergraduate degree (BSc, BA)",No specific feedback except that I wish we hadn't left but I also wish the dialogue between the two sides was less bitter.,93,2,Remain,Leave
20,1651855270303,06/05/2022 16:41:10,1651855270123,1,06/05/2022 17:41:10,87571,2,task-l3ey,NA,21720415,6421723,NA,complete,NA,62754ee4e472c9f47831775e,mobile,undefined M2101K6G,Android 12,Chrome 98.0.4758.101,873x393,792x255,NA,ITT Ratings,3,Leave,10,NA,NA,NA,NA,NA,NA,NA,NA,ACCEPT,NA,batch10_REM,batch10_REM,54,18,1,Screen 1,continueButton,response_rating_scale_likert_active,2423.699999988079,NA,NA,Somewhat Disagree,1,0,1,0,NA,NA,NA,NA,1,statements,More jobs for citizens,1,5/4/22,5/4/22,R_3090zRXcgf2gFrE,YES,Remain (Against Brexit),Very confident,NA,Disagree,NA,NA,NA,Disagree,Agree,Agree,NA,NA,NA,Neither Agree nor Disagree,Neither Agree nor Disagree,Neither Agree nor Disagree,Rarely,A few times a year,30,Male,NA,"GCSEs,Vocational Training / Apprenticeship",NA,99,3,Remain,Remain
21,1651855278527,06/05/2022 16:41:18,1651855278379,1,06/05/2022 17:41:18,87571,2,task-l3ey,NA,21720415,6421723,NA,complete,NA,62754ee4e472c9f47831775e,mobile,undefined M2101K6G,Android 12,Chrome 98.0.4758.101,393x873,393x688,NA,ITT Ratings,3,Leave,10,NA,NA,NA,NA,NA,NA,NA,NA,ACCEPT,NA,batch10_REM,batch10_REM,46,19,1,Screen 1,continueButton,response_rating_scale_likert_active,8184.200000047684,NA,NA,Somewhat Agree,1,0,1,0,NA,NA,NA,NA,1,statements,Our economic situation would get worse if we left the EU,1,5/4/22,5/4/22,R_DkFtm34BTsS10dP,YES,Remain (Against Brexit),Confident,NA,Somewhat Agree,NA,NA,NA,Somewhat Disagree,Somewhat Disagree,Somewhat Agree,NA,NA,NA,Neither Agree nor Disagree,Somewhat Agree,Somewhat Disagree,A few times a year,Once or twice a year,25,Female,NA,"Postgraduate degree (MSc, MA, MPhil)",NA,98,1,Remain,Remain
22,1651855282790,06/05/2022 16:41:22,1651855282634,1,06/05/2022 17:41:22,87571,2,task-l3ey,NA,21720415,6421723,NA,complete,NA,62754ee4e472c9f47831775e,mobile,undefined M2101K6G,Android 12,Chrome 98.0.4758.101,873x393,792x255,NA,ITT Ratings,3,Leave,10,NA,NA,NA,NA,NA,NA,NA,NA,ACCEPT,NA,batch10_REM,batch10_REM,32,20,1,Screen 1,continueButton,response_rating_scale_likert_active,2685.300000011921,NA,NA,Somewhat Disagree,1,0,1,0,NA,NA,NA,NA,1,statements,The uk will take back control of fisheries,1,5/4/22,5/4/22,R_1FzudSUEz3wVbYB,YES,Remain (Against Brexit),Somewhat Confident,NA,Neither Agree nor Disagree,NA,NA,NA,Neither Agree nor Disagree,Neither Agree nor Disagree,Somewhat Agree,NA,NA,NA,Somewhat Agree,Somewhat Disagree,Neither Agree nor Disagree,Never,Once or twice a year,39,Female,NA,"Undergraduate degree (BSc, BA)",NA,95,2,Remain,Leave
23,1651855288721,06/05/2022 16:41:28,1651855288551,1,06/05/2022 17:41:28,87571,2,task-l3ey,NA,21720415,6421723,NA,complete,NA,62754ee4e472c9f47831775e,mobile,undefined M2101K6G,Android 12,Chrome 98.0.4758.101,393x873,393x688,NA,ITT Ratings,3,Leave,10,NA,NA,NA,NA,NA,NA,NA,NA,ACCEPT,NA,batch10_REM,batch10_REM,5,21,1,Screen 1,continueButton,response_rating_scale_likert_active,5857.399999976158,NA,NA,Agree,1,0,1,0,NA,NA,NA,NA,1,statements,Freedom of movement between European countries and immigration,1,5/4/22,5/4/22,R_2rDDppxPgHGQAEp,YES,Remain (Against Brexit),Very confident,NA,Disagree,NA,NA,NA,Somewhat Agree,Neither Agree nor Disagree,Somewhat Agree,NA,NA,NA,Neither Agree nor Disagree,Neither Agree nor Disagree,Neither Agree nor Disagree,Rarely,Rarely,31,Female,NA,"Undergraduate degree (BSc, BA)",NA,91,2,Remain,Remain
24,1651855296233,06/05/2022 16:41:36,1651855296113,1,06/05/2022 17:41:36,87571,2,task-l3ey,NA,21720415,6421723,NA,complete,NA,62754ee4e472c9f47831775e,mobile,undefined M2101K6G,Android 12,Chrome 98.0.4758.101,393x873,393x688,NA,ITT Ratings,3,Leave,10,NA,NA,NA,NA,NA,NA,NA,NA,ACCEPT,NA,batch10_REM,batch10_REM,51,22,1,Screen 1,continueButton,response_rating_scale_likert_active,5953.5,NA,NA,Agree,1,0,1,0,NA,NA,NA,NA,1,statements,i want more independence when it comes to decisions about my country.,1,5/4/22,5/4/22,R_DkFtm34BTsS10dP,YES,Remain (Against Brexit),Confident,NA,Somewhat Agree,NA,NA,NA,Somewhat Disagree,Somewhat Disagree,Somewhat Agree,NA,NA,NA,Neither Agree nor Disagree,Somewhat Agree,Somewhat Disagree,A few times a year,Once or twice a year,25,Female,NA,"Postgraduate degree (MSc, MA, MPhil)",NA,98,3,Remain,Leave
25,1651855301741,06/05/2022 16:41:41,1651855301582,1,06/05/2022 17:41:41,87571,2,task-l3ey,NA,21720415,6421723,NA,complete,NA,62754ee4e472c9f47831775e,mobile,undefined M2101K6G,Android 12,Chrome 98.0.4758.101,393x873,393x688,NA,ITT Ratings,3,Leave,10,NA,NA,NA,NA,NA,NA,NA,NA,ACCEPT,NA,batch10_REM,batch10_REM,29,23,1,Screen 1,continueButton,response_rating_scale_likert_active,3913.100000023842,NA,NA,Neither Agree nor Disagree,1,0,1,0,NA,NA,NA,NA,1,statements,Trade will be affected,1,5/4/22,5/4/22,R_1FzudSUEz3wVbYB,YES,Remain (Against Brexit),Somewhat Confident,NA,Neither Agree nor Disagree,NA,NA,NA,Neither Agree nor Disagree,Neither Agree nor Disagree,Somewhat Agree,NA,NA,NA,Somewhat Agree,Somewhat Disagree,Neither Agree nor Disagree,Never,Once or twice a year,39,Female,NA,"Undergraduate degree (BSc, BA)",NA,95,2,Remain,Remain
26,1651855305899,06/05/2022 16:41:45,1651855305750,1,06/05/2022 17:41:45,87571,2,task-l3ey,NA,21720415,6421723,NA,complete,NA,62754ee4e472c9f47831775e,mobile,undefined M2101K6G,Android 12,Chrome 98.0.4758.101,873x393,792x255,NA,ITT Ratings,3,Leave,10,NA,NA,NA,NA,NA,NA,NA,NA,ACCEPT,NA,batch10_REM,batch10_REM,7,24,1,Screen 1,continueButton,response_rating_scale_likert_active,2574.399999976158,NA,NA,Somewhat Disagree,1,0,1,0,NA,NA,NA,NA,1,statements,Political control over direction of country,1,5/4/22,5/4/22,R_2rDDppxPgHGQAEp,YES,Remain (Against Brexit),Very confident,NA,Disagree,NA,NA,NA,Somewhat Agree,Neither Agree nor Disagree,Somewhat Agree,NA,NA,NA,Neither Agree nor Disagree,Neither Agree nor Disagree,Neither Agree nor Disagree,Rarely,Rarely,31,Female,NA,"Undergraduate degree (BSc, BA)",NA,91,1,Remain,Leave
27,1651855308286,06/05/2022 16:41:48,1651855308162,1,06/05/2022 17:41:48,87571,2,task-l3ey,NA,21720415,6421723,NA,complete,NA,62754ee4e472c9f47831775e,mobile,undefined M2101K6G,Android 12,Chrome 98.0.4758.101,873x393,792x255,NA,ITT Ratings,3,Leave,10,NA,NA,NA,NA,NA,NA,NA,NA,ACCEPT,NA,batch10_REM,batch10_REM,55,25,1,Screen 1,continueButton,response_rating_scale_likert_active,2359.400000035763,NA,NA,Disagree,1,0,1,0,NA,NA,NA,NA,1,statements,They're taking our jobs,1,5/4/22,5/4/22,R_3090zRXcgf2gFrE,YES,Remain (Against Brexit),Very confident,NA,Disagree,NA,NA,NA,Disagree,Agree,Agree,NA,NA,NA,Neither Agree nor Disagree,Neither Agree nor Disagree,Neither Agree nor Disagree,Rarely,A few times a year,30,Male,NA,"GCSEs,Vocational Training / Apprenticeship",NA,99,1,Remain,Leave
28,1651855315137,06/05/2022 16:41:55,1651855314963,1,06/05/2022 17:41:54,87571,2,task-l3ey,NA,21720415,6421723,NA,complete,NA,62754ee4e472c9f47831775e,mobile,undefined M2101K6G,Android 12,Chrome 98.0.4758.101,873x393,792x255,NA,ITT Ratings,3,Leave,10,NA,NA,NA,NA,NA,NA,NA,NA,ACCEPT,NA,batch10_REM,batch10_REM,56,26,1,Screen 1,continueButton,response_rating_scale_likert_active,6746.600000023842,NA,NA,Somewhat Disagree,1,0,1,0,NA,NA,NA,NA,1,statements,Brtiain just isn't like it was in the good old days,1,5/4/22,5/4/22,R_3090zRXcgf2gFrE,YES,Remain (Against Brexit),Very confident,NA,Disagree,NA,NA,NA,Disagree,Agree,Agree,NA,NA,NA,Neither Agree nor Disagree,Neither Agree nor Disagree,Neither Agree nor Disagree,Rarely,A few times a year,30,Male,NA,"GCSEs,Vocational Training / Apprenticeship",NA,99,2,Remain,Leave
29,1651855318470,06/05/2022 16:41:58,1651855318347,1,06/05/2022 17:41:58,87571,2,task-l3ey,NA,21720415,6421723,NA,complete,NA,62754ee4e472c9f47831775e,mobile,undefined M2101K6G,Android 12,Chrome 98.0.4758.101,873x393,792x255,NA,ITT Ratings,3,Leave,10,NA,NA,NA,NA,NA,NA,NA,NA,ACCEPT,NA,batch10_REM,batch10_REM,57,27,1,Screen 1,continueButton,response_rating_scale_likert_active,3330.699999988079,NA,NA,Disagree,1,0,1,0,NA,NA,NA,NA,1,statements,i dont like immigrants,1,5/4/22,5/4/22,R_3090zRXcgf2gFrE,YES,Remain (Against Brexit),Very confident,NA,Disagree,NA,NA,NA,Disagree,Agree,Agree,NA,NA,NA,Neither Agree nor Disagree,Neither Agree nor Disagree,Neither Agree nor Disagree,Rarely,A few times a year,30,Male,NA,"GCSEs,Vocational Training / Apprenticeship",NA,99,3,Remain,Leave
30,1651855323199,06/05/2022 16:42:03,1651855323066,1,06/05/2022 17:42:03,87571,2,task-l3ey,NA,21720415,6421723,NA,complete,NA,62754ee4e472c9f47831775e,mobile,undefined M2101K6G,Android 12,Chrome 98.0.4758.101,873x393,792x255,NA,ITT Ratings,3,Leave,10,NA,NA,NA,NA,NA,NA,NA,NA,ACCEPT,NA,batch10_REM,batch10_REM,40,28,1,Screen 1,continueButton,response_rating_scale_likert_active,4620.399999976158,NA,NA,Somewhat Disagree,1,0,1,0,NA,NA,NA,NA,1,statements,Can only visit Europe for 90 days in every 180 day period. It’s difficult to juggle.,1,5/4/22,5/4/22,R_2978MEunsk8Bqb7,YES,Remain (Against Brexit),Confident,NA,Disagree,NA,NA,NA,Disagree,Disagree,Disagree,NA,NA,NA,Disagree,Disagree,Disagree,Never,Most months,64,Female,NA,"Undergraduate degree (BSc, BA)",N/A,97,1,Remain,Remain
31,1651855328654,06/05/2022 16:42:08,1651855328542,1,06/05/2022 17:42:08,87571,2,task-l3ey,NA,21720415,6421723,NA,complete,NA,62754ee4e472c9f47831775e,mobile,undefined M2101K6G,Android 12,Chrome 98.0.4758.101,393x873,393x688,NA,ITT Ratings,3,Leave,10,NA,NA,NA,NA,NA,NA,NA,NA,ACCEPT,NA,batch10_REM,batch10_REM,2,29,1,Screen 1,continueButton,response_rating_scale_likert_active,5412.300000011921,NA,NA,Somewhat Agree,1,0,1,0,NA,NA,NA,NA,1,statements,We would like to check you are reading each argument carefully. Please select 'Somewhat Agree' for this answer,1,NA,NA,NA,NA,NA,NA,NA,NA,NA,NA,NA,NA,NA,NA,NA,NA,NA,NA,NA,NA,NA,NA,NA,NA,NA,NA,NA,NA,check1,NA,NA
32,1651855333134,06/05/2022 16:42:13,1651855332989,1,06/05/2022 17:42:12,87571,2,task-l3ey,NA,21720415,6421723,NA,complete,NA,62754ee4e472c9f47831775e,mobile,undefined M2101K6G,Android 12,Chrome 98.0.4758.101,873x393,792x255,NA,ITT Ratings,3,Leave,10,NA,NA,NA,NA,NA,NA,NA,NA,ACCEPT,NA,batch10_REM,batch10_REM,58,30,1,Screen 1,continueButton,response_rating_scale_likert_active,2874.5,NA,NA,Somewhat Disagree,1,0,1,0,NA,NA,NA,NA,1,statements,More safety in the eu,1,5/4/22,5/4/22,R_2A126Q1TOCo5HJ5,YES,Remain (Against Brexit),Very confident,NA,Somewhat Agree,NA,NA,NA,Disagree,Somewhat Agree,Somewhat Disagree,NA,NA,NA,Somewhat Disagree,Somewhat Disagree,Somewhat Agree,Rarely,Once or twice a year,32,Female,NA,"Postgraduate degree (MSc, MA, MPhil)",NA,100,1,Remain,Remain
33,1651855339153,06/05/2022 16:42:19,1651855339025,1,06/05/2022 17:42:19,87571,2,task-l3ey,NA,21720415,6421723,NA,complete,NA,62754ee4e472c9f47831775e,mobile,undefined M2101K6G,Android 12,Chrome 98.0.4758.101,393x873,393x688,NA,ITT Ratings,3,Leave,10,NA,NA,NA,NA,NA,NA,NA,NA,ACCEPT,NA,batch10_REM,batch10_REM,23,31,1,Screen 1,continueButton,response_rating_scale_likert_active,5970.199999988079,NA,NA,Somewhat Agree,1,0,1,0,NA,NA,NA,NA,1,statements,Many EU laws are beneficial to UK - eg environmental,1,5/4/22,5/4/22,R_2cc4hvh2YdbJwRo,YES,Remain (Against Brexit),Confident,NA,Agree,NA,NA,NA,Disagree,Disagree,Disagree,NA,NA,NA,Disagree,Disagree,Disagree,Most weeks,Most weeks,54,Female,NA,"Undergraduate degree (BSc, BA)","I think that some of the answers on offer were a little simplistic. For example, I don't characterise a leave voter as ignorant just because they have a different persepective from me. I appreciate that they may have different concerns. I welcome their freedom to have a different opinion and however much I may disagree with it, I think categorizing either side as somehow more ignorant than one's own, is dangerous because it doesn't leave much room for healthy respectful debate. It is only by being open to the opposing view that we can really heal our differences. None of which lessens the fact that I enjoyed this study very much, thank you!",94,2,Remain,Remain
34,1651855347739,06/05/2022 16:42:27,1651855347592,1,06/05/2022 17:42:27,87571,2,task-l3ey,NA,21720415,6421723,NA,complete,NA,62754ee4e472c9f47831775e,mobile,undefined M2101K6G,Android 12,Chrome 98.0.4758.101,393x873,393x688,NA,ITT Ratings,3,Leave,10,NA,NA,NA,NA,NA,NA,NA,NA,ACCEPT,NA,batch10_REM,batch10_REM,33,32,1,Screen 1,continueButton,response_rating_scale_likert_active,6986.199999988079,NA,NA,Neither Agree nor Disagree,1,0,1,0,NA,NA,NA,NA,1,statements,More money sent directly back into the nhs rather than to the eu,1,5/4/22,5/4/22,R_1FzudSUEz3wVbYB,YES,Remain (Against Brexit),Somewhat Confident,NA,Neither Agree nor Disagree,NA,NA,NA,Neither Agree nor Disagree,Neither Agree nor Disagree,Somewhat Agree,NA,NA,NA,Somewhat Agree,Somewhat Disagree,Neither Agree nor Disagree,Never,Once or twice a year,39,Female,NA,"Undergraduate degree (BSc, BA)",NA,95,3,Remain,Leave
35,1651855353431,06/05/2022 16:42:33,1651855353253,1,06/05/2022 17:42:33,87571,2,task-l3ey,NA,21720415,6421723,NA,complete,NA,62754ee4e472c9f47831775e,mobile,undefined M2101K6G,Android 12,Chrome 98.0.4758.101,873x393,792x255,NA,ITT Ratings,3,Leave,10,NA,NA,NA,NA,NA,NA,NA,NA,ACCEPT,NA,batch10_REM,batch10_REM,61,33,1,Screen 1,continueButton,response_rating_scale_likert_active,4075.5,NA,NA,Disagree,1,0,1,0,NA,NA,NA,NA,1,statements,i think it would be better,1,5/4/22,5/4/22,R_2A126Q1TOCo5HJ5,YES,Remain (Against Brexit),Very confident,NA,Somewhat Agree,NA,NA,NA,Disagree,Somewhat Agree,Somewhat Disagree,NA,NA,NA,Somewhat Disagree,Somewhat Disagree,Somewhat Agree,Rarely,Once or twice a year,32,Female,NA,"Postgraduate degree (MSc, MA, MPhil)",NA,100,1,Remain,Leave
36,1651855358514,06/05/2022 16:42:38,1651855358398,1,06/05/2022 17:42:38,87571,2,task-l3ey,NA,21720415,6421723,NA,complete,NA,62754ee4e472c9f47831775e,mobile,undefined M2101K6G,Android 12,Chrome 98.0.4758.101,393x873,393x688,NA,ITT Ratings,3,Leave,10,NA,NA,NA,NA,NA,NA,NA,NA,ACCEPT,NA,batch10_REM,batch10_REM,47,34,1,Screen 1,continueButton,response_rating_scale_likert_active,5082.699999988079,NA,NA,Somewhat Agree,1,0,1,0,NA,NA,NA,NA,1,statements,Stability in being joined with other countries - both financial and social.,1,5/4/22,5/4/22,R_DkFtm34BTsS10dP,YES,Remain (Against Brexit),Confident,NA,Somewhat Agree,NA,NA,NA,Somewhat Disagree,Somewhat Disagree,Somewhat Agree,NA,NA,NA,Neither Agree nor Disagree,Somewhat Agree,Somewhat Disagree,A few times a year,Once or twice a year,25,Female,NA,"Postgraduate degree (MSc, MA, MPhil)",NA,98,2,Remain,Remain
37,1651855365459,06/05/2022 16:42:45,1651855365266,1,06/05/2022 17:42:45,87571,2,task-l3ey,NA,21720415,6421723,NA,complete,NA,62754ee4e472c9f47831775e,mobile,undefined M2101K6G,Android 12,Chrome 98.0.4758.101,873x393,792x255,NA,ITT Ratings,3,Leave,10,NA,NA,NA,NA,NA,NA,NA,NA,ACCEPT,NA,batch10_REM,batch10_REM,24,35,1,Screen 1,continueButton,response_rating_scale_likert_active,5303.799999952316,NA,NA,Somewhat Disagree,1,0,1,0,NA,NA,NA,NA,1,statements,We have more in common culturally with our EU neighbours than that which divides us,1,5/4/22,5/4/22,R_2cc4hvh2YdbJwRo,YES,Remain (Against Brexit),Confident,NA,Agree,NA,NA,NA,Disagree,Disagree,Disagree,NA,NA,NA,Disagree,Disagree,Disagree,Most weeks,Most weeks,54,Female,NA,"Undergraduate degree (BSc, BA)","I think that some of the answers on offer were a little simplistic. For example, I don't characterise a leave voter as ignorant just because they have a different persepective from me. I appreciate that they may have different concerns. I welcome their freedom to have a different opinion and however much I may disagree with it, I think categorizing either side as somehow more ignorant than one's own, is dangerous because it doesn't leave much room for healthy respectful debate. It is only by being open to the opposing view that we can really heal our differences. None of which lessens the fact that I enjoyed this study very much, thank you!",94,3,Remain,Remain
38,1651855368855,06/05/2022 16:42:48,1651855368709,1,06/05/2022 17:42:48,87571,2,task-l3ey,NA,21720415,6421723,NA,complete,NA,62754ee4e472c9f47831775e,mobile,undefined M2101K6G,Android 12,Chrome 98.0.4758.101,873x393,792x255,NA,ITT Ratings,3,Leave,10,NA,NA,NA,NA,NA,NA,NA,NA,ACCEPT,NA,batch10_REM,batch10_REM,41,36,1,Screen 1,continueButton,response_rating_scale_likert_active,3382.600000023842,NA,NA,Somewhat Disagree,1,0,1,0,NA,NA,NA,NA,1,statements,It now costs a fortune to take a pet to Europe with you on holiday.,1,5/4/22,5/4/22,R_2978MEunsk8Bqb7,YES,Remain (Against Brexit),Confident,NA,Disagree,NA,NA,NA,Disagree,Disagree,Disagree,NA,NA,NA,Disagree,Disagree,Disagree,Never,Most months,64,Female,NA,"Undergraduate degree (BSc, BA)",N/A,97,2,Remain,Remain
39,1651855372385,06/05/2022 16:42:52,1651855372219,1,06/05/2022 17:42:52,87571,2,task-l3ey,NA,21720415,6421723,NA,complete,NA,62754ee4e472c9f47831775e,mobile,undefined M2101K6G,Android 12,Chrome 98.0.4758.101,873x393,792x255,NA,ITT Ratings,3,Leave,10,NA,NA,NA,NA,NA,NA,NA,NA,ACCEPT,NA,batch10_REM,batch10_REM,6,37,1,Screen 1,continueButton,response_rating_scale_likert_active,3441.300000011921,NA,NA,Somewhat Disagree,1,0,1,0,NA,NA,NA,NA,1,statements,International influence and political sway,1,5/4/22,5/4/22,R_2rDDppxPgHGQAEp,YES,Remain (Against Brexit),Very confident,NA,Disagree,NA,NA,NA,Somewhat Agree,Neither Agree nor Disagree,Somewhat Agree,NA,NA,NA,Neither Agree nor Disagree,Neither Agree nor Disagree,Neither Agree nor Disagree,Rarely,Rarely,31,Female,NA,"Undergraduate degree (BSc, BA)",NA,91,3,Remain,Remain
40,1651855377870,06/05/2022 16:42:57,1651855377740,1,06/05/2022 17:42:57,87571,2,task-l3ey,NA,21720415,6421723,NA,complete,NA,62754ee4e472c9f47831775e,mobile,undefined M2101K6G,Android 12,Chrome 98.0.4758.101,393x873,393x688,NA,ITT Ratings,3,Leave,10,NA,NA,NA,NA,NA,NA,NA,NA,ACCEPT,NA,batch10_REM,batch10_REM,21,38,1,Screen 1,continueButton,response_rating_scale_likert_active,5459.600000023842,NA,NA,Agree,1,0,1,0,NA,NA,NA,NA,1,statements,There was the suggestion that we were paying too much to be members and if we took back that money we could spend it on the NHS.,1,5/4/22,5/4/22,R_3PBMe3j9V4zzDzA,YES,Remain (Against Brexit),Very confident,NA,Somewhat Agree,NA,NA,NA,Disagree,Somewhat Disagree,Somewhat Disagree,NA,NA,NA,Strongly Disagree,Strongly Disagree,Strongly Disagree,Rarely,A few times a year,58,Female,NA,"Undergraduate degree (BSc, BA)",No specific feedback except that I wish we hadn't left but I also wish the dialogue between the two sides was less bitter.,93,3,Remain,Leave
41,1651855381589,06/05/2022 16:43:01,1651855381413,1,06/05/2022 17:43:01,87571,2,task-l3ey,NA,21720415,6421723,NA,complete,NA,62754ee4e472c9f47831775e,mobile,undefined M2101K6G,Android 12,Chrome 98.0.4758.101,873x393,792x255,NA,ITT Ratings,3,Leave,10,NA,NA,NA,NA,NA,NA,NA,NA,ACCEPT,NA,batch10_REM,batch10_REM,30,39,1,Screen 1,continueButton,response_rating_scale_likert_active,2090.7999999523163,NA,NA,Somewhat Disagree,1,0,1,0,NA,NA,NA,NA,1,statements,Restriction on immigration,1,5/4/22,5/4/22,R_1FzudSUEz3wVbYB,YES,Remain (Against Brexit),Somewhat Confident,NA,Neither Agree nor Disagree,NA,NA,NA,Neither Agree nor Disagree,Neither Agree nor Disagree,Somewhat Agree,NA,NA,NA,Somewhat Agree,Somewhat Disagree,Neither Agree nor Disagree,Never,Once or twice a year,39,Female,NA,"Undergraduate degree (BSc, BA)",NA,95,3,Remain,Remain
42,1651855383107,06/05/2022 16:43:03,1651855382956,1,06/05/2022 17:43:02,87571,2,task-l3ey,NA,21720415,6421723,NA,complete,NA,62754ee4e472c9f47831775e,mobile,undefined M2101K6G,Android 12,Chrome 98.0.4758.101,873x393,792x255,NA,ITT Ratings,3,Leave,10,NA,NA,NA,NA,NA,NA,NA,NA,ACCEPT,NA,batch10_REM,batch10_REM,25,40,1,Screen 1,continueButton,response_rating_scale_likert_active,1508.899999976158,NA,NA,Somewhat Disagree,1,0,1,0,NA,NA,NA,NA,1,statements,Worry about competition for jobs,1,5/4/22,5/4/22,R_2cc4hvh2YdbJwRo,YES,Remain (Against Brexit),Confident,NA,Agree,NA,NA,NA,Disagree,Disagree,Disagree,NA,NA,NA,Disagree,Disagree,Disagree,Most weeks,Most weeks,54,Female,NA,"Undergraduate degree (BSc, BA)","I think that some of the answers on offer were a little simplistic. For example, I don't characterise a leave voter as ignorant just because they have a different persepective from me. I appreciate that they may have different concerns. I welcome their freedom to have a different opinion and however much I may disagree with it, I think categorizing either side as somehow more ignorant than one's own, is dangerous because it doesn't leave much room for healthy respectful debate. It is only by being open to the opposing view that we can really heal our differences. None of which lessens the fact that I enjoyed this study very much, thank you!",94,1,Remain,Leave
