Event.Index,UTC.Timestamp,UTC.Date,Local.Timestamp,Local.Timezone,Local.Date,Experiment.ID,Experiment.Version,Tree.Node.Key,Repeat.Key,Schedule.ID,Participant.Private.ID,Participant.Starting.Group,Participant.Status,Participant.Completion.Code,Participant.External.Session.ID,Participant.Device.Type,Participant.Device,Participant.OS,Participant.Browser,Participant.Monitor.Size,Participant.Viewport.Size,Checkpoint,Task.Name,Task.Version,branch.69an,randomiser.8vg2,quota.bqtt,quota.rycs,quota.wtfi,quota.usve,quota.zgic,quota.f3yz,quota.r9vy,quota.tfqq,quota.3dga,quota.kfqt,Spreadsheet,Spreadsheet.Name,Spreadsheet.Row,Trial.Number,Screen.Number,Screen.Name,Zone.Name,Zone.Type,Reaction.Time,Reaction.Onset,Response.Type,Response,Attempt,Correct,Incorrect,Dishonest,X.Coordinate,Y.Coordinate,Timed.Out,randomise_blocks,randomise_trials,display,Arguments,ShowProgressBar,StartDate,EndDate,ResponseId,CONSENT,LeaveOrRemain,brex_conf,stanely_L,stanley_R,intellectual_R_1,intellectual_R_2,intellectual_R_3,intellectual_L_1,intellectual_L_2,intellectual_L_3,morality_R_1,morality_R_2,morality_R_3,morality_L_1,morality_L_2,morality_L_3,discuss_1,read_1,age,gender,gender_4_TEXT,edu,anything_else,ID,arg_ID,Position,Arg_Position
1,1651853725659,06/05/2022 16:15:25,1651853725555,1,06/05/2022 17:15:25,87571,2,task-l3ey,NA,21719437,6421456,NA,complete,NA,6275495b1e93b165b3849c06,computer,Desktop or Laptop,Windows 10,Firefox 100.0,1920x1080,1920x927,NA,ITT Ratings,3,Leave,10,NA,NA,NA,NA,NA,NA,NA,NA,ACCEPT,NA,batch10_REM,NA,NA,BEGIN TASK,NA,NA,NA,NA,NA,NA,NA,NA,NA,0,1,0,NA,NA,NA,NA,NA,NA,NA,NA,NA,NA,NA,NA,NA,NA,NA,NA,NA,NA,NA,NA,NA,NA,NA,NA,NA,NA,NA,NA,NA,NA,NA,NA,NA,NA,NA,NA,NA,NA,NA
2,1651853730918,06/05/2022 16:15:30,1651853730838,1,06/05/2022 17:15:30,87571,2,task-l3ey,NA,21719437,6421456,NA,complete,NA,6275495b1e93b165b3849c06,computer,Desktop or Laptop,Windows 10,Firefox 100.0,1920x1080,1920x927,NA,ITT Ratings,3,Leave,10,NA,NA,NA,NA,NA,NA,NA,NA,ACCEPT,NA,batch10_REM,batch10_REM,1,1,1,Screen 1,advancementZone,continue_button,5225,NA,NA,NA,NA,0,1,0,NA,NA,NA,NA,NA,instructions,NA,NA,NA,NA,NA,NA,NA,NA,NA,NA,NA,NA,NA,NA,NA,NA,NA,NA,NA,NA,NA,NA,NA,NA,NA,NA,NA,NA,NA,NA,NA,NA,NA
3,1651853735573,06/05/2022 16:15:35,1651853735498,1,06/05/2022 17:15:35,87571,2,task-l3ey,NA,21719437,6421456,NA,complete,NA,6275495b1e93b165b3849c06,computer,Desktop or Laptop,Windows 10,Firefox 100.0,1920x1080,1920x927,NA,ITT Ratings,3,Leave,10,NA,NA,NA,NA,NA,NA,NA,NA,ACCEPT,NA,batch10_REM,batch10_REM,46,1,1,Screen 1,continueButton,response_rating_scale_likert_active,4638,NA,NA,Disagree,1,0,1,0,NA,NA,NA,NA,1,statements,Our economic situation would get worse if we left the EU,1,5/4/22,5/4/22,R_DkFtm34BTsS10dP,YES,Remain (Against Brexit),Confident,NA,Somewhat Agree,NA,NA,NA,Somewhat Disagree,Somewhat Disagree,Somewhat Agree,NA,NA,NA,Neither Agree nor Disagree,Somewhat Agree,Somewhat Disagree,A few times a year,Once or twice a year,25,Female,NA,"Postgraduate degree (MSc, MA, MPhil)",NA,98,1,Remain,Remain
4,1651853740593,06/05/2022 16:15:40,1651853740536,1,06/05/2022 17:15:40,87571,2,task-l3ey,NA,21719437,6421456,NA,complete,NA,6275495b1e93b165b3849c06,computer,Desktop or Laptop,Windows 10,Firefox 100.0,1920x1080,1920x927,NA,ITT Ratings,3,Leave,10,NA,NA,NA,NA,NA,NA,NA,NA,ACCEPT,NA,batch10_REM,batch10_REM,33,2,1,Screen 1,continueButton,response_rating_scale_likert_active,5022,NA,NA,Somewhat Agree,1,0,1,0,NA,NA,NA,NA,1,statements,More money sent directly back into the nhs rather than to the eu,1,5/4/22,5/4/22,R_1FzudSUEz3wVbYB,YES,Remain (Against Brexit),Somewhat Confident,NA,Neither Agree nor Disagree,NA,NA,NA,Neither Agree nor Disagree,Neither Agree nor Disagree,Somewhat Agree,NA,NA,NA,Somewhat Agree,Somewhat Disagree,Neither Agree nor Disagree,Never,Once or twice a year,39,Female,NA,"Undergraduate degree (BSc, BA)",NA,95,3,Remain,Leave
5,1651853750935,06/05/2022 16:15:50,1651853750877,1,06/05/2022 17:15:50,87571,2,task-l3ey,NA,21719437,6421456,NA,complete,NA,6275495b1e93b165b3849c06,computer,Desktop or Laptop,Windows 10,Firefox 100.0,1920x1080,1920x927,NA,ITT Ratings,3,Leave,10,NA,NA,NA,NA,NA,NA,NA,NA,ACCEPT,NA,batch10_REM,batch10_REM,19,3,1,Screen 1,continueButton,response_rating_scale_likert_active,10326,NA,NA,Agree,1,0,1,0,NA,NA,NA,NA,1,statements,Sovereignty. Certain media and politicians have been telling us all for years that Brussels is trying to lord it over us and deprive us of our sovereignty.,1,5/4/22,5/4/22,R_3PBMe3j9V4zzDzA,YES,Remain (Against Brexit),Very confident,NA,Somewhat Agree,NA,NA,NA,Disagree,Somewhat Disagree,Somewhat Disagree,NA,NA,NA,Strongly Disagree,Strongly Disagree,Strongly Disagree,Rarely,A few times a year,58,Female,NA,"Undergraduate degree (BSc, BA)",No specific feedback except that I wish we hadn't left but I also wish the dialogue between the two sides was less bitter.,93,1,Remain,Leave
6,1651853754850,06/05/2022 16:15:54,1651853754763,1,06/05/2022 17:15:54,87571,2,task-l3ey,NA,21719437,6421456,NA,complete,NA,6275495b1e93b165b3849c06,computer,Desktop or Laptop,Windows 10,Firefox 100.0,1920x1080,1920x927,NA,ITT Ratings,3,Leave,10,NA,NA,NA,NA,NA,NA,NA,NA,ACCEPT,NA,batch10_REM,batch10_REM,14,4,1,Screen 1,continueButton,response_rating_scale_likert_active,3873,NA,NA,Somewhat Disagree,1,0,1,0,NA,NA,NA,NA,1,statements,£300 mil that we spend on the EU each week will go to the NHS instead.,1,5/4/22,5/4/22,R_28CdLh75b5SHpU6,YES,Remain (Against Brexit),Very confident,NA,Strongly Disagree,NA,NA,NA,Agree,Somewhat Agree,Agree,NA,NA,NA,Neither Agree nor Disagree,Somewhat Agree,Neither Agree nor Disagree,Rarely,A few times a year,29,Female,NA,A levels,NA,92,2,Remain,Leave
7,1651853763890,06/05/2022 16:16:03,1651853763838,1,06/05/2022 17:16:03,87571,2,task-l3ey,NA,21719437,6421456,NA,complete,NA,6275495b1e93b165b3849c06,computer,Desktop or Laptop,Windows 10,Firefox 100.0,1920x1080,1920x927,NA,ITT Ratings,3,Leave,10,NA,NA,NA,NA,NA,NA,NA,NA,ACCEPT,NA,batch10_REM,batch10_REM,38,5,1,Screen 1,continueButton,response_rating_scale_likert_active,9063,NA,NA,Somewhat Agree,1,0,1,0,NA,NA,NA,NA,1,statements,I fear the effects of immigration (or immigrants themselves) and think leaving the EU will slow or prevent immigration.,1,5/4/22,5/4/22,R_32VBarFINVzl5jr,YES,Remain (Against Brexit),Very confident,NA,Disagree,NA,NA,NA,Neither Agree nor Disagree,Neither Agree nor Disagree,Somewhat Agree,NA,NA,NA,Neither Agree nor Disagree,Neither Agree nor Disagree,Neither Agree nor Disagree,Once or twice a year,A few times a year,31,Female,NA,"Undergraduate degree (BSc, BA)",NA,96,2,Remain,Leave
8,1651853766651,06/05/2022 16:16:06,1651853766580,1,06/05/2022 17:16:06,87571,2,task-l3ey,NA,21719437,6421456,NA,complete,NA,6275495b1e93b165b3849c06,computer,Desktop or Laptop,Windows 10,Firefox 100.0,1920x1080,1920x927,NA,ITT Ratings,3,Leave,10,NA,NA,NA,NA,NA,NA,NA,NA,ACCEPT,NA,batch10_REM,batch10_REM,28,6,1,Screen 1,continueButton,response_rating_scale_likert_active,2731,NA,NA,Disagree,1,0,1,0,NA,NA,NA,NA,1,statements,UK's borrowing would increase,1,5/4/22,5/4/22,R_1FzudSUEz3wVbYB,YES,Remain (Against Brexit),Somewhat Confident,NA,Neither Agree nor Disagree,NA,NA,NA,Neither Agree nor Disagree,Neither Agree nor Disagree,Somewhat Agree,NA,NA,NA,Somewhat Agree,Somewhat Disagree,Neither Agree nor Disagree,Never,Once or twice a year,39,Female,NA,"Undergraduate degree (BSc, BA)",NA,95,1,Remain,Remain
9,1651853772723,06/05/2022 16:16:12,1651853772665,1,06/05/2022 17:16:12,87571,2,task-l3ey,NA,21719437,6421456,NA,complete,NA,6275495b1e93b165b3849c06,computer,Desktop or Laptop,Windows 10,Firefox 100.0,1920x1080,1920x927,NA,ITT Ratings,3,Leave,10,NA,NA,NA,NA,NA,NA,NA,NA,ACCEPT,NA,batch10_REM,batch10_REM,29,7,1,Screen 1,continueButton,response_rating_scale_likert_active,6071,NA,NA,Disagree,1,0,1,0,NA,NA,NA,NA,1,statements,Trade will be affected,1,5/4/22,5/4/22,R_1FzudSUEz3wVbYB,YES,Remain (Against Brexit),Somewhat Confident,NA,Neither Agree nor Disagree,NA,NA,NA,Neither Agree nor Disagree,Neither Agree nor Disagree,Somewhat Agree,NA,NA,NA,Somewhat Agree,Somewhat Disagree,Neither Agree nor Disagree,Never,Once or twice a year,39,Female,NA,"Undergraduate degree (BSc, BA)",NA,95,2,Remain,Remain
10,1651853778349,06/05/2022 16:16:18,1651853778295,1,06/05/2022 17:16:18,87571,2,task-l3ey,NA,21719437,6421456,NA,complete,NA,6275495b1e93b165b3849c06,computer,Desktop or Laptop,Windows 10,Firefox 100.0,1920x1080,1920x927,NA,ITT Ratings,3,Leave,10,NA,NA,NA,NA,NA,NA,NA,NA,ACCEPT,NA,batch10_REM,batch10_REM,12,8,1,Screen 1,continueButton,response_rating_scale_likert_active,5616,NA,NA,Somewhat Disagree,1,0,1,0,NA,NA,NA,NA,1,statements,"Trading with the EU has been to our benefit, to cut ourselves off from that is going to hurt us and our economy.",1,5/4/22,5/4/22,R_28CdLh75b5SHpU6,YES,Remain (Against Brexit),Very confident,NA,Strongly Disagree,NA,NA,NA,Agree,Somewhat Agree,Agree,NA,NA,NA,Neither Agree nor Disagree,Somewhat Agree,Neither Agree nor Disagree,Rarely,A few times a year,29,Female,NA,A levels,NA,92,3,Remain,Remain
11,1651853782357,06/05/2022 16:16:22,1651853782300,1,06/05/2022 17:16:22,87571,2,task-l3ey,NA,21719437,6421456,NA,complete,NA,6275495b1e93b165b3849c06,computer,Desktop or Laptop,Windows 10,Firefox 100.0,1920x1080,1920x927,NA,ITT Ratings,3,Leave,10,NA,NA,NA,NA,NA,NA,NA,NA,ACCEPT,NA,batch10_REM,batch10_REM,63,9,1,Screen 1,continueButton,response_rating_scale_likert_active,3993,NA,NA,Neither Agree nor Disagree,1,0,1,0,NA,NA,NA,NA,1,statements,Politicians encouraged it,1,5/4/22,5/4/22,R_2A126Q1TOCo5HJ5,YES,Remain (Against Brexit),Very confident,NA,Somewhat Agree,NA,NA,NA,Disagree,Somewhat Agree,Somewhat Disagree,NA,NA,NA,Somewhat Disagree,Somewhat Disagree,Somewhat Agree,Rarely,Once or twice a year,32,Female,NA,"Postgraduate degree (MSc, MA, MPhil)",NA,100,3,Remain,Leave
12,1651853786652,06/05/2022 16:16:26,1651853786587,1,06/05/2022 17:16:26,87571,2,task-l3ey,NA,21719437,6421456,NA,complete,NA,6275495b1e93b165b3849c06,computer,Desktop or Laptop,Windows 10,Firefox 100.0,1920x1080,1920x927,NA,ITT Ratings,3,Leave,10,NA,NA,NA,NA,NA,NA,NA,NA,ACCEPT,NA,batch10_REM,batch10_REM,62,10,1,Screen 1,continueButton,response_rating_scale_likert_active,4276,NA,NA,Agree,1,0,1,0,NA,NA,NA,NA,1,statements,So that the country doesn't have to follow EU rules and regulations,1,5/4/22,5/4/22,R_2A126Q1TOCo5HJ5,YES,Remain (Against Brexit),Very confident,NA,Somewhat Agree,NA,NA,NA,Disagree,Somewhat Agree,Somewhat Disagree,NA,NA,NA,Somewhat Disagree,Somewhat Disagree,Somewhat Agree,Rarely,Once or twice a year,32,Female,NA,"Postgraduate degree (MSc, MA, MPhil)",NA,100,2,Remain,Leave
13,1651853791283,06/05/2022 16:16:31,1651853791218,1,06/05/2022 17:16:31,87571,2,task-l3ey,NA,21719437,6421456,NA,complete,NA,6275495b1e93b165b3849c06,computer,Desktop or Laptop,Windows 10,Firefox 100.0,1920x1080,1920x927,NA,ITT Ratings,3,Leave,10,NA,NA,NA,NA,NA,NA,NA,NA,ACCEPT,NA,batch10_REM,batch10_REM,37,11,1,Screen 1,continueButton,response_rating_scale_likert_active,4620,NA,NA,Agree,1,0,1,0,NA,NA,NA,NA,1,statements,"I value ""British identity"" and consider membership of the EU to be incompatible with that.",1,5/4/22,5/4/22,R_32VBarFINVzl5jr,YES,Remain (Against Brexit),Very confident,NA,Disagree,NA,NA,NA,Neither Agree nor Disagree,Neither Agree nor Disagree,Somewhat Agree,NA,NA,NA,Neither Agree nor Disagree,Neither Agree nor Disagree,Neither Agree nor Disagree,Once or twice a year,A few times a year,31,Female,NA,"Undergraduate degree (BSc, BA)",NA,96,1,Remain,Leave
14,1651853794253,06/05/2022 16:16:34,1651853794159,1,06/05/2022 17:16:34,87571,2,task-l3ey,NA,21719437,6421456,NA,complete,NA,6275495b1e93b165b3849c06,computer,Desktop or Laptop,Windows 10,Firefox 100.0,1920x1080,1920x927,NA,ITT Ratings,3,Leave,10,NA,NA,NA,NA,NA,NA,NA,NA,ACCEPT,NA,batch10_REM,batch10_REM,11,12,1,Screen 1,continueButton,response_rating_scale_likert_active,2929,NA,NA,Strongly Disagree,1,0,1,0,NA,NA,NA,NA,1,statements,"EU regulations are some of the best in the world, especially their human rights. It would be a shame to lose this for the UK.",1,5/4/22,5/4/22,R_28CdLh75b5SHpU6,YES,Remain (Against Brexit),Very confident,NA,Strongly Disagree,NA,NA,NA,Agree,Somewhat Agree,Agree,NA,NA,NA,Neither Agree nor Disagree,Somewhat Agree,Neither Agree nor Disagree,Rarely,A few times a year,29,Female,NA,A levels,NA,92,2,Remain,Remain
15,1651853800107,06/05/2022 16:16:40,1651853800045,1,06/05/2022 17:16:40,87571,2,task-l3ey,NA,21719437,6421456,NA,complete,NA,6275495b1e93b165b3849c06,computer,Desktop or Laptop,Windows 10,Firefox 100.0,1920x1080,1920x927,NA,ITT Ratings,3,Leave,10,NA,NA,NA,NA,NA,NA,NA,NA,ACCEPT,NA,batch10_REM,batch10_REM,60,13,1,Screen 1,continueButton,response_rating_scale_likert_active,5873,NA,NA,Somewhat Disagree,1,0,1,0,NA,NA,NA,NA,1,statements,To avoid problems with borders,1,5/4/22,5/4/22,R_2A126Q1TOCo5HJ5,YES,Remain (Against Brexit),Very confident,NA,Somewhat Agree,NA,NA,NA,Disagree,Somewhat Agree,Somewhat Disagree,NA,NA,NA,Somewhat Disagree,Somewhat Disagree,Somewhat Agree,Rarely,Once or twice a year,32,Female,NA,"Postgraduate degree (MSc, MA, MPhil)",NA,100,3,Remain,Remain
16,1651853810101,06/05/2022 16:16:50,1651853810024,1,06/05/2022 17:16:50,87571,2,task-l3ey,NA,21719437,6421456,NA,complete,NA,6275495b1e93b165b3849c06,computer,Desktop or Laptop,Windows 10,Firefox 100.0,1920x1080,1920x927,NA,ITT Ratings,3,Leave,10,NA,NA,NA,NA,NA,NA,NA,NA,ACCEPT,NA,batch10_REM,batch10_REM,36,14,1,Screen 1,continueButton,response_rating_scale_likert_active,9969,NA,NA,Strongly Disagree,1,0,1,0,NA,NA,NA,NA,1,statements,"The arguments put forward by the Leave campaign (e.g. the hateful and inaccurate ""LOOK AT ALL THESE SCARY IMMIGRANTS"" posters) were so awful that, frankly, opposing them felt right in itself.",1,5/4/22,5/4/22,R_32VBarFINVzl5jr,YES,Remain (Against Brexit),Very confident,NA,Disagree,NA,NA,NA,Neither Agree nor Disagree,Neither Agree nor Disagree,Somewhat Agree,NA,NA,NA,Neither Agree nor Disagree,Neither Agree nor Disagree,Neither Agree nor Disagree,Once or twice a year,A few times a year,31,Female,NA,"Undergraduate degree (BSc, BA)",NA,96,3,Remain,Remain
17,1651853821411,06/05/2022 16:17:01,1651853821355,1,06/05/2022 17:17:01,87571,2,task-l3ey,NA,21719437,6421456,NA,complete,NA,6275495b1e93b165b3849c06,computer,Desktop or Laptop,Windows 10,Firefox 100.0,1920x1080,1920x927,NA,ITT Ratings,3,Leave,10,NA,NA,NA,NA,NA,NA,NA,NA,ACCEPT,NA,batch10_REM,batch10_REM,5,15,1,Screen 1,continueButton,response_rating_scale_likert_active,11320,NA,NA,Somewhat Agree,1,0,1,0,NA,NA,NA,NA,1,statements,Freedom of movement between European countries and immigration,1,5/4/22,5/4/22,R_2rDDppxPgHGQAEp,YES,Remain (Against Brexit),Very confident,NA,Disagree,NA,NA,NA,Somewhat Agree,Neither Agree nor Disagree,Somewhat Agree,NA,NA,NA,Neither Agree nor Disagree,Neither Agree nor Disagree,Neither Agree nor Disagree,Rarely,Rarely,31,Female,NA,"Undergraduate degree (BSc, BA)",NA,91,2,Remain,Remain
18,1651853830238,06/05/2022 16:17:10,1651853830190,1,06/05/2022 17:17:10,87571,2,task-l3ey,NA,21719437,6421456,NA,complete,NA,6275495b1e93b165b3849c06,computer,Desktop or Laptop,Windows 10,Firefox 100.0,1920x1080,1920x927,NA,ITT Ratings,3,Leave,10,NA,NA,NA,NA,NA,NA,NA,NA,ACCEPT,NA,batch10_REM,batch10_REM,10,16,1,Screen 1,continueButton,response_rating_scale_likert_active,8823,NA,NA,Somewhat Agree,1,0,1,0,NA,NA,NA,NA,1,statements,Freedom of movement between the UK and EU making it easier to migrate across Europe if you wanted to.,1,5/4/22,5/4/22,R_28CdLh75b5SHpU6,YES,Remain (Against Brexit),Very confident,NA,Strongly Disagree,NA,NA,NA,Agree,Somewhat Agree,Agree,NA,NA,NA,Neither Agree nor Disagree,Somewhat Agree,Neither Agree nor Disagree,Rarely,A few times a year,29,Female,NA,A levels,NA,92,1,Remain,Remain
19,1651853833036,06/05/2022 16:17:13,1651853832980,1,06/05/2022 17:17:12,87571,2,task-l3ey,NA,21719437,6421456,NA,complete,NA,6275495b1e93b165b3849c06,computer,Desktop or Laptop,Windows 10,Firefox 100.0,1920x1080,1920x927,NA,ITT Ratings,3,Leave,10,NA,NA,NA,NA,NA,NA,NA,NA,ACCEPT,NA,batch10_REM,batch10_REM,18,17,1,Screen 1,continueButton,response_rating_scale_likert_active,2779,NA,NA,Strongly Disagree,1,0,1,0,NA,NA,NA,NA,1,statements,We are stronger as part of a larger community. On our own we are small and now rather pathetic.,1,5/4/22,5/4/22,R_3PBMe3j9V4zzDzA,YES,Remain (Against Brexit),Very confident,NA,Somewhat Agree,NA,NA,NA,Disagree,Somewhat Disagree,Somewhat Disagree,NA,NA,NA,Strongly Disagree,Strongly Disagree,Strongly Disagree,Rarely,A few times a year,58,Female,NA,"Undergraduate degree (BSc, BA)",No specific feedback except that I wish we hadn't left but I also wish the dialogue between the two sides was less bitter.,93,3,Remain,Remain
20,1651853838218,06/05/2022 16:17:18,1651853838146,1,06/05/2022 17:17:18,87571,2,task-l3ey,NA,21719437,6421456,NA,complete,NA,6275495b1e93b165b3849c06,computer,Desktop or Laptop,Windows 10,Firefox 100.0,1920x1080,1920x927,NA,ITT Ratings,3,Leave,10,NA,NA,NA,NA,NA,NA,NA,NA,ACCEPT,NA,batch10_REM,batch10_REM,61,18,1,Screen 1,continueButton,response_rating_scale_likert_active,5156,NA,NA,Disagree,1,0,1,0,NA,NA,NA,NA,1,statements,i think it would be better,1,5/4/22,5/4/22,R_2A126Q1TOCo5HJ5,YES,Remain (Against Brexit),Very confident,NA,Somewhat Agree,NA,NA,NA,Disagree,Somewhat Agree,Somewhat Disagree,NA,NA,NA,Somewhat Disagree,Somewhat Disagree,Somewhat Agree,Rarely,Once or twice a year,32,Female,NA,"Postgraduate degree (MSc, MA, MPhil)",NA,100,1,Remain,Leave
21,1651853843799,06/05/2022 16:17:23,1651853843737,1,06/05/2022 17:17:23,87571,2,task-l3ey,NA,21719437,6421456,NA,complete,NA,6275495b1e93b165b3849c06,computer,Desktop or Laptop,Windows 10,Firefox 100.0,1920x1080,1920x927,NA,ITT Ratings,3,Leave,10,NA,NA,NA,NA,NA,NA,NA,NA,ACCEPT,NA,batch10_REM,batch10_REM,17,19,1,Screen 1,continueButton,response_rating_scale_likert_active,5580,NA,NA,Neither Agree nor Disagree,1,0,1,0,NA,NA,NA,NA,1,statements,"Easier travel, work and study throughout the EU - how can this be a bad thing?",1,5/4/22,5/4/22,R_3PBMe3j9V4zzDzA,YES,Remain (Against Brexit),Very confident,NA,Somewhat Agree,NA,NA,NA,Disagree,Somewhat Disagree,Somewhat Disagree,NA,NA,NA,Strongly Disagree,Strongly Disagree,Strongly Disagree,Rarely,A few times a year,58,Female,NA,"Undergraduate degree (BSc, BA)",No specific feedback except that I wish we hadn't left but I also wish the dialogue between the two sides was less bitter.,93,2,Remain,Remain
22,1651853849039,06/05/2022 16:17:29,1651853848982,1,06/05/2022 17:17:28,87571,2,task-l3ey,NA,21719437,6421456,NA,complete,NA,6275495b1e93b165b3849c06,computer,Desktop or Laptop,Windows 10,Firefox 100.0,1920x1080,1920x927,NA,ITT Ratings,3,Leave,10,NA,NA,NA,NA,NA,NA,NA,NA,ACCEPT,NA,batch10_REM,batch10_REM,41,20,1,Screen 1,continueButton,response_rating_scale_likert_active,5235,NA,NA,Disagree,1,0,1,0,NA,NA,NA,NA,1,statements,It now costs a fortune to take a pet to Europe with you on holiday.,1,5/4/22,5/4/22,R_2978MEunsk8Bqb7,YES,Remain (Against Brexit),Confident,NA,Disagree,NA,NA,NA,Disagree,Disagree,Disagree,NA,NA,NA,Disagree,Disagree,Disagree,Never,Most months,64,Female,NA,"Undergraduate degree (BSc, BA)",N/A,97,2,Remain,Remain
23,1651853852575,06/05/2022 16:17:32,1651853852524,1,06/05/2022 17:17:32,87571,2,task-l3ey,NA,21719437,6421456,NA,complete,NA,6275495b1e93b165b3849c06,computer,Desktop or Laptop,Windows 10,Firefox 100.0,1920x1080,1920x927,NA,ITT Ratings,3,Leave,10,NA,NA,NA,NA,NA,NA,NA,NA,ACCEPT,NA,batch10_REM,batch10_REM,13,21,1,Screen 1,continueButton,response_rating_scale_likert_active,3531,NA,NA,Somewhat Agree,1,0,1,0,NA,NA,NA,NA,1,statements,EU immigrants can no longer 'take' the jobs of UK citizens.,1,5/4/22,5/4/22,R_28CdLh75b5SHpU6,YES,Remain (Against Brexit),Very confident,NA,Strongly Disagree,NA,NA,NA,Agree,Somewhat Agree,Agree,NA,NA,NA,Neither Agree nor Disagree,Somewhat Agree,Neither Agree nor Disagree,Rarely,A few times a year,29,Female,NA,A levels,NA,92,1,Remain,Leave
24,1651853855825,06/05/2022 16:17:35,1651853855762,1,06/05/2022 17:17:35,87571,2,task-l3ey,NA,21719437,6421456,NA,complete,NA,6275495b1e93b165b3849c06,computer,Desktop or Laptop,Windows 10,Firefox 100.0,1920x1080,1920x927,NA,ITT Ratings,3,Leave,10,NA,NA,NA,NA,NA,NA,NA,NA,ACCEPT,NA,batch10_REM,batch10_REM,44,22,1,Screen 1,continueButton,response_rating_scale_likert_active,3227,NA,NA,Agree,1,0,1,0,NA,NA,NA,NA,1,statements,We want to make our own laws,1,5/4/22,5/4/22,R_2978MEunsk8Bqb7,YES,Remain (Against Brexit),Confident,NA,Disagree,NA,NA,NA,Disagree,Disagree,Disagree,NA,NA,NA,Disagree,Disagree,Disagree,Never,Most months,64,Female,NA,"Undergraduate degree (BSc, BA)",N/A,97,2,Remain,Leave
25,1651853864634,06/05/2022 16:17:44,1651853864575,1,06/05/2022 17:17:44,87571,2,task-l3ey,NA,21719437,6421456,NA,complete,NA,6275495b1e93b165b3849c06,computer,Desktop or Laptop,Windows 10,Firefox 100.0,1920x1080,1920x927,NA,ITT Ratings,3,Leave,10,NA,NA,NA,NA,NA,NA,NA,NA,ACCEPT,NA,batch10_REM,batch10_REM,21,23,1,Screen 1,continueButton,response_rating_scale_likert_active,8803,NA,NA,Somewhat Agree,1,0,1,0,NA,NA,NA,NA,1,statements,There was the suggestion that we were paying too much to be members and if we took back that money we could spend it on the NHS.,1,5/4/22,5/4/22,R_3PBMe3j9V4zzDzA,YES,Remain (Against Brexit),Very confident,NA,Somewhat Agree,NA,NA,NA,Disagree,Somewhat Disagree,Somewhat Disagree,NA,NA,NA,Strongly Disagree,Strongly Disagree,Strongly Disagree,Rarely,A few times a year,58,Female,NA,"Undergraduate degree (BSc, BA)",No specific feedback except that I wish we hadn't left but I also wish the dialogue between the two sides was less bitter.,93,3,Remain,Leave
26,1651853867786,06/05/2022 16:17:47,1651853867717,1,06/05/2022 17:17:47,87571,2,task-l3ey,NA,21719437,6421456,NA,complete,NA,6275495b1e93b165b3849c06,computer,Desktop or Laptop,Windows 10,Firefox 100.0,1920x1080,1920x927,NA,ITT Ratings,3,Leave,10,NA,NA,NA,NA,NA,NA,NA,NA,ACCEPT,NA,batch10_REM,batch10_REM,16,24,1,Screen 1,continueButton,response_rating_scale_likert_active,3131,NA,NA,Somewhat Disagree,1,0,1,0,NA,NA,NA,NA,1,statements,Easier trading with our closest geographic neighbours.,1,5/4/22,5/4/22,R_3PBMe3j9V4zzDzA,YES,Remain (Against Brexit),Very confident,NA,Somewhat Agree,NA,NA,NA,Disagree,Somewhat Disagree,Somewhat Disagree,NA,NA,NA,Strongly Disagree,Strongly Disagree,Strongly Disagree,Rarely,A few times a year,58,Female,NA,"Undergraduate degree (BSc, BA)",No specific feedback except that I wish we hadn't left but I also wish the dialogue between the two sides was less bitter.,93,1,Remain,Remain
27,1651853872687,06/05/2022 16:17:52,1651853872627,1,06/05/2022 17:17:52,87571,2,task-l3ey,NA,21719437,6421456,NA,complete,NA,6275495b1e93b165b3849c06,computer,Desktop or Laptop,Windows 10,Firefox 100.0,1920x1080,1920x927,NA,ITT Ratings,3,Leave,10,NA,NA,NA,NA,NA,NA,NA,NA,ACCEPT,NA,batch10_REM,batch10_REM,39,25,1,Screen 1,continueButton,response_rating_scale_likert_active,4900,NA,NA,Disagree,1,0,1,0,NA,NA,NA,NA,1,statements,"I'm unhappy with the status quo and am making a ""protest vote"", or a vote for ""change"" generally.",1,5/4/22,5/4/22,R_32VBarFINVzl5jr,YES,Remain (Against Brexit),Very confident,NA,Disagree,NA,NA,NA,Neither Agree nor Disagree,Neither Agree nor Disagree,Somewhat Agree,NA,NA,NA,Neither Agree nor Disagree,Neither Agree nor Disagree,Neither Agree nor Disagree,Once or twice a year,A few times a year,31,Female,NA,"Undergraduate degree (BSc, BA)",NA,96,3,Remain,Leave
28,1651853877116,06/05/2022 16:17:57,1651853877040,1,06/05/2022 17:17:57,87571,2,task-l3ey,NA,21719437,6421456,NA,complete,NA,6275495b1e93b165b3849c06,computer,Desktop or Laptop,Windows 10,Firefox 100.0,1920x1080,1920x927,NA,ITT Ratings,3,Leave,10,NA,NA,NA,NA,NA,NA,NA,NA,ACCEPT,NA,batch10_REM,batch10_REM,59,26,1,Screen 1,continueButton,response_rating_scale_likert_active,4403,NA,NA,Neither Agree nor Disagree,1,0,1,0,NA,NA,NA,NA,1,statements,Protect peace in Northern Ireland,1,5/4/22,5/4/22,R_2A126Q1TOCo5HJ5,YES,Remain (Against Brexit),Very confident,NA,Somewhat Agree,NA,NA,NA,Disagree,Somewhat Agree,Somewhat Disagree,NA,NA,NA,Somewhat Disagree,Somewhat Disagree,Somewhat Agree,Rarely,Once or twice a year,32,Female,NA,"Postgraduate degree (MSc, MA, MPhil)",NA,100,2,Remain,Remain
29,1651853880120,06/05/2022 16:18:00,1651853880062,1,06/05/2022 17:18:00,87571,2,task-l3ey,NA,21719437,6421456,NA,complete,NA,6275495b1e93b165b3849c06,computer,Desktop or Laptop,Windows 10,Firefox 100.0,1920x1080,1920x927,NA,ITT Ratings,3,Leave,10,NA,NA,NA,NA,NA,NA,NA,NA,ACCEPT,NA,batch10_REM,batch10_REM,34,27,1,Screen 1,continueButton,response_rating_scale_likert_active,3013,NA,NA,Disagree,1,0,1,0,NA,NA,NA,NA,1,statements,Being part of the EU had more benefits than costs for the UK,1,5/4/22,5/4/22,R_32VBarFINVzl5jr,YES,Remain (Against Brexit),Very confident,NA,Disagree,NA,NA,NA,Neither Agree nor Disagree,Neither Agree nor Disagree,Somewhat Agree,NA,NA,NA,Neither Agree nor Disagree,Neither Agree nor Disagree,Neither Agree nor Disagree,Once or twice a year,A few times a year,31,Female,NA,"Undergraduate degree (BSc, BA)",NA,96,1,Remain,Remain
30,1651853884331,06/05/2022 16:18:04,1651853884268,1,06/05/2022 17:18:04,87571,2,task-l3ey,NA,21719437,6421456,NA,complete,NA,6275495b1e93b165b3849c06,computer,Desktop or Laptop,Windows 10,Firefox 100.0,1920x1080,1920x927,NA,ITT Ratings,3,Leave,10,NA,NA,NA,NA,NA,NA,NA,NA,ACCEPT,NA,batch10_REM,batch10_REM,57,28,1,Screen 1,continueButton,response_rating_scale_likert_active,4194,NA,NA,Disagree,1,0,1,0,NA,NA,NA,NA,1,statements,i dont like immigrants,1,5/4/22,5/4/22,R_3090zRXcgf2gFrE,YES,Remain (Against Brexit),Very confident,NA,Disagree,NA,NA,NA,Disagree,Agree,Agree,NA,NA,NA,Neither Agree nor Disagree,Neither Agree nor Disagree,Neither Agree nor Disagree,Rarely,A few times a year,30,Male,NA,"GCSEs,Vocational Training / Apprenticeship",NA,99,3,Remain,Leave
