Event.Index,UTC.Timestamp,UTC.Date,Local.Timestamp,Local.Timezone,Local.Date,Experiment.ID,Experiment.Version,Tree.Node.Key,Repeat.Key,Schedule.ID,Participant.Private.ID,Participant.Starting.Group,Participant.Status,Participant.Completion.Code,Participant.External.Session.ID,Participant.Device.Type,Participant.Device,Participant.OS,Participant.Browser,Participant.Monitor.Size,Participant.Viewport.Size,Checkpoint,Task.Name,Task.Version,branch.69an,randomiser.8vg2,quota.bqtt,quota.rycs,quota.wtfi,quota.usve,quota.zgic,quota.f3yz,quota.r9vy,quota.tfqq,quota.3dga,quota.kfqt,Spreadsheet,Spreadsheet.Name,Spreadsheet.Row,Trial.Number,Screen.Number,Screen.Name,Zone.Name,Zone.Type,Reaction.Time,Reaction.Onset,Response.Type,Response,Attempt,Correct,Incorrect,Dishonest,X.Coordinate,Y.Coordinate,Timed.Out,randomise_blocks,randomise_trials,display,Arguments,ShowProgressBar,StartDate,EndDate,ResponseId,CONSENT,LeaveOrRemain,brex_conf,stanely_L,stanley_R,intellectual_R_1,intellectual_R_2,intellectual_R_3,intellectual_L_1,intellectual_L_2,intellectual_L_3,morality_R_1,morality_R_2,morality_R_3,morality_L_1,morality_L_2,morality_L_3,discuss_1,read_1,age,gender,gender_4_TEXT,edu,anything_else,ID,arg_ID,Position,Arg_Position
1,1651589251098,03/05/2022 14:47:31,1651589251535,1,03/05/2022 15:47:31,85800,7,task-t3d4,NA,21642419,6399237,NA,complete,NA,62714063e9db12e15cec4361,computer,Desktop or Laptop,Windows 10,Chrome 100.0.4896.127,1280x720,1280x577,NA,ITT Ratings,4,Remain,2,ACCEPT,NA,NA,NA,NA,NA,NA,NA,NA,NA,batch2_leavers,NA,NA,BEGIN TASK,NA,NA,NA,NA,NA,NA,NA,NA,NA,0,1,0,NA,NA,NA,NA,NA,NA,NA,NA,NA,NA,NA,NA,NA,NA,NA,NA,NA,NA,NA,NA,NA,NA,NA,NA,NA,NA,NA,NA,NA,NA,NA,NA,NA,NA,NA,NA,NA,NA,NA
2,1651589254231,03/05/2022 14:47:34,1651589254712,1,03/05/2022 15:47:34,85800,7,task-t3d4,NA,21642419,6399237,NA,complete,NA,62714063e9db12e15cec4361,computer,Desktop or Laptop,Windows 10,Chrome 100.0.4896.127,1280x720,1280x577,NA,ITT Ratings,4,Remain,2,ACCEPT,NA,NA,NA,NA,NA,NA,NA,NA,NA,batch2_leavers,batch2_leavers,1,1,1,Screen 1,advancementZone,continue_button,3121.699999988079,NA,NA,NA,NA,0,1,0,NA,NA,NA,NA,NA,instructions,NA,NA,NA,NA,NA,NA,NA,NA,NA,NA,NA,NA,NA,NA,NA,NA,NA,NA,NA,NA,NA,NA,NA,NA,NA,NA,NA,NA,NA,NA,NA,NA,NA
3,1651589259474,03/05/2022 14:47:39,1651589259974,1,03/05/2022 15:47:39,85800,7,task-t3d4,NA,21642419,6399237,NA,complete,NA,62714063e9db12e15cec4361,computer,Desktop or Laptop,Windows 10,Chrome 100.0.4896.127,1280x720,1280x577,NA,ITT Ratings,4,Remain,2,ACCEPT,NA,NA,NA,NA,NA,NA,NA,NA,NA,batch2_leavers,batch2_leavers,51,1,1,Screen 1,continueButton,response_rating_scale_likert_active,5242.900000035763,NA,NA,Strongly Disagree,1,0,1,0,NA,NA,NA,NA,1,statements,LAws we can make our own laws,1,4/4/22,4/4/22,R_XueMc9y41rJsqhr,YES,Leave (For Brexit),Undecided,Neither Agree nor Disagree,NA,Neither Agree nor Disagree,Neither Agree nor Disagree,Neither Agree nor Disagree,NA,NA,NA,Neither Agree nor Disagree,Neither Agree nor Disagree,Neither Agree nor Disagree,NA,NA,NA,Never,Never,35,Female,NA,GCSEs,NA,18,3,Leave,Leave
4,1651589263428,03/05/2022 14:47:43,1651589263918,1,03/05/2022 15:47:43,85800,7,task-t3d4,NA,21642419,6399237,NA,complete,NA,62714063e9db12e15cec4361,computer,Desktop or Laptop,Windows 10,Chrome 100.0.4896.127,1280x720,1280x577,NA,ITT Ratings,4,Remain,2,ACCEPT,NA,NA,NA,NA,NA,NA,NA,NA,NA,batch2_leavers,batch2_leavers,5,2,1,Screen 1,continueButton,response_rating_scale_likert_active,3919.699999988079,NA,NA,Strongly Disagree,1,0,1,0,NA,NA,NA,NA,1,statements,The 'right' thing to do,1,4/4/22,4/4/22,R_2uHXR6x7eQTfyVD,YES,Leave (For Brexit),Very confident,Agree,NA,Strongly Disagree,Strongly Disagree,Strongly Disagree,NA,NA,NA,Strongly Disagree,Strongly Disagree,Strongly Disagree,NA,NA,NA,Rarely,Rarely,32,Male,NA,Doctorate (PhD),-,11,2,Leave,Remain
5,1651589281462,03/05/2022 14:48:01,1651589281971,1,03/05/2022 15:48:01,85800,7,task-t3d4,NA,21642419,6399237,NA,complete,NA,62714063e9db12e15cec4361,computer,Desktop or Laptop,Windows 10,Chrome 100.0.4896.127,1280x720,1280x577,NA,ITT Ratings,4,Remain,2,ACCEPT,NA,NA,NA,NA,NA,NA,NA,NA,NA,batch2_leavers,batch2_leavers,33,3,1,Screen 1,continueButton,response_rating_scale_likert_active,18041.39999997616,NA,NA,Somewhat Disagree,1,0,1,0,NA,NA,NA,NA,1,statements,Countries unequal in economy leading to disproportionate immigration which then leads to social tensions,1,4/4/22,4/4/22,R_ThFGcCdnwHRGsZr,YES,Leave (For Brexit),Undecided,Agree,NA,Disagree,Disagree,Disagree,NA,NA,NA,Disagree,Strongly Disagree,Strongly Disagree,NA,NA,NA,Never,Never,41,Male,NA,"Undergraduate degree (BSc, BA)",NA,15,3,Leave,Leave
6,1651589284407,03/05/2022 14:48:04,1651589284904,1,03/05/2022 15:48:04,85800,7,task-t3d4,NA,21642419,6399237,NA,complete,NA,62714063e9db12e15cec4361,computer,Desktop or Laptop,Windows 10,Chrome 100.0.4896.127,1280x720,1280x577,NA,ITT Ratings,4,Remain,2,ACCEPT,NA,NA,NA,NA,NA,NA,NA,NA,NA,batch2_leavers,batch2_leavers,9,4,1,Screen 1,continueButton,response_rating_scale_likert_active,2913.2000000476837,NA,NA,Strongly Disagree,1,0,1,0,NA,NA,NA,NA,1,statements,"More money for the UK, instead of paying for the EU",1,4/4/22,4/4/22,R_2uHXR6x7eQTfyVD,YES,Leave (For Brexit),Very confident,Agree,NA,Strongly Disagree,Strongly Disagree,Strongly Disagree,NA,NA,NA,Strongly Disagree,Strongly Disagree,Strongly Disagree,NA,NA,NA,Rarely,Rarely,32,Male,NA,Doctorate (PhD),-,11,3,Leave,Leave
7,1651589287456,03/05/2022 14:48:07,1651589287959,1,03/05/2022 15:48:07,85800,7,task-t3d4,NA,21642419,6399237,NA,complete,NA,62714063e9db12e15cec4361,computer,Desktop or Laptop,Windows 10,Chrome 100.0.4896.127,1280x720,1280x577,NA,ITT Ratings,4,Remain,2,ACCEPT,NA,NA,NA,NA,NA,NA,NA,NA,NA,batch2_leavers,batch2_leavers,2,5,1,Screen 1,continueButton,response_rating_scale_likert_active,3042,NA,NA,Somewhat Agree,1,0,1,0,NA,NA,NA,NA,1,statements,We would like to check you are reading each argument carefully. Please select 'Somewhat Agree' for this answer,1,NA,NA,NA,NA,NA,NA,NA,NA,NA,NA,NA,NA,NA,NA,NA,NA,NA,NA,NA,NA,NA,NA,NA,NA,NA,NA,NA,NA,check1,NA,NA
8,1651589290732,03/05/2022 14:48:10,1651589291242,1,03/05/2022 15:48:11,85800,7,task-t3d4,NA,21642419,6399237,NA,complete,NA,62714063e9db12e15cec4361,computer,Desktop or Laptop,Windows 10,Chrome 100.0.4896.127,1280x720,1280x577,NA,ITT Ratings,4,Remain,2,ACCEPT,NA,NA,NA,NA,NA,NA,NA,NA,NA,batch2_leavers,batch2_leavers,48,6,1,Screen 1,continueButton,response_rating_scale_likert_active,3256.5,NA,NA,Strongly Disagree,1,0,1,0,NA,NA,NA,NA,1,statements,by allowing them to trade more freely with non-EU markets. F,1,4/4/22,4/4/22,R_XueMc9y41rJsqhr,YES,Leave (For Brexit),Undecided,Neither Agree nor Disagree,NA,Neither Agree nor Disagree,Neither Agree nor Disagree,Neither Agree nor Disagree,NA,NA,NA,Neither Agree nor Disagree,Neither Agree nor Disagree,Neither Agree nor Disagree,NA,NA,NA,Never,Never,35,Female,NA,GCSEs,NA,18,3,Leave,Remain
9,1651589293138,03/05/2022 14:48:13,1651589293412,1,03/05/2022 15:48:13,85800,7,task-t3d4,NA,21642419,6399237,NA,complete,NA,62714063e9db12e15cec4361,computer,Desktop or Laptop,Windows 10,Chrome 100.0.4896.127,1280x720,1280x577,NA,ITT Ratings,4,Remain,2,ACCEPT,NA,NA,NA,NA,NA,NA,NA,NA,NA,batch2_leavers,batch2_leavers,16,7,1,Screen 1,continueButton,response_rating_scale_likert_active,2153.100000023842,NA,NA,Strongly Disagree,1,0,1,0,NA,NA,NA,NA,1,statements,better and easier trading,1,4/4/22,4/4/22,R_3hrt3qakK6SasVx,YES,Leave (For Brexit),Undecided,Neither Agree nor Disagree,NA,Disagree,Disagree,Disagree,NA,NA,NA,Disagree,Strongly Disagree,Strongly Disagree,NA,NA,NA,Never,Never,58,Female,NA,GCSEs,NA,13,1,Leave,Remain
10,1651589294904,03/05/2022 14:48:14,1651589295400,1,03/05/2022 15:48:15,85800,7,task-t3d4,NA,21642419,6399237,NA,complete,NA,62714063e9db12e15cec4361,computer,Desktop or Laptop,Windows 10,Chrome 100.0.4896.127,1280x720,1280x577,NA,ITT Ratings,4,Remain,2,ACCEPT,NA,NA,NA,NA,NA,NA,NA,NA,NA,batch2_leavers,batch2_leavers,41,8,1,Screen 1,continueButton,response_rating_scale_likert_active,1967,NA,NA,Strongly Disagree,1,0,1,0,NA,NA,NA,NA,1,statements,"prices staying the same, no big increases",1,4/4/22,4/4/22,R_2U5TinR5nYU5ezP,YES,Leave (For Brexit),Doubtful,Neither Agree nor Disagree,NA,Neither Agree nor Disagree,Neither Agree nor Disagree,Neither Agree nor Disagree,NA,NA,NA,Neither Agree nor Disagree,Neither Agree nor Disagree,Neither Agree nor Disagree,NA,NA,NA,Rarely,Rarely,35,Male,NA,GCSEs,"I regret voting leave, we were all misled",17,2,Leave,Remain
11,1651589296323,03/05/2022 14:48:16,1651589296836,1,03/05/2022 15:48:16,85800,7,task-t3d4,NA,21642419,6399237,NA,complete,NA,62714063e9db12e15cec4361,computer,Desktop or Laptop,Windows 10,Chrome 100.0.4896.127,1280x720,1280x577,NA,ITT Ratings,4,Remain,2,ACCEPT,NA,NA,NA,NA,NA,NA,NA,NA,NA,batch2_leavers,batch2_leavers,58,9,1,Screen 1,continueButton,response_rating_scale_likert_active,1416.9000000357628,NA,NA,Strongly Disagree,1,0,1,0,NA,NA,NA,NA,1,statements,Better the devil you know than the devil you don't.,1,4/4/22,4/4/22,R_1plK5bEvI0ZVhcf,YES,Leave (For Brexit),Very confident,Agree,NA,Neither Agree nor Disagree,Somewhat Agree,Somewhat Disagree,NA,NA,NA,Neither Agree nor Disagree,Somewhat Disagree,Somewhat Disagree,NA,NA,NA,Once or twice a year,Rarely,65,Male,NA,"Undergraduate degree (BSc, BA)",BREXIT is an old topic!  Hard to give an opinion on someone who might have different (wrong!) views..,20,1,Leave,Remain
12,1651589298527,03/05/2022 14:48:18,1651589298946,1,03/05/2022 15:48:18,85800,7,task-t3d4,NA,21642419,6399237,NA,complete,NA,62714063e9db12e15cec4361,computer,Desktop or Laptop,Windows 10,Chrome 100.0.4896.127,1280x720,1280x577,NA,ITT Ratings,4,Remain,2,ACCEPT,NA,NA,NA,NA,NA,NA,NA,NA,NA,batch2_leavers,batch2_leavers,14,10,1,Screen 1,continueButton,response_rating_scale_likert_active,2087.699999988079,NA,NA,Strongly Disagree,1,0,1,0,NA,NA,NA,NA,1,statements,To make sure that jobs are available for british people,1,4/4/22,4/4/22,R_2fx4jZCqukB0nan,YES,Leave (For Brexit),Very Doubtful,Agree,NA,Strongly Disagree,Strongly Disagree,Strongly Disagree,NA,NA,NA,Disagree,Disagree,Disagree,NA,NA,NA,Rarely,Rarely,56,Female,NA,A levels,I voted leave because I believed the rubbish spouted by Johnson on saving money and redirecting it to the NHS.  I soon learnt that this was not true and wish I had voted remain but was relieved that my borough did come back with a remain win.,12,2,Leave,Leave
13,1651589300605,03/05/2022 14:48:20,1651589301103,1,03/05/2022 15:48:21,85800,7,task-t3d4,NA,21642419,6399237,NA,complete,NA,62714063e9db12e15cec4361,computer,Desktop or Laptop,Windows 10,Chrome 100.0.4896.127,1280x720,1280x577,NA,ITT Ratings,4,Remain,2,ACCEPT,NA,NA,NA,NA,NA,NA,NA,NA,NA,batch2_leavers,batch2_leavers,63,11,1,Screen 1,continueButton,response_rating_scale_likert_active,2143.7999999523163,NA,NA,Strongly Disagree,1,0,1,0,NA,NA,NA,NA,1,statements,Greater world opportunities for trade,1,4/4/22,4/4/22,R_1plK5bEvI0ZVhcf,YES,Leave (For Brexit),Very confident,Agree,NA,Neither Agree nor Disagree,Somewhat Agree,Somewhat Disagree,NA,NA,NA,Neither Agree nor Disagree,Somewhat Disagree,Somewhat Disagree,NA,NA,NA,Once or twice a year,Rarely,65,Male,NA,"Undergraduate degree (BSc, BA)",BREXIT is an old topic!  Hard to give an opinion on someone who might have different (wrong!) views..,20,3,Leave,Leave
14,1651589302120,03/05/2022 14:48:22,1651589302618,1,03/05/2022 15:48:22,85800,7,task-t3d4,NA,21642419,6399237,NA,complete,NA,62714063e9db12e15cec4361,computer,Desktop or Laptop,Windows 10,Chrome 100.0.4896.127,1280x720,1280x577,NA,ITT Ratings,4,Remain,2,ACCEPT,NA,NA,NA,NA,NA,NA,NA,NA,NA,batch2_leavers,batch2_leavers,57,12,1,Screen 1,continueButton,response_rating_scale_likert_active,1496.4000000357628,NA,NA,Strongly Disagree,1,0,1,0,NA,NA,NA,NA,1,statements,Because I believe something I have read online,1,4/4/22,4/4/22,R_3KwoKE9FW0C2EVe,YES,Leave (For Brexit),Somewhat doubtful,Somewhat Agree,NA,Strongly Disagree,Strongly Disagree,Strongly Disagree,NA,NA,NA,Strongly Disagree,Strongly Disagree,Strongly Disagree,NA,NA,NA,Never,Never,30,Female,NA,"Undergraduate degree (BSc, BA)",NA,19,3,Leave,Leave
15,1651589306195,03/05/2022 14:48:26,1651589306709,1,03/05/2022 15:48:26,85800,7,task-t3d4,NA,21642419,6399237,NA,complete,NA,62714063e9db12e15cec4361,computer,Desktop or Laptop,Windows 10,Chrome 100.0.4896.127,1280x720,1280x577,NA,ITT Ratings,4,Remain,2,ACCEPT,NA,NA,NA,NA,NA,NA,NA,NA,NA,batch2_leavers,batch2_leavers,15,13,1,Screen 1,continueButton,response_rating_scale_likert_active,4071.199999988079,NA,NA,Strongly Disagree,1,0,1,0,NA,NA,NA,NA,1,statements,To stop people coming into the country and claiming benefits and taking priority on the council housing list,1,4/4/22,4/4/22,R_2fx4jZCqukB0nan,YES,Leave (For Brexit),Very Doubtful,Agree,NA,Strongly Disagree,Strongly Disagree,Strongly Disagree,NA,NA,NA,Disagree,Disagree,Disagree,NA,NA,NA,Rarely,Rarely,56,Female,NA,A levels,I voted leave because I believed the rubbish spouted by Johnson on saving money and redirecting it to the NHS.  I soon learnt that this was not true and wish I had voted remain but was relieved that my borough did come back with a remain win.,12,3,Leave,Leave
16,1651589308856,03/05/2022 14:48:28,1651589309351,1,03/05/2022 15:48:29,85800,7,task-t3d4,NA,21642419,6399237,NA,complete,NA,62714063e9db12e15cec4361,computer,Desktop or Laptop,Windows 10,Chrome 100.0.4896.127,1280x720,1280x577,NA,ITT Ratings,4,Remain,2,ACCEPT,NA,NA,NA,NA,NA,NA,NA,NA,NA,batch2_leavers,batch2_leavers,45,14,1,Screen 1,continueButton,response_rating_scale_likert_active,2627.5,NA,NA,Strongly Disagree,1,0,1,0,NA,NA,NA,NA,1,statements,"own laws, the european courts deciding things rather than us",1,4/4/22,4/4/22,R_2U5TinR5nYU5ezP,YES,Leave (For Brexit),Doubtful,Neither Agree nor Disagree,NA,Neither Agree nor Disagree,Neither Agree nor Disagree,Neither Agree nor Disagree,NA,NA,NA,Neither Agree nor Disagree,Neither Agree nor Disagree,Neither Agree nor Disagree,NA,NA,NA,Rarely,Rarely,35,Male,NA,GCSEs,"I regret voting leave, we were all misled",17,3,Leave,Leave
17,1651589322996,03/05/2022 14:48:42,1651589323505,1,03/05/2022 15:48:43,85800,7,task-t3d4,NA,21642419,6399237,NA,complete,NA,62714063e9db12e15cec4361,computer,Desktop or Laptop,Windows 10,Chrome 100.0.4896.127,1280x720,1280x577,NA,ITT Ratings,4,Remain,2,ACCEPT,NA,NA,NA,NA,NA,NA,NA,NA,NA,batch2_leavers,batch2_leavers,52,15,1,Screen 1,continueButton,response_rating_scale_likert_active,14130,NA,NA,Neither Agree nor Disagree,1,0,1,0,NA,NA,NA,NA,1,statements,Because I like the EU,1,4/4/22,4/4/22,R_3KwoKE9FW0C2EVe,YES,Leave (For Brexit),Somewhat doubtful,Somewhat Agree,NA,Strongly Disagree,Strongly Disagree,Strongly Disagree,NA,NA,NA,Strongly Disagree,Strongly Disagree,Strongly Disagree,NA,NA,NA,Never,Never,30,Female,NA,"Undergraduate degree (BSc, BA)",NA,19,1,Leave,Remain
18,1651589338200,03/05/2022 14:48:58,1651589338700,1,03/05/2022 15:48:58,85800,7,task-t3d4,NA,21642419,6399237,NA,complete,NA,62714063e9db12e15cec4361,computer,Desktop or Laptop,Windows 10,Chrome 100.0.4896.127,1280x720,1280x577,NA,ITT Ratings,4,Remain,2,ACCEPT,NA,NA,NA,NA,NA,NA,NA,NA,NA,batch2_leavers,batch2_leavers,12,16,1,Screen 1,continueButton,response_rating_scale_likert_active,15179.69999998808,NA,NA,Strongly Agree,1,0,1,0,NA,NA,NA,NA,1,statements,"To be able to keep the many EU citizens that are working in the UK, especially in the NHS",1,4/4/22,4/4/22,R_2fx4jZCqukB0nan,YES,Leave (For Brexit),Very Doubtful,Agree,NA,Strongly Disagree,Strongly Disagree,Strongly Disagree,NA,NA,NA,Disagree,Disagree,Disagree,NA,NA,NA,Rarely,Rarely,56,Female,NA,A levels,I voted leave because I believed the rubbish spouted by Johnson on saving money and redirecting it to the NHS.  I soon learnt that this was not true and wish I had voted remain but was relieved that my borough did come back with a remain win.,12,3,Leave,Remain
19,1651589339904,03/05/2022 14:48:59,1651589340411,1,03/05/2022 15:49:00,85800,7,task-t3d4,NA,21642419,6399237,NA,complete,NA,62714063e9db12e15cec4361,computer,Desktop or Laptop,Windows 10,Chrome 100.0.4896.127,1280x720,1280x577,NA,ITT Ratings,4,Remain,2,ACCEPT,NA,NA,NA,NA,NA,NA,NA,NA,NA,batch2_leavers,batch2_leavers,18,17,1,Screen 1,continueButton,response_rating_scale_likert_active,1700.199999988079,NA,NA,Strongly Agree,1,0,1,0,NA,NA,NA,NA,1,statements,help from eu countries,1,4/4/22,4/4/22,R_3hrt3qakK6SasVx,YES,Leave (For Brexit),Undecided,Neither Agree nor Disagree,NA,Disagree,Disagree,Disagree,NA,NA,NA,Disagree,Strongly Disagree,Strongly Disagree,NA,NA,NA,Never,Never,58,Female,NA,GCSEs,NA,13,3,Leave,Remain
20,1651589344230,03/05/2022 14:49:04,1651589344683,1,03/05/2022 15:49:04,85800,7,task-t3d4,NA,21642419,6399237,NA,complete,NA,62714063e9db12e15cec4361,computer,Desktop or Laptop,Windows 10,Chrome 100.0.4896.127,1280x720,1280x577,NA,ITT Ratings,4,Remain,2,ACCEPT,NA,NA,NA,NA,NA,NA,NA,NA,NA,batch2_leavers,batch2_leavers,43,18,1,Screen 1,continueButton,response_rating_scale_likert_active,4253.300000011921,NA,NA,Strongly Disagree,1,0,1,0,NA,NA,NA,NA,1,statements,"immigration, more control over who comes in and out",1,4/4/22,4/4/22,R_2U5TinR5nYU5ezP,YES,Leave (For Brexit),Doubtful,Neither Agree nor Disagree,NA,Neither Agree nor Disagree,Neither Agree nor Disagree,Neither Agree nor Disagree,NA,NA,NA,Neither Agree nor Disagree,Neither Agree nor Disagree,Neither Agree nor Disagree,NA,NA,NA,Rarely,Rarely,35,Male,NA,GCSEs,"I regret voting leave, we were all misled",17,1,Leave,Leave
21,1651589347001,03/05/2022 14:49:07,1651589347065,1,03/05/2022 15:49:07,85800,7,task-t3d4,NA,21642419,6399237,NA,complete,NA,62714063e9db12e15cec4361,computer,Desktop or Laptop,Windows 10,Chrome 100.0.4896.127,1280x720,1280x577,NA,ITT Ratings,4,Remain,2,ACCEPT,NA,NA,NA,NA,NA,NA,NA,NA,NA,batch2_leavers,batch2_leavers,40,19,1,Screen 1,continueButton,response_rating_scale_likert_active,2362,NA,NA,Strongly Agree,1,0,1,0,NA,NA,NA,NA,1,statements,"inclusivity, opportunities for everyone",1,4/4/22,4/4/22,R_2U5TinR5nYU5ezP,YES,Leave (For Brexit),Doubtful,Neither Agree nor Disagree,NA,Neither Agree nor Disagree,Neither Agree nor Disagree,Neither Agree nor Disagree,NA,NA,NA,Neither Agree nor Disagree,Neither Agree nor Disagree,Neither Agree nor Disagree,NA,NA,NA,Rarely,Rarely,35,Male,NA,GCSEs,"I regret voting leave, we were all misled",17,1,Leave,Remain
22,1651589348063,03/05/2022 14:49:08,1651589348567,1,03/05/2022 15:49:08,85800,7,task-t3d4,NA,21642419,6399237,NA,complete,NA,62714063e9db12e15cec4361,computer,Desktop or Laptop,Windows 10,Chrome 100.0.4896.127,1280x720,1280x577,NA,ITT Ratings,4,Remain,2,ACCEPT,NA,NA,NA,NA,NA,NA,NA,NA,NA,batch2_leavers,batch2_leavers,17,20,1,Screen 1,continueButton,response_rating_scale_likert_active,1489.199999988079,NA,NA,Strongly Disagree,1,0,1,0,NA,NA,NA,NA,1,statements,tighter regulations on goods,1,4/4/22,4/4/22,R_3hrt3qakK6SasVx,YES,Leave (For Brexit),Undecided,Neither Agree nor Disagree,NA,Disagree,Disagree,Disagree,NA,NA,NA,Disagree,Strongly Disagree,Strongly Disagree,NA,NA,NA,Never,Never,58,Female,NA,GCSEs,NA,13,2,Leave,Remain
23,1651589352282,03/05/2022 14:49:12,1651589352786,1,03/05/2022 15:49:12,85800,7,task-t3d4,NA,21642419,6399237,NA,complete,NA,62714063e9db12e15cec4361,computer,Desktop or Laptop,Windows 10,Chrome 100.0.4896.127,1280x720,1280x577,NA,ITT Ratings,4,Remain,2,ACCEPT,NA,NA,NA,NA,NA,NA,NA,NA,NA,batch2_leavers,batch2_leavers,61,21,1,Screen 1,continueButton,response_rating_scale_likert_active,4203.700000047684,NA,NA,Strongly Disagree,1,0,1,0,NA,NA,NA,NA,1,statements,Control of borders - letting people in and out that we validate,1,4/4/22,4/4/22,R_1plK5bEvI0ZVhcf,YES,Leave (For Brexit),Very confident,Agree,NA,Neither Agree nor Disagree,Somewhat Agree,Somewhat Disagree,NA,NA,NA,Neither Agree nor Disagree,Somewhat Disagree,Somewhat Disagree,NA,NA,NA,Once or twice a year,Rarely,65,Male,NA,"Undergraduate degree (BSc, BA)",BREXIT is an old topic!  Hard to give an opinion on someone who might have different (wrong!) views..,20,1,Leave,Leave
24,1651589353696,03/05/2022 14:49:13,1651589354205,1,03/05/2022 15:49:14,85800,7,task-t3d4,NA,21642419,6399237,NA,complete,NA,62714063e9db12e15cec4361,computer,Desktop or Laptop,Windows 10,Chrome 100.0.4896.127,1280x720,1280x577,NA,ITT Ratings,4,Remain,2,ACCEPT,NA,NA,NA,NA,NA,NA,NA,NA,NA,batch2_leavers,batch2_leavers,21,22,1,Screen 1,continueButton,response_rating_scale_likert_active,1406.899999976158,NA,NA,Strongly Disagree,1,0,1,0,NA,NA,NA,NA,1,statements,less fishing rights in our waters,1,4/4/22,4/4/22,R_3hrt3qakK6SasVx,YES,Leave (For Brexit),Undecided,Neither Agree nor Disagree,NA,Disagree,Disagree,Disagree,NA,NA,NA,Disagree,Strongly Disagree,Strongly Disagree,NA,NA,NA,Never,Never,58,Female,NA,GCSEs,NA,13,3,Leave,Leave
25,1651589354743,03/05/2022 14:49:14,1651589355229,1,03/05/2022 15:49:15,85800,7,task-t3d4,NA,21642419,6399237,NA,complete,NA,62714063e9db12e15cec4361,computer,Desktop or Laptop,Windows 10,Chrome 100.0.4896.127,1280x720,1280x577,NA,ITT Ratings,4,Remain,2,ACCEPT,NA,NA,NA,NA,NA,NA,NA,NA,NA,batch2_leavers,batch2_leavers,24,23,1,Screen 1,continueButton,response_rating_scale_likert_active,1003.399999976158,NA,NA,Strongly Disagree,1,0,1,0,NA,NA,NA,NA,1,statements,stronger leadership for Britain,1,4/4/22,4/4/22,R_1kGN7ezgQunI10B,YES,Leave (For Brexit),Somewhat Confident,Somewhat Disagree,NA,Strongly Disagree,Strongly Disagree,Strongly Disagree,NA,NA,NA,Strongly Disagree,Strongly Disagree,Strongly Disagree,NA,NA,NA,Rarely,Most months,64,Male,NA,GCSEs,NA,14,3,Leave,Remain
26,1651589356259,03/05/2022 14:49:16,1651589356763,1,03/05/2022 15:49:16,85800,7,task-t3d4,NA,21642419,6399237,NA,complete,NA,62714063e9db12e15cec4361,computer,Desktop or Laptop,Windows 10,Chrome 100.0.4896.127,1280x720,1280x577,NA,ITT Ratings,4,Remain,2,ACCEPT,NA,NA,NA,NA,NA,NA,NA,NA,NA,batch2_leavers,batch2_leavers,54,24,1,Screen 1,continueButton,response_rating_scale_likert_active,1514.800000011921,NA,NA,Strongly Disagree,1,0,1,0,NA,NA,NA,NA,1,statements,Because their family members did,1,4/4/22,4/4/22,R_3KwoKE9FW0C2EVe,YES,Leave (For Brexit),Somewhat doubtful,Somewhat Agree,NA,Strongly Disagree,Strongly Disagree,Strongly Disagree,NA,NA,NA,Strongly Disagree,Strongly Disagree,Strongly Disagree,NA,NA,NA,Never,Never,30,Female,NA,"Undergraduate degree (BSc, BA)",NA,19,3,Leave,Remain
27,1651589359561,03/05/2022 14:49:19,1651589360073,1,03/05/2022 15:49:20,85800,7,task-t3d4,NA,21642419,6399237,NA,complete,NA,62714063e9db12e15cec4361,computer,Desktop or Laptop,Windows 10,Chrome 100.0.4896.127,1280x720,1280x577,NA,ITT Ratings,4,Remain,2,ACCEPT,NA,NA,NA,NA,NA,NA,NA,NA,NA,batch2_leavers,batch2_leavers,4,25,1,Screen 1,continueButton,response_rating_scale_likert_active,3290.099999964237,NA,NA,Strongly Disagree,1,0,1,0,NA,NA,NA,NA,1,statements,Access to tariff free trade,1,4/4/22,4/4/22,R_2uHXR6x7eQTfyVD,YES,Leave (For Brexit),Very confident,Agree,NA,Strongly Disagree,Strongly Disagree,Strongly Disagree,NA,NA,NA,Strongly Disagree,Strongly Disagree,Strongly Disagree,NA,NA,NA,Rarely,Rarely,32,Male,NA,Doctorate (PhD),-,11,1,Leave,Remain
28,1651589365486,03/05/2022 14:49:25,1651589365999,1,03/05/2022 15:49:25,85800,7,task-t3d4,NA,21642419,6399237,NA,complete,NA,62714063e9db12e15cec4361,computer,Desktop or Laptop,Windows 10,Chrome 100.0.4896.127,1280x720,1280x577,NA,ITT Ratings,4,Remain,2,ACCEPT,NA,NA,NA,NA,NA,NA,NA,NA,NA,batch2_leavers,batch2_leavers,29,26,1,Screen 1,continueButton,response_rating_scale_likert_active,5907.600000023842,NA,NA,Strongly Agree,1,0,1,0,NA,NA,NA,NA,1,statements,Working together always achieves better and quicker outcomes than to go it alone,1,4/4/22,4/4/22,R_ThFGcCdnwHRGsZr,YES,Leave (For Brexit),Undecided,Agree,NA,Disagree,Disagree,Disagree,NA,NA,NA,Disagree,Strongly Disagree,Strongly Disagree,NA,NA,NA,Never,Never,41,Male,NA,"Undergraduate degree (BSc, BA)",NA,15,2,Leave,Remain
29,1651589370120,03/05/2022 14:49:30,1651589370621,1,03/05/2022 15:49:30,85800,7,task-t3d4,NA,21642419,6399237,NA,complete,NA,62714063e9db12e15cec4361,computer,Desktop or Laptop,Windows 10,Chrome 100.0.4896.127,1280x720,1280x577,NA,ITT Ratings,4,Remain,2,ACCEPT,NA,NA,NA,NA,NA,NA,NA,NA,NA,batch2_leavers,batch2_leavers,6,27,1,Screen 1,continueButton,response_rating_scale_likert_active,4609.600000023842,NA,NA,Agree,1,0,1,0,NA,NA,NA,NA,1,statements,Freedom of movement helps the economy,1,4/4/22,4/4/22,R_2uHXR6x7eQTfyVD,YES,Leave (For Brexit),Very confident,Agree,NA,Strongly Disagree,Strongly Disagree,Strongly Disagree,NA,NA,NA,Strongly Disagree,Strongly Disagree,Strongly Disagree,NA,NA,NA,Rarely,Rarely,32,Male,NA,Doctorate (PhD),-,11,3,Leave,Remain
30,1651589371484,03/05/2022 14:49:31,1651589371988,1,03/05/2022 15:49:31,85800,7,task-t3d4,NA,21642419,6399237,NA,complete,NA,62714063e9db12e15cec4361,computer,Desktop or Laptop,Windows 10,Chrome 100.0.4896.127,1280x720,1280x577,NA,ITT Ratings,4,Remain,2,ACCEPT,NA,NA,NA,NA,NA,NA,NA,NA,NA,batch2_leavers,batch2_leavers,7,28,1,Screen 1,continueButton,response_rating_scale_likert_active,1343.100000023842,NA,NA,Strongly Disagree,1,0,1,0,NA,NA,NA,NA,1,statements,Reduce immigration to the UK,1,4/4/22,4/4/22,R_2uHXR6x7eQTfyVD,YES,Leave (For Brexit),Very confident,Agree,NA,Strongly Disagree,Strongly Disagree,Strongly Disagree,NA,NA,NA,Strongly Disagree,Strongly Disagree,Strongly Disagree,NA,NA,NA,Rarely,Rarely,32,Male,NA,Doctorate (PhD),-,11,1,Leave,Leave
